comment,cleaned_comment,score1,score2,combined_score
"alex小姐姐讲到的那个男生说我对你是认真的那个故事，我觉得观点真的很难得。我的闺蜜说她找男朋友就是要找对她很好的，但其实是个很奇怪的想法，如果你们是互相喜欢的，那对彼此好难道不是最基础的事情吗？
我觉得我谈恋爱很需要去确认这段感情的排他性，也就是我对另一方来说是因为喜欢我这个人才会跟我在一起，而不是出于觉得需要谈恋爱了，觉得我合适或者聊得来就在一起了。",alex小姐姐讲到的那个男生说我对你是认真的那个故事，我觉得观点真的很难得。我的闺蜜说她找男朋友就是要找对她很好的，但其实是个很奇怪的想法，如果你们是互相喜欢的，那对彼此好难道不是最基础的事情吗？ 我觉得我谈恋爱很需要去确认这段感情的排他性，也就是我对另一方来说是因为喜欢我这个人才会跟我在一起，而不是出于觉得需要谈恋爱了，觉得我合适或者聊得来就在一起了。,0.3594573740249155,1.0,0.8326763521517423
"我发布了一篇笔记，快来看看吧
一、人际关系的构成  人类需要和他人接触，想与他人建立亲密关系的强烈内驱力，是人类一种本性，和伴侣长久愉快地交往能满足人的“归属需要”，才能保持正常生活、...
https://www.bilibili.com/h5/note-app/view?cvid=16065999&amp;pagefrom=comment",我发布了一篇笔记，快来看看吧 一、人际关系的构成 人类需要和他人接触，想与他人建立亲密关系的强烈内驱力，是人类一种本性，和伴侣长久愉快地交往能满足人的“归属需要”，才能保持正常生活、...,0.3594573740249155,0.33622659986374615,0.37350471775529204
我希望大家明白一点，你买房买车出彩礼结婚是为了交配对吧？但其实合理合法的交配根本不需要这些，十分之一甚至百分之一都不用,我希望大家明白一点，你买房买车出彩礼结婚是为了交配对吧？但其实合理合法的交配根本不需要这些，十分之一甚至百分之一都不用,0.3594573740249155,1.0,0.584650074987417
彩礼需要和嫁妆对等[吃瓜],彩礼需要和嫁妆对等,0.3594573740249155,1.0,0.563133920258339
我只能说不用生孩子，家务对半分，我就不需要你任何彩礼、买房，租房还能跟你a一般房租,我只能说不用生孩子，家务对半分，我就不需要你任何彩礼、买房，租房还能跟你a一般房租,0.3594573740249155,1.0,0.5443665533686554
中国的婚姻是有爱情的，本人男，自由恋爱结婚，为什么很多人觉得中国婚姻是没爱情的呢？因为他只适合恋爱，不适合结婚，因为婚姻不但需要爱情，更需要物质基础，很多人不适合结婚，不是因为你没有爱情，而是因为你没有结婚所需要的物质，既然只说爱情不说物质，就不要谈婚姻，直接谈恋爱，这样女方家父母也不会难为你，爱情不是婚姻，如果非要在爱情和物质基础里面选择，我认为女方以及女方家优先选择物质条件，并没有错，这年头大家都不是傻子，不用在这自欺欺人[吃瓜],中国的婚姻是有爱情的，本人男，自由恋爱结婚，为什么很多人觉得中国婚姻是没爱情的呢？因为他只适合恋爱，不适合结婚，因为婚姻不但需要爱情，更需要物质基础，很多人不适合结婚，不是因为你没有爱情，而是因为你没有结婚所需要的物质，既然只说爱情不说物质，就不要谈婚姻，直接谈恋爱，这样女方家父母也不会难为你，爱情不是婚姻，如果非要在爱情和物质基础里面选择，我认为女方以及女方家优先选择物质条件，并没有错，这年头大家都不是傻子，不用在这自欺欺人,0.3594573740249155,1.0,0.8439364046738436
结婚需要冷静期，离婚不需要。,结婚需要冷静期，离婚不需要。,0.3594573740249155,1.0,0.6020588500336078
以前一个男的挣钱可以养全家，女的带娃生活也过得去，现在男女都需要挣钱才能勉强养家，那男女都需要带娃干家务才公平，在我看来现在根本不适合结婚生娃，因为时间，金钱，人员都不具备,以前一个男的挣钱可以养全家，女的带娃生活也过得去，现在男女都需要挣钱才能勉强养家，那男女都需要带娃干家务才公平，在我看来现在根本不适合结婚生娃，因为时间，金钱，人员都不具备,0.3594573740249155,1.0,0.8029610023209434
人需要爱，但不一定要恋爱；人可以恋爱，但不一定要结婚；人可以结婚，但不一定要生孩子。[doge],人需要爱，但不一定要恋爱；人可以恋爱，但不一定要结婚；人可以结婚，但不一定要生孩子。,0.3594573740249155,1.0,0.5949589007264877
[tv_坏笑]和莲莲谈恋爱需要注意什么,和莲莲谈恋爱需要注意什么,0.3594573740249155,1.0,0.6864461619036517
这期视频真的很不错，很开眼界……能让人知道跨国恋浪漫一面背后更多的东西……不只是浪漫、快乐的东西……或许会有人说这些东西会看着很累或者很难懂……但知识的获取都是需要代价的……而这就是某一方面的知识……而且在我看来这其中的一些问题就算不是跨国恋也是需要考虑的……,这期视频真的很不错，很开眼界……能让人知道跨国恋浪漫一面背后更多的东西……不只是浪漫、快乐的东西……或许会有人说这些东西会看着很累或者很难懂……但知识的获取都是需要代价的……而这就是某一方面的知识……而且在我看来这其中的一些问题就算不是跨国恋也是需要考虑的……,0.3594573740249155,1.0,0.757859634300847
婚姻就需要这样坦诚的交流和反思，喜欢你们两口子[惊喜],婚姻就需要这样坦诚的交流和反思，喜欢你们两口子,0.3594573740249155,1.0,0.5887555795199526
如果结婚后，一方管另一方的💰，但管钱的可以随便花，给钱的需要询问，这时实际上就不是共同财产了。,如果结婚后，一方管另一方的💰，但管钱的可以随便花，给钱的需要询问，这时实际上就不是共同财产了。,0.3594573740249155,1.0,0.5551282938523942
"很多人把“杏”想得太简单而又把“爱”想得过于神圣，实际上一段高质量的“杏”困难程度和需要的能力，完全不亚于谈一段高质量的恋爱。
既需要双方极高的默契，又需要每一方个人的技巧和实力，乃至于对语言、情绪、思维和想象力的综合应用。很考验双方的智商和情商和“杏”商。
而东亚范围内整个“杏”方面的大环境，都是比较“鸭抑”，加上杏教育的集体缺失，大部分人对这方面的认知和了解都非常不足，导致很多成年人在这方面都得不到满足…
至于鸭抑的原因，以及谁在造成鸭抑，乃至于如何才能拥有一段高质量的恋爱和“杏”。我主页和视频有提到过，但看来某些人不希望别人知道（起码是不希望普通人知道…）",很多人把“杏”想得太简单而又把“爱”想得过于神圣，实际上一段高质量的“杏”困难程度和需要的能力，完全不亚于谈一段高质量的恋爱。 既需要双方极高的默契，又需要每一方个人的技巧和实力，乃至于对语言、情绪、思维和想象力的综合应用。很考验双方的智商和情商和“杏”商。 而东亚范围内整个“杏”方面的大环境，都是比较“鸭抑”，加上杏教育的集体缺失，大部分人对这方面的认知和了解都非常不足，导致很多成年人在这方面都得不到满足… 至于鸭抑的原因，以及谁在造成鸭抑，乃至于如何才能拥有一段高质量的恋爱和“杏”。我主页和视频有提到过，但看来某些人不希望别人知道（起码是不希望普通人知道…）,0.3594573740249155,1.0,0.9483089739889823
我写小说的时候都要替俩纸片人考虑这些，有些人居然认为两个人结婚不需要考虑？太荒唐了[藏狐],我写小说的时候都要替俩纸片人考虑这些，有些人居然认为两个人结婚不需要考虑？太荒唐了,0.0,0.33622659986374615,0.3855705954198684
其实我最近感觉我确实需要另一半的陪伴了，但是最近的相亲让我恶心了[笑哭][笑哭],其实我最近感觉我确实需要另一半的陪伴了，但是最近的相亲让我恶心了,0.3594573740249155,1.0,0.6485693160741137
"我的首页在骂完我绿茶、渣女、冷暴力、回避型依恋、失恋、星辰大海再无你，又到了我们为什么需要婚姻、你真的想老年孤独一人吗？
我是不是需要婚姻不知道，但b站首页像个哼哼唧唧的男朋友无疑[吃瓜][无语]",我的首页在骂完我绿茶、渣女、冷暴力、回避型依恋、失恋、星辰大海再无你，又到了我们为什么需要婚姻、你真的想老年孤独一人吗？ 我是不是需要婚姻不知道，但b站首页像个哼哼唧唧的男朋友无疑,0.3594573740249155,1.0,0.6316142465403
"我跟父母之间，在我还需要伸手问父母要钱的时候，我就必须得听父母的 。
     我结婚的时候。如果我还伸手问对方要钱，那么我也是对对方奴役的。
    哪怕是我的孩子，只要他申请问我要钱，那么，他必须得听我的。
     合作就是双方达成一致。没有利益冲突。哪怕是有如意关系，也是心甘情愿的。因为对方身上有自己想要的东西。
     不过，如果不想要任何的奴役关系，必须得让自己强大到不需要讨好任何人，不需要伸手问任何人要东西，才行。",我跟父母之间，在我还需要伸手问父母要钱的时候，我就必须得听父母的 。 我结婚的时候。如果我还伸手问对方要钱，那么我也是对对方奴役的。 哪怕是我的孩子，只要他申请问我要钱，那么，他必须得听我的。 合作就是双方达成一致。没有利益冲突。哪怕是有如意关系，也是心甘情愿的。因为对方身上有自己想要的东西。 不过，如果不想要任何的奴役关系，必须得让自己强大到不需要讨好任何人，不需要伸手问任何人要东西，才行。,0.3594573740249155,0.4320558161628193,0.42620593459109224
