comment,cleaned_comment,score1,score2,combined_score
你妈妈要么是太单纯，要么可能内心深处也是认同重男轻女的，因为她居然觉得你能占便宜[笑哭]多个姐姐家庭的男孩从小会受到过度的关爱，认为家人对他的付出是理所当然的，在其认知中获得家庭偏爱不需要等量付出只需要“我是个男的”，这样就导致生活中对伴侣的付出理所当然，对自己的付出时若瑰宝，作为伴侣除非深谙娘道，否则[doge],你妈妈要么是太单纯，要么可能内心深处也是认同重男轻女的，因为她居然觉得你能占便宜多个姐姐家庭的男孩从小会受到过度的关爱，认为家人对他的付出是理所当然的，在其认知中获得家庭偏爱不需要等量付出只需要“我是个男的”，这样就导致生活中对伴侣的付出理所当然，对自己的付出时若瑰宝，作为伴侣除非深谙娘道，否则,0.0,0.33622659986374615,0.4428738365736792
"能够等了八年，是很喜欢，很喜欢的存在了吧。我妈妈说，如果一个人，激情式地喜欢了你几个月，你需要好好考虑一下ta只是把你当成只是一个不错的达成恋爱的“工具人”………现在自己上大学，看着身边的人，因为觉得应该而谈恋爱，因为觉得孤单而谈恋爱，分分合合的，总会给我几分爱情看起来很容易的错觉。
其实遇见爱情并不是一件易事，首先你得是一个不庸俗的，独立的人，你平等地尊重对方，不把对方当成工具人。你和ta有这一样的信仰，一样的热枕，一样的三观，认真的生活，我知你外表普通，但是我会注意到你凡事为别人考虑的体贴，我注意到你身上太多的闪光点，以至于让我不想在看到其他人………
在网上看到一些话，总有人会爱你的，哪怕你贪婪，懒惰，任性…………但是真是真的吗？我自问不会爱上一个太负面的人。个人需要优秀，感情之中需要付出才能等到一段爱情。
所以这个视频真令人感动，我自问做不到喜欢一个人8年，最多5年就要说服自己需要忘记了……",能够等了八年，是很喜欢，很喜欢的存在了吧。我妈妈说，如果一个人，激情式地喜欢了你几个月，你需要好好考虑一下ta只是把你当成只是一个不错的达成恋爱的“工具人”………现在自己上大学，看着身边的人，因为觉得应该而谈恋爱，因为觉得孤单而谈恋爱，分分合合的，总会给我几分爱情看起来很容易的错觉。 其实遇见爱情并不是一件易事，首先你得是一个不庸俗的，独立的人，你平等地尊重对方，不把对方当成工具人。你和ta有这一样的信仰，一样的热枕，一样的三观，认真的生活，我知你外表普通，但是我会注意到你凡事为别人考虑的体贴，我注意到你身上太多的闪光点，以至于让我不想在看到其他人……… 在网上看到一些话，总有人会爱你的，哪怕你贪婪，懒惰，任性…………但是真是真的吗？我自问不会爱上一个太负面的人。个人需要优秀，感情之中需要付出才能等到一段爱情。 所以这个视频真令人感动，我自问做不到喜欢一个人年，最多年就要说服自己需要忘记了……,0.3594573740249155,1.0,0.8723774317492965
曾教授，您的这个婚姻观，我不敢苟同，如果婚姻需要所有人同意，那婚姻已经不单纯了，目的性太强，而且婚后会带来很多矛盾，如果婚姻把家族因素最大化，就容易产生扶弟魔，樊胜美，妈宝男，这才是如今社会离婚率高的根本原因，婚姻应该是两个相爱的人在一起组建一个新家庭，分离原生家庭…婚姻才会幸福。,曾教授，您的这个婚姻观，我不敢苟同，如果婚姻需要所有人同意，那婚姻已经不单纯了，目的性太强，而且婚后会带来很多矛盾，如果婚姻把家族因素最大化，就容易产生扶弟魔，樊胜美，妈宝男，这才是如今社会离婚率高的根本原因，婚姻应该是两个相爱的人在一起组建一个新家庭，分离原生家庭…婚姻才会幸福。,0.3594573740249155,1.0,0.6438246555889018
对女性来说，生完孩子和夫家抗衡，真的需要大智慧。很多人说要经济对等，才能谈判。但是一位生养中的母亲，要和丈夫经济对等，这是很大的不平等。,对女性来说，生完孩子和夫家抗衡，真的需要大智慧。很多人说要经济对等，才能谈判。但是一位生养中的母亲，要和丈夫经济对等，这是很大的不平等。,0.3594573740249155,1.0,0.7534504049617188
确实，自己的需求只有自己明白，只要两个人舒服 就没必要管别人怎么看，自己的亲密关系不需要给任何人交代。,确实，自己的需求只有自己明白，只要两个人舒服 就没必要管别人怎么看，自己的亲密关系不需要给任何人交代。,0.3594573740249155,1.0,0.6543505305772478
婚姻的幸福是需要你自己去经营的，不是坐等幸福找上门，现在的人都想找一个现成的，不想付出[吃瓜],婚姻的幸福是需要你自己去经营的，不是坐等幸福找上门，现在的人都想找一个现成的，不想付出,0.3594573740249155,1.0,0.6021669003813195
爱需要交流，如果不说你就会死的很惨！我前女友就是整死不说想法，那就算了呗。如果能心连心，那还需要语言干什么呢？不怕说出来，就怕不说！那种想找一个眼神一个动作就能懂我的人，就继续扯蛋吧，又不是肚子里蛔虫，哪有那么多秒懂的！,爱需要交流，如果不说你就会死的很惨！我前女友就是整死不说想法，那就算了呗。如果能心连心，那还需要语言干什么呢？不怕说出来，就怕不说！那种想找一个眼神一个动作就能懂我的人，就继续扯蛋吧，又不是肚子里蛔虫，哪有那么多秒懂的！,0.3594573740249155,1.0,0.7312243022907022
谈恋爱是需要练习的,谈恋爱是需要练习的,0.3594573740249155,1.0,0.6359641887385015
需要修复婚姻，能帮助一下吗？凯哥,需要修复婚姻，能帮助一下吗？凯哥,0.3594573740249155,1.0,0.5729408278765373
在一起7年半还是感觉自己热恋期的我，我觉得并不需要那么多弯弯绕绕，最重要的还是筛选，人对就对，人不对就不行 不需要吊着也不需要假装,在一起年半还是感觉自己热恋期的我，我觉得并不需要那么多弯弯绕绕，最重要的还是筛选，人对就对，人不对就不行 不需要吊着也不需要假装,0.3594573740249155,1.0,0.7213810098890282
"就像现在很多人说的一样，需要相互理解体谅扶持，有福同享，当然要有难同当。以前可能因为经济等原因很多家庭就算再不好也不会分，比较极端，但是现在生活好起来了所以离婚率会多些。
只是现在有很多家庭却又走向相反的极端，有不愿意有福同享有难同当的，有一点矛盾就离的，有出柜的…
怎么说呢…更像是道德底线下滑引起的…",就像现在很多人说的一样，需要相互理解体谅扶持，有福同享，当然要有难同当。以前可能因为经济等原因很多家庭就算再不好也不会分，比较极端，但是现在生活好起来了所以离婚率会多些。 只是现在有很多家庭却又走向相反的极端，有不愿意有福同享有难同当的，有一点矛盾就离的，有出柜的… 怎么说呢…更像是道德底线下滑引起的…,0.3594573740249155,1.0,0.7681428570869886
"学业完成前 你需要斩断情丝。
学业完成后 你需要儿孙满堂。
这就是属于华夏独特的浪漫。",学业完成前 你需要斩断情丝。 学业完成后 你需要儿孙满堂。 这就是属于华夏独特的浪漫。,0.3594573740249155,1.0,0.6045304973310631
那就离婚啊，不离婚在这儿搞婚外恋，算啥？她和我以前一样，缺爱，到处抓取，没主体性。她需要自我疗愈，而不是劈腿！,那就离婚啊，不离婚在这儿搞婚外恋，算啥？她和我以前一样，缺爱，到处抓取，没主体性。她需要自我疗愈，而不是劈腿！,0.3594573740249155,1.0,0.6618791891654705
本双鱼女需要先认同自己之后再考虑谈恋爱，和视频里的一样，没有十足把握不会想到在一起这个阶段，不存在试一试。,本双鱼女需要先认同自己之后再考虑谈恋爱，和视频里的一样，没有十足把握不会想到在一起这个阶段，不存在试一试。,0.3594573740249155,1.0,0.7229399162827574
我觉得恋爱不同居特棒，人都是独立的个体在一段关系中还是需要独立空间的，就是md北京租开间太贵了,我觉得恋爱不同居特棒，人都是独立的个体在一段关系中还是需要独立空间的，就是md北京租开间太贵了,0.3594573740249155,1.0,0.6576598382659121
异地恋，已分。小姐姐说的每一个小故事都让我感到两人的甜蜜，但我觉得异地恋需要在足够的感情基础和彼此都有很强的执念才能最终走到一起，事实证明，单方面用力是不行的。,异地恋，已分。小姐姐说的每一个小故事都让我感到两人的甜蜜，但我觉得异地恋需要在足够的感情基础和彼此都有很强的执念才能最终走到一起，事实证明，单方面用力是不行的。,0.3594573740249155,1.0,0.7284124329690737
"【from ChatGPT】要谈好一段异地恋，需要注意以下几点：
1.确定日标和计划：两个人应该共同商定异地恋的目标和计划，如何维持感情、何时相见、何时结束异地恋等。这有助于双方明确彼此的期望，减少不必要的误解和猜测。
2．保持沟通：在异地恋中，保持良好的沟通非常重要。双方应该在合适的时间内保持联系，并旦需要充分理解对方的时间和空间，不要过度干扰对方的生活。可以使用各种通讯工具，如短信、电话、视频聊天等。
3.建立信任：建立信任是异地恋的基石。双方需要在日常交流中逐渐建立起对彼此的信任，分享个人信息、情感和生活中的一些小事情。
4. 保持独立：在异地恋中，双方需要保持自己的独立和生活重心。可以尝试做些自己喜欢的事情，保持白己的兴趣爱好和社交生活。
5. 珍惜相处的时间：如果有机会见面，一定要好好珍惜相处的时间。可以选择去旅游、参加活动或是单纯的约会，让彼此更加了解和了解对方的生活。
最后，要谈好一段异地恋，需要双方真心相爱，并愿意为此付出努力和时间。只有双方互相理解和支持，才能使感情更加稳固，度过异地恋的困难时期。",【from ChatGPT】要谈好一段异地恋，需要注意以下几点： .确定日标和计划：两个人应该共同商定异地恋的目标和计划，如何维持感情、何时相见、何时结束异地恋等。这有助于双方明确彼此的期望，减少不必要的误解和猜测。 ．保持沟通：在异地恋中，保持良好的沟通非常重要。双方应该在合适的时间内保持联系，并旦需要充分理解对方的时间和空间，不要过度干扰对方的生活。可以使用各种通讯工具，如短信、电话、视频聊天等。 .建立信任：建立信任是异地恋的基石。双方需要在日常交流中逐渐建立起对彼此的信任，分享个人信息、情感和生活中的一些小事情。 . 保持独立：在异地恋中，双方需要保持自己的独立和生活重心。可以尝试做些自己喜欢的事情，保持白己的兴趣爱好和社交生活。 . 珍惜相处的时间：如果有机会见面，一定要好好珍惜相处的时间。可以选择去旅游、参加活动或是单纯的约会，让彼此更加了解和了解对方的生活。 最后，要谈好一段异地恋，需要双方真心相爱，并愿意为此付出努力和时间。只有双方互相理解和支持，才能使感情更加稳固，度过异地恋的困难时期。,1.0,1.0,0.9165394134471485
谈异地，最害怕的事情就是，在我最需要你的时候，你却沉默，不说[doge],谈异地，最害怕的事情就是，在我最需要你的时候，你却沉默，不说,0.3594573740249155,1.0,0.557663205309509
人是很难爱上另一个人的，爱上另一个人需要天时地利人和。但很容易爱上自己的欲念即某些概念。所以，在结束的时候保持感恩就好，感谢别人陪你短暂地实现了你的欲念。,人是很难爱上另一个人的，爱上另一个人需要天时地利人和。但很容易爱上自己的欲念即某些概念。所以，在结束的时候保持感恩就好，感谢别人陪你短暂地实现了你的欲念。,0.3594573740249155,1.0,0.7656050433580706
爱情是一种错觉。以为爱的是这个人，其实爱的是这个阶段的需要。,爱情是一种错觉。以为爱的是这个人，其实爱的是这个阶段的需要。,0.3594573740249155,1.0,0.6591081941178889
"不要想着爱，占有，追求
要想尊重，理解，责任，后者才是人真正需要的",不要想着爱，占有，追求 要想尊重，理解，责任，后者才是人真正需要的,0.3594573740249155,1.0,0.7400082927358009
非常赞同！爱情和婚姻是两件事情，婚姻需要付出更多精力来经营，而不是坐享其成。,非常赞同！爱情和婚姻是两件事情，婚姻需要付出更多精力来经营，而不是坐享其成。,0.3594573740249155,1.0,0.7332931806335667
信任重建不是不可以，但需要俩人一起努力很久，但凡一个人放弃就重建失败了,信任重建不是不可以，但需要俩人一起努力很久，但凡一个人放弃就重建失败了,0.3594573740249155,1.0,0.6037124620468125
昨天我还在和闺蜜说，我可能永远都没办法去信任谁了。好幸运，今天就听见了我非常需要的东西，让我又有了力量[爱心],昨天我还在和闺蜜说，我可能永远都没办法去信任谁了。好幸运，今天就听见了我非常需要的东西，让我又有了力量,0.40159477065724175,0.4632039205553255,0.37935838143070155
其实人人想结婚都签出轨净身出户协议并需要赔偿大额赔款，就能减少大部分问题，甚至他们还会互相搞计谋互相防御，自发提防接近的异性，可惜这办法不可能实现[拥抱],其实人人想结婚都签出轨净身出户协议并需要赔偿大额赔款，就能减少大部分问题，甚至他们还会互相搞计谋互相防御，自发提防接近的异性，可惜这办法不可能实现,0.3594573740249155,1.0,0.6327260956487524
本视频讲述了年轻女性在建立关系前需要先完善自己的身心和技能，多读书、参与社会工作、接受社会的教训和考验，而不是盲目地学习套路和接触异性。早期的寻觅关系可能会遇到下沉市场的男性，因此需要沉下心来打磨自己的技能和赚钱。--以上内容由模型基于视频内容生成，仅供参考,本视频讲述了年轻女性在建立关系前需要先完善自己的身心和技能，多读书、参与社会工作、接受社会的教训和考验，而不是盲目地学习套路和接触异性。早期的寻觅关系可能会遇到下沉市场的男性，因此需要沉下心来打磨自己的技能和赚钱。--以上内容由模型基于视频内容生成，仅供参考,0.0,0.33622659986374615,0.4365773710532731
我甚至能接受相敬如宾的伴侣关系，各自有各自独立的精神空间，只要双方忠诚，能相互尊重，爱不爱的是啥样的爱不重要。要不是因为人有一定的爱与归属的需要，有些时候需要陪伴，我会选择一直单身,我甚至能接受相敬如宾的伴侣关系，各自有各自独立的精神空间，只要双方忠诚，能相互尊重，爱不爱的是啥样的爱不重要。要不是因为人有一定的爱与归属的需要，有些时候需要陪伴，我会选择一直单身,0.3594573740249155,1.0,0.81470720557393
不管动心不动心，我都不想谈。爱情是奢侈品，我不需要奢侈品。,不管动心不动心，我都不想谈。爱情是奢侈品，我不需要奢侈品。,0.0,1.0,0.5914012904643969
终于有人跟我一样发现男的其实需要的不是传宗接代，只是需要性，只有婚姻可以将这件事变得合理合法。如果有一个办法可以解决这个问题（比如diy或者人偶），那婚姻完全就是个枷锁。,终于有人跟我一样发现男的其实需要的不是传宗接代，只是需要性，只有婚姻可以将这件事变得合理合法。如果有一个办法可以解决这个问题（比如diy或者人偶），那婚姻完全就是个枷锁。,0.3594573740249155,1.0,0.793237823435187
真不会有人觉得生物在恶劣环境下停止生育是句玩笑吧，全国大概八成人还处于3k以及3k以下的月薪，别说你月薪几千几万，算税后算支出后你看看你净收入高过一千吗？而这个社会一千一个月净收入还能支持你更多消费吗？说白了现在不是不结婚，而是没办法结婚，另外谈女朋友是需要时间的，而你需要时间换金钱来保障生活，所以我遇到的情况就是一边父母说结婚谈女朋友，而另一方面就告诉你需要挣钱,真不会有人觉得生物在恶劣环境下停止生育是句玩笑吧，全国大概八成人还处于k以及k以下的月薪，别说你月薪几千几万，算税后算支出后你看看你净收入高过一千吗？而这个社会一千一个月净收入还能支持你更多消费吗？说白了现在不是不结婚，而是没办法结婚，另外谈女朋友是需要时间的，而你需要时间换金钱来保障生活，所以我遇到的情况就是一边父母说结婚谈女朋友，而另一方面就告诉你需要挣钱,0.3594573740249155,1.0,0.8398136777914899
"想来和可爸可妈理性探讨一下作为一个“不愿意结婚与生育者”的看法（并非完全的恐惧，二十单纯的觉得没有必要）：
我的原生家庭很好，父母超级恩爱也互相扶持，也没有什么大男子主义什么的问题。但我从很小开始就不想结婚生育，我也不太同意可妈最后把婚姻与爱情等同的观点。我认为结婚是个高消耗且无必要的事情：
1. 高消耗：
（1）需要在婚前婚后花费大量时间精力去与对方家人的相处与应对各种相关问题，这些问题都是完全没有必要的，因为爱情单纯的建立在两个人中间，而结婚是两个家庭的事，我认为很多时候两个人的矛盾都来自于此，对个人的精力、时间、金钱以及两个人的爱情都是一种消耗；
（2）需要准备婚礼、婚纱、结婚种种事宜，都是非常繁琐的；甚至对于新娘来说，为了穿婚纱，还要提前很久开始减肥、美容bulabula，花费完全没必要的时间精力；（如果你梦想着婚礼就当我没说）
（3）如果最终不幸准备分开，按照目前国家的法律修改与判例，离婚可以说阻力重重。如果一方恶意拖着，那么至少需要两年，对双方（特别是女性）都是一种巨大的精神与物力消耗。
2. 无必要：
（1）老人们最关注的生育问题：即便没有结婚证，现在也可以给孩子上户口，这个证没有用；
（2）结婚证不是两个人生活在一起的必要物件，国家不会阻止两个相爱的人在一起，因此无必要
（3）结婚证不是婚姻的保障：如果有个人真的爱你，不需要结婚证他/她依然爱你；如果有个人不爱你讨厌你，就算有结婚证他依然可以选择分居、互相折磨；
（4）有关财产分割，法律对于事实婚姻的财产是有相关规定的，这点不需要靠结婚证保障（比如大件礼物赠送等等，详细请见民法典）

因此，我一直坚定的觉得“结婚”这件事没有必要，与敢不敢担责无关，只是觉得没有必要。爱你的人不会因为不结婚而不爱你；不爱你的人也不会因为一张纸而绑在一起。当然，我很羡慕也十分祝福像可爸可妈这种圆满幸福的婚姻，但就我自己而言，我没有看到这个行为的必要性。因为选择不婚。

不育的话，是我自己目前的想法。可能以后遇到一个很爱的人，也会开始喜欢小孩子吧～

（理性讨论，尊重所有的爱情与所有的观点💙）",想来和可爸可妈理性探讨一下作为一个“不愿意结婚与生育者”的看法（并非完全的恐惧，二十单纯的觉得没有必要）： 我的原生家庭很好，父母超级恩爱也互相扶持，也没有什么大男子主义什么的问题。但我从很小开始就不想结婚生育，我也不太同意可妈最后把婚姻与爱情等同的观点。我认为结婚是个高消耗且无必要的事情： . 高消耗： （）需要在婚前婚后花费大量时间精力去与对方家人的相处与应对各种相关问题，这些问题都是完全没有必要的，因为爱情单纯的建立在两个人中间，而结婚是两个家庭的事，我认为很多时候两个人的矛盾都来自于此，对个人的精力、时间、金钱以及两个人的爱情都是一种消耗； （）需要准备婚礼、婚纱、结婚种种事宜，都是非常繁琐的；甚至对于新娘来说，为了穿婚纱，还要提前很久开始减肥、美容bulabula，花费完全没必要的时间精力；（如果你梦想着婚礼就当我没说） （）如果最终不幸准备分开，按照目前国家的法律修改与判例，离婚可以说阻力重重。如果一方恶意拖着，那么至少需要两年，对双方（特别是女性）都是一种巨大的精神与物力消耗。 . 无必要： （）老人们最关注的生育问题：即便没有结婚证，现在也可以给孩子上户口，这个证没有用； （）结婚证不是两个人生活在一起的必要物件，国家不会阻止两个相爱的人在一起，因此无必要 （）结婚证不是婚姻的保障：如果有个人真的爱你，不需要结婚证他/她依然爱你；如果有个人不爱你讨厌你，就算有结婚证他依然可以选择分居、互相折磨； （）有关财产分割，法律对于事实婚姻的财产是有相关规定的，这点不需要靠结婚证保障（比如大件礼物赠送等等，详细请见民法典） 因此，我一直坚定的觉得“结婚”这件事没有必要，与敢不敢担责无关，只是觉得没有必要。爱你的人不会因为不结婚而不爱你；不爱你的人也不会因为一张纸而绑在一起。当然，我很羡慕也十分祝福像可爸可妈这种圆满幸福的婚姻，但就我自己而言，我没有看到这个行为的必要性。因为选择不婚。 不育的话，是我自己目前的想法。可能以后遇到一个很爱的人，也会开始喜欢小孩子吧～ （理性讨论，尊重所有的爱情与所有的观点💙）,0.3594573740249155,1.0,1.0
我奶奶现在78了，我是大孙子，就指望我给她能体验一下抱重孙子的感受，然后前几年催的时候，我都以家里没钱为理由，老人的要求从抱孩子变成了能让她闭眼前看到带女朋友回去就安心了。然后今年我赚了点钱不太需要去坐班了，前几天催的时候就是某某地方的彩礼便宜，你周边有没有这种同事？我说有啊，就是她又黑又瘦小的，牙口还不好，生了小孩也不像聪明点的，我奶奶说这有啥的，给我整无语了。后面就搪塞说出来旅游是相亲去了，不然看见我旅游就觉得乱花钱了,我奶奶现在了，我是大孙子，就指望我给她能体验一下抱重孙子的感受，然后前几年催的时候，我都以家里没钱为理由，老人的要求从抱孩子变成了能让她闭眼前看到带女朋友回去就安心了。然后今年我赚了点钱不太需要去坐班了，前几天催的时候就是某某地方的彩礼便宜，你周边有没有这种同事？我说有啊，就是她又黑又瘦小的，牙口还不好，生了小孩也不像聪明点的，我奶奶说这有啥的，给我整无语了。后面就搪塞说出来旅游是相亲去了，不然看见我旅游就觉得乱花钱了,0.3594573740249155,1.0,0.7582055667303746
只要你自己认可自己，就没必要改变，因为即使你变得完美，也大概率找不到完美的另一半，亲密关系需要的是适合和运气，再说了人会变。也不要觉得婚姻比恋爱更高阶，所有的关系都差不多，只需要你的聪明和包容。,只要你自己认可自己，就没必要改变，因为即使你变得完美，也大概率找不到完美的另一半，亲密关系需要的是适合和运气，再说了人会变。也不要觉得婚姻比恋爱更高阶，所有的关系都差不多，只需要你的聪明和包容。,0.3594573740249155,1.0,0.6691186085771499
