comment,cleaned_comment,score1,score2,combined_score
跟人相处很难，跟一个人建立亲密关系更难。且不说虚无缥缈的爱情，和一个人签订契约过一生必然需要信任，理解，真诚和尊重，试问现在的小情侣有哪一对能真的做到这四点。,跟人相处很难，跟一个人建立亲密关系更难。且不说虚无缥缈的爱情，和一个人签订契约过一生必然需要信任，理解，真诚和尊重，试问现在的小情侣有哪一对能真的做到这四点。,0.3594573740249155,1.0,0.6255179480023011
人与人的交流就是资源交换啊，楼上那个说这是做生意，这经营友情爱情什么不是需要花费精力的？打着友谊爱情万岁然后就能无底线的付出吗？,人与人的交流就是资源交换啊，楼上那个说这是做生意，这经营友情爱情什么不是需要花费精力的？打着友谊爱情万岁然后就能无底线的付出吗？,0.3594573740249155,0.33622659986374615,0.35286910694553963
爱情里面比较离谱的一个矛盾是当你需要TA的时候你对TA是没有吸引力的，而当你对别人有吸引力的时候你根本不需要另外一个人，因为人的吸引力就来自自我的完善,爱情里面比较离谱的一个矛盾是当你需要TA的时候你对TA是没有吸引力的，而当你对别人有吸引力的时候你根本不需要另外一个人，因为人的吸引力就来自自我的完善,0.3594573740249155,1.0,0.6764795341897687
需要性，但不需要爱情和婚姻。,需要性，但不需要爱情和婚姻。,0.3594573740249155,1.0,0.6359641887385015
与人建立一段亲密关系也是需要学习的啊，有的二十多了还不知道啥是爱呢，然后匆匆忙忙就步入婚姻了，其实到老都没有体会到爱情吧,与人建立一段亲密关系也是需要学习的啊，有的二十多了还不知道啥是爱呢，然后匆匆忙忙就步入婚姻了，其实到老都没有体会到爱情吧,0.3594573740249155,1.0,0.5793076527878204
男的不是长得太抽象，会打理，主动一点基本上都可以谈上，也就这几年谈成本最低也最甜，有需要的是可以的，成不成就看自己本事和运气了,男的不是长得太抽象，会打理，主动一点基本上都可以谈上，也就这几年谈成本最低也最甜，有需要的是可以的，成不成就看自己本事和运气了,0.40159477065724175,1.0,0.6076522573538484
都有这样的舍友了还需要女朋友吗？[doge],都有这样的舍友了还需要女朋友吗？,0.3594573740249155,1.0,0.6921698433747796
这样好像也不需要恋爱了呢,这样好像也不需要恋爱了呢,0.40159477065724175,0.4320558161628193,0.4081977514561893
"他的话语有一个观点还是很赞同的    降低对婚姻的期望
一直觉得   应该把婚姻当成一个开始    而不是一个事情的结束
类似开店开公司    不是开业就万事大吉了    真的需要经营   想要好   还要双方共同经营

但某些人并不这么想    为了结婚而去结婚   或许会更累    降低期望挺好的     就当做第二次人生   从头再活   事事小心   认真对待经营",他的话语有一个观点还是很赞同的 降低对婚姻的期望 一直觉得 应该把婚姻当成一个开始 而不是一个事情的结束 类似开店开公司 不是开业就万事大吉了 真的需要经营 想要好 还要双方共同经营 但某些人并不这么想 为了结婚而去结婚 或许会更累 降低期望挺好的 就当做第二次人生 从头再活 事事小心 认真对待经营,0.3594573740249155,1.0,0.890022205796161
"一、早恋并不是一件可耻的事情，而是人类正常的活动，需要树立正确的恋爱观，包括爱情和性，以及爱情与爱。
00:01 - 早恋不等于道德有问题，恋爱是人类正常活动
00:38 - 树立正确的恋爱观，才能更好地爱自己和他人
02:07 - 性是正常生理现象，但需要正确对待和保护自己
二、在恋爱中需要注意的一些问题，包括保护自己的身体和避免一些疾病的传播，同时也强调了女孩子要懂得自我保护。
03:02 - 人们容易感性，但需要分辨能力来判断言论的真实性和目的
03:37 - 恋爱可能导致怀孕、生命危险和艾滋病等疾病传播
05:51 - HPV病毒可能导致宫颈癌等严重疾病，需要加强保护和教育
三、爱情和性爱之间的区别，以及科普了一些关于艾滋病等方面的知识，提醒女孩子在恋爱中要理性思考，不要被爱情冲昏头脑。
06:02 - 没有了解重要的现实科普，人们容易被爱情冲昏头脑
06:45 - 美丽的事物背后都有缺点，需要承担后果
08:46 - 男孩子对你好可能只是激素分泌，不能只看表面
四、如何判断一个男孩子是否真的爱你，需要看他是否为了你们的前途在努力，而女孩子必须先成为一个独立的人才能找到幸福。
09:00 - 看一个男孩子是否真心爱你，要看他是否为你着想。
09:20 - 一个好的伴侣应该相互促进，一起变得更好。
09:50 - 成为独立自主的人，才能找到相匹配的另一半。
--以上内容由模型基于视频内容生成，仅供参考",一、早恋并不是一件可耻的事情，而是人类正常的活动，需要树立正确的恋爱观，包括爱情和性，以及爱情与爱。 : - 早恋不等于道德有问题，恋爱是人类正常活动 : - 树立正确的恋爱观，才能更好地爱自己和他人 : - 性是正常生理现象，但需要正确对待和保护自己 二、在恋爱中需要注意的一些问题，包括保护自己的身体和避免一些疾病的传播，同时也强调了女孩子要懂得自我保护。 : - 人们容易感性，但需要分辨能力来判断言论的真实性和目的 : - 恋爱可能导致怀孕、生命危险和艾滋病等疾病传播 : - HPV病毒可能导致宫颈癌等严重疾病，需要加强保护和教育 三、爱情和性爱之间的区别，以及科普了一些关于艾滋病等方面的知识，提醒女孩子在恋爱中要理性思考，不要被爱情冲昏头脑。 : - 没有了解重要的现实科普，人们容易被爱情冲昏头脑 : - 美丽的事物背后都有缺点，需要承担后果 : - 男孩子对你好可能只是激素分泌，不能只看表面 四、如何判断一个男孩子是否真的爱你，需要看他是否为了你们的前途在努力，而女孩子必须先成为一个独立的人才能找到幸福。 : - 看一个男孩子是否真心爱你，要看他是否为你着想。 : - 一个好的伴侣应该相互促进，一起变得更好。 : - 成为独立自主的人，才能找到相匹配的另一半。 --以上内容由模型基于视频内容生成，仅供参考,0.3594573740249155,1.0,0.9920853708465044
对象的恋爱羞耻曾经让我怀疑是不是她不够喜欢，我不值得以她男朋友的身份出现在别人面前[笑哭]不过后来无所谓了。话说作为男朋友，需要帮助或者怎么帮助对象克服恋爱羞耻呢？,对象的恋爱羞耻曾经让我怀疑是不是她不够喜欢，我不值得以她男朋友的身份出现在别人面前不过后来无所谓了。话说作为男朋友，需要帮助或者怎么帮助对象克服恋爱羞耻呢？,0.3594573740249155,1.0,0.6067710637753474
老师说得好，有情感需求是一件非常正常的事，不需要为此而有负罪感。我不会再因为父母担心双方条件不合适而主动放弃我所需要的感情了。只有自己才清楚什么样的人是适合走一生的。,老师说得好，有情感需求是一件非常正常的事，不需要为此而有负罪感。我不会再因为父母担心双方条件不合适而主动放弃我所需要的感情了。只有自己才清楚什么样的人是适合走一生的。,0.3594573740249155,1.0,0.8282097591846601
"一、在农村谈恋爱所面临的困难和复杂情况，与在城市谈恋爱不同，涉及到更多家庭、家族和社区等方面的考虑和影响。
00:01 - 谈恋爱需要找对象，要去大城市寻找机会
00:23 - 大城市市场大、资源多，更容易找到合适的对象
01:03 - 在农村谈恋爱容易涉及到两个家庭甚至更多，难度变大
二、在谈恋爱过程中，需要付出更多的精力来对抗负面情绪的倾泻，建议保持独立自主可控，不要跨服，找到合适自己的才是最好的。
03:00 - 谈恋爱需要消耗额外的精力对抗负面情绪
03:15 - 建议谈恋爱时独立自主可控，保证安全，不要跨服或段位
03:53 - 按照规则匹配合适的人，不要想着找高段位的人带你
--本内容由AI视频小助理生成，关注解锁AI助理，由@侈哆 召唤发送",一、在农村谈恋爱所面临的困难和复杂情况，与在城市谈恋爱不同，涉及到更多家庭、家族和社区等方面的考虑和影响。 : - 谈恋爱需要找对象，要去大城市寻找机会 : - 大城市市场大、资源多，更容易找到合适的对象 : - 在农村谈恋爱容易涉及到两个家庭甚至更多，难度变大 二、在谈恋爱过程中，需要付出更多的精力来对抗负面情绪的倾泻，建议保持独立自主可控，不要跨服，找到合适自己的才是最好的。 : - 谈恋爱需要消耗额外的精力对抗负面情绪 : - 建议谈恋爱时独立自主可控，保证安全，不要跨服或段位 : - 按照规则匹配合适的人，不要想着找高段位的人带你 --本内容由AI视频小助理生成，关注解锁AI助理，由@侈哆 召唤发送,0.3594573740249155,1.0,0.7652523707443337
择偶定位还需要花钱找人做么？自己看看自己身边有多少追求者，都是什么类别，不就一目了然了。。。,择偶定位还需要花钱找人做么？自己看看自己身边有多少追求者，都是什么类别，不就一目了然了。。。,0.3594573740249155,1.0,0.7396628379269448
“我爱你”说跟做是两回事，这是一个考验，需要一辈子去完成。,“我爱你”说跟做是两回事，这是一个考验，需要一辈子去完成。,0.3594573740249155,1.0,0.6687334058337986
跟他都是安全型 有做过ky的同一个测试 但即使如此 步调也还是需要磨合协调 因为太像了 都不太主动 看到对方退一步 自己也就退一步……但是需要你来我往 你进我退呀 有的时候有点心累 太像这一点 做朋友时或者说前期是很惊喜的点 现在……发现进入感情后 被动的自己还是更期待对方主动的[大哭],跟他都是安全型 有做过ky的同一个测试 但即使如此 步调也还是需要磨合协调 因为太像了 都不太主动 看到对方退一步 自己也就退一步……但是需要你来我往 你进我退呀 有的时候有点心累 太像这一点 做朋友时或者说前期是很惊喜的点 现在……发现进入感情后 被动的自己还是更期待对方主动的,0.3594573740249155,1.0,0.7602753341654347
up主说的某些话有点极端，对于婚姻，还是需要设置几条底线，比如，出轨，家暴，赌博，吸毒等。有了一次，就分开的好，其他的，其实互相包容就可以。,up主说的某些话有点极端，对于婚姻，还是需要设置几条底线，比如，出轨，家暴，赌博，吸毒等。有了一次，就分开的好，其他的，其实互相包容就可以。,0.3594573740249155,1.0,0.6507173845146021
我的感受，要爱具体的人。没有完美的人，没有完美的你我，“爱是需要学习的，幸福是需要练习的”。然后，虽然那些霸总小说沈老师前面视频有，但还是笑的不行[笑哭]（我小时候看的都是些什么玩意）。最后！！还是祝福大家能找到同频的人，走向爱情都能遇到双向奔赴的人！！！[桃源_缘分][桃源_给花花],我的感受，要爱具体的人。没有完美的人，没有完美的你我，“爱是需要学习的，幸福是需要练习的”。然后，虽然那些霸总小说沈老师前面视频有，但还是笑的不行（我小时候看的都是些什么玩意）。最后！！还是祝福大家能找到同频的人，走向爱情都能遇到双向奔赴的人！！！,0.3594573740249155,1.0,0.7683168741715598
"《幸福的勇气》里有一句话：“主动去爱，自立起来，选择人生，这是一条多么艰难的道路。”
从小到大都是被爱，现在需要主动去爱，需要真正的勇气去蜕变呀。",《幸福的勇气》里有一句话：“主动去爱，自立起来，选择人生，这是一条多么艰难的道路。” 从小到大都是被爱，现在需要主动去爱，需要真正的勇气去蜕变呀。,0.3594573740249155,1.0,0.6600147730134034
"，
，
我就躺平，我就朝九晚五双休，我就享受生活，我就一个月七八千，我就想吃什么吃什么，我就想玩就玩，能遇到合适的就结婚，不能就算了，我就不生孩子，让我生孩子，玩呢，徒增负担，我没有王位需要继承，我甚至都没有房子需要继承。",， ， 我就躺平，我就朝九晚五双休，我就享受生活，我就一个月七八千，我就想吃什么吃什么，我就想玩就玩，能遇到合适的就结婚，不能就算了，我就不生孩子，让我生孩子，玩呢，徒增负担，我没有王位需要继承，我甚至都没有房子需要继承。,0.3594573740249155,0.33622659986374615,0.4432157429394092
"一、本书介绍了幸福的婚姻必须经历的五个步骤，以及如何使你的婚姻幸福。婚姻管理中最关键的一点是要接受变化，让双方都能得到提升。
00:01 - 结婚是为了轻松省心，但婚姻需要经营和管理。
01:02 - 婚姻中，双方需要接受改变，共同成长。
02:58 - 重新认识婚姻的本质，学会主动面对变化。
二、作者认为，好的婚姻需要经历波折与改变，夫妇间发生冲突时，要理解彼此的差异，搞清楚问题的根源，才能有效解决问题。
04:00 - 夫妻关系融洽，即使遇到考验也能相互扶持
04:16 - 夫妻间的差异使他们成长，情感升华，理解彼此
05:33 - 夫妻间的沟通需要理解男女之间的差异，才能有效解决问题
三、在婚姻中理解和尊重男女差异的重要性，以及如何恰当地表达情感和设身处地地看待彼此。
08:01 - 尊重男性和女性的差异，恰当地表达情感。
09:18 - 将彼此视为最敬重的朋友，设身处地地看待问题。
11:41 - 恢复婚姻需要从心态上转变，意识到自己的问题。
四、在婚姻中，夫妻双方需要理性地处理自己的需要，主动与另一半交流，并尽力找到双方的共同兴趣，才能保持健康的婚姻关系。
12:00 - 不能和对方交流想法会导致问题更复杂
12:32 - 夫妻中的一方需要面对自己的需求，并与另一方交流
14:00 - 建立有效的交流方式，摆脱家族影响，避免过度依赖父母
五、要建立幸福的婚姻关系需要尊重和理解男女之间的差异，建立共同的目标并为之奋斗，以及在争吵后尝试修补关系。
16:01 - 摆脱原生家庭对自身的影响，建立有效的交流模式。
16:39 - 尝试在争吵后修补情绪，用简单的有默契的行动阻止负面情绪的增加。
18:00 - 寻找共同的目标，携手合作，建立快乐的家庭关系。
--本内容由AI视频小助理生成，关注解锁AI助理，由@氵苦小瓜 召唤发送",一、本书介绍了幸福的婚姻必须经历的五个步骤，以及如何使你的婚姻幸福。婚姻管理中最关键的一点是要接受变化，让双方都能得到提升。 : - 结婚是为了轻松省心，但婚姻需要经营和管理。 : - 婚姻中，双方需要接受改变，共同成长。 : - 重新认识婚姻的本质，学会主动面对变化。 二、作者认为，好的婚姻需要经历波折与改变，夫妇间发生冲突时，要理解彼此的差异，搞清楚问题的根源，才能有效解决问题。 : - 夫妻关系融洽，即使遇到考验也能相互扶持 : - 夫妻间的差异使他们成长，情感升华，理解彼此 : - 夫妻间的沟通需要理解男女之间的差异，才能有效解决问题 三、在婚姻中理解和尊重男女差异的重要性，以及如何恰当地表达情感和设身处地地看待彼此。 : - 尊重男性和女性的差异，恰当地表达情感。 : - 将彼此视为最敬重的朋友，设身处地地看待问题。 : - 恢复婚姻需要从心态上转变，意识到自己的问题。 四、在婚姻中，夫妻双方需要理性地处理自己的需要，主动与另一半交流，并尽力找到双方的共同兴趣，才能保持健康的婚姻关系。 : - 不能和对方交流想法会导致问题更复杂 : - 夫妻中的一方需要面对自己的需求，并与另一方交流 : - 建立有效的交流方式，摆脱家族影响，避免过度依赖父母 五、要建立幸福的婚姻关系需要尊重和理解男女之间的差异，建立共同的目标并为之奋斗，以及在争吵后尝试修补关系。 : - 摆脱原生家庭对自身的影响，建立有效的交流模式。 : - 尝试在争吵后修补情绪，用简单的有默契的行动阻止负面情绪的增加。 : - 寻找共同的目标，携手合作，建立快乐的家庭关系。 --本内容由AI视频小助理生成，关注解锁AI助理，由@氵苦小瓜 召唤发送,1.0,1.0,0.8887341959475664
现在的人谈的那是爱情吗，谈的那是钱……不是说爱情不需要物质基础，那肯定是需要的，但现在的人有点太物质了，已经完全超过了物质“基础”这个层次。,现在的人谈的那是爱情吗，谈的那是钱……不是说爱情不需要物质基础，那肯定是需要的，但现在的人有点太物质了，已经完全超过了物质“基础”这个层次。,0.3594573740249155,1.0,0.706846193657598
真爱都需要责任感，不管男女,真爱都需要责任感，不管男女,0.3594573740249155,1.0,0.72957836251326
我是对方太亲密了我会疏远，疏远了又会想ta真的就这样淡了吗？如果是，我可能会难过一下然后说服自己:嗯没关系，反正我也不需要，该干啥干啥,我是对方太亲密了我会疏远，疏远了又会想ta真的就这样淡了吗？如果是，我可能会难过一下然后说服自己:嗯没关系，反正我也不需要，该干啥干啥,0.3594573740249155,1.0,0.7560874235961135
对我来说，对人忽冷忽热是一件很痛苦的事情，之前追求的女孩，朋友一直劝我要少说少做，可是，我就是忍不住去找她，或许我不是需要对象，只是想要一个伴吧,对我来说，对人忽冷忽热是一件很痛苦的事情，之前追求的女孩，朋友一直劝我要少说少做，可是，我就是忍不住去找她，或许我不是需要对象，只是想要一个伴吧,0.3594573740249155,1.0,0.7323238902642653
女生需要经济独立，这是尊严问题  在爱情中不要让一方过度付出，不然容易失衡哦,女生需要经济独立，这是尊严问题 在爱情中不要让一方过度付出，不然容易失衡哦,0.3594573740249155,0.4320558161628193,0.4584794020759
"我认为彩礼是一种“生育补偿”，因为生一个孩子，男方客观上可以不做任何付出，但是女方需要怀孕痛苦至少10个月，包括身体受损、心情抑郁、身材走样、影响事业晋升，严重可能会导致失业和死亡，生孩子之后，大部分需要哺乳，可能经历产后抑郁。这些都是不可能逃离的痛苦。男性可以无痛得到一个跟着自己姓的孩子，事业身心都不会受损，所以适当拿一些彩礼是应该的。
不是高额彩礼，只是保证怀孕、生育、月子期间的一切消费，女方可以自由支配，就比如视频里说的无痛、月子中心，一些婆家为了省钱不愿给儿媳出的。",我认为彩礼是一种“生育补偿”，因为生一个孩子，男方客观上可以不做任何付出，但是女方需要怀孕痛苦至少个月，包括身体受损、心情抑郁、身材走样、影响事业晋升，严重可能会导致失业和死亡，生孩子之后，大部分需要哺乳，可能经历产后抑郁。这些都是不可能逃离的痛苦。男性可以无痛得到一个跟着自己姓的孩子，事业身心都不会受损，所以适当拿一些彩礼是应该的。 不是高额彩礼，只是保证怀孕、生育、月子期间的一切消费，女方可以自由支配，就比如视频里说的无痛、月子中心，一些婆家为了省钱不愿给儿媳出的。,0.3594573740249155,1.0,0.7324154642945679
我和前男友相处一年，他自愿给我转的钱，我没有要过一分钱。大概不到2万，需要返还吗？,我和前男友相处一年，他自愿给我转的钱，我没有要过一分钱。大概不到万，需要返还吗？,0.3594573740249155,1.0,0.6198364253449334
彩礼有很强的阶级性。不要的大概率也不会为彩礼发愁，需要彩礼的大概率给不起。未来彩礼只会越来越高，新数据0-9岁新生儿男女比例更加夸张，拭目以待吧。一句话，能结就结，不能结就拉到。,彩礼有很强的阶级性。不要的大概率也不会为彩礼发愁，需要彩礼的大概率给不起。未来彩礼只会越来越高，新数据-岁新生儿男女比例更加夸张，拭目以待吧。一句话，能结就结，不能结就拉到。,0.3594573740249155,1.0,0.5888856700540321
这个需要双方关系到一定程度吧？矜持一点好,这个需要双方关系到一定程度吧？矜持一点好,0.3594573740249155,0.4320558161628193,0.3598970125807187
"第一次当回课代表如有没有记到的地方还请谅解[调皮]：
建议静下心来认真了解自己和对方的性格，性格非常的重要。
性格分析的宝藏书籍《请理解我》
想测测自己什么性格，书籍背后有测试表，也可以在网上搜集MBTI性格测试，找个免费的测试一下。
遇上对的人，别做错的事。
“我发现很多人对爱情都有误解，他们总认为爱情纯凭感觉的，不需要后天的学习，但实际上凭感觉的叫激情，而不是爱情。当成为情侣的新鲜感散去，激情消退后，两个人是需要共同努力去共同守护这段关系的， 它需要包容，包容对方的一些缺点，也需要改变，改变自己的一些习惯，更需要学习。
爱情不是单方面的付出，也不是无底线的纵容，更不是低入尘土的卑微，它应该是平等的，它需要两个人的共同努力。你的未来有TA，TA的未来有你，这才是最好的爱情❤️”",第一次当回课代表如有没有记到的地方还请谅解： 建议静下心来认真了解自己和对方的性格，性格非常的重要。 性格分析的宝藏书籍《请理解我》 想测测自己什么性格，书籍背后有测试表，也可以在网上搜集MBTI性格测试，找个免费的测试一下。 遇上对的人，别做错的事。 “我发现很多人对爱情都有误解，他们总认为爱情纯凭感觉的，不需要后天的学习，但实际上凭感觉的叫激情，而不是爱情。当成为情侣的新鲜感散去，激情消退后，两个人是需要共同努力去共同守护这段关系的， 它需要包容，包容对方的一些缺点，也需要改变，改变自己的一些习惯，更需要学习。 爱情不是单方面的付出，也不是无底线的纵容，更不是低入尘土的卑微，它应该是平等的，它需要两个人的共同努力。你的未来有TA，TA的未来有你，这才是最好的爱情❤️”,0.3594573740249155,1.0,0.7766035398069482
最近常看到一句话叫「爱到最后全凭良心」，也许双方对感情的底层需求是否匹配才是维持关系的关键吧。如果需要的是忠诚和责任，那可能只要从关系中得到陪伴和安全感就够了；如果需要的是激情和相互吸引，那可能更需要的是相互间生理性的喜欢。传统的浪漫爱情总让我们以为两者是相互融合缺一不可的，但实际上能满足和维持其中一项就已经很难了,最近常看到一句话叫「爱到最后全凭良心」，也许双方对感情的底层需求是否匹配才是维持关系的关键吧。如果需要的是忠诚和责任，那可能只要从关系中得到陪伴和安全感就够了；如果需要的是激情和相互吸引，那可能更需要的是相互间生理性的喜欢。传统的浪漫爱情总让我们以为两者是相互融合缺一不可的，但实际上能满足和维持其中一项就已经很难了,0.3594573740249155,1.0,0.8182576956587639
男人要多夸，我老公就是那种越吐槽他越不改，你一夸，他反而积极起来。婚姻生活也是需要技巧，彼此都需要包容,男人要多夸，我老公就是那种越吐槽他越不改，你一夸，他反而积极起来。婚姻生活也是需要技巧，彼此都需要包容,0.3594573740249155,1.0,0.7898099355174941
