comment,cleaned_comment,score1,score2,combined_score
我也准备结婚了，已经感觉到婚前买房以及彩礼之类的消费，双方父母总是会有矛盾，我爸和他爸爸吵架，我爸喊我分手，我和我男朋友在中间周旋了很久，互相说好话，才和平共处了，婚前买房也是，他爸妈也很担心我要去掺和什么（加名字之类的），我爸又怕我吃亏，总之就是双方各防各的，以及如果父母很开明，婚前同居没关系，要是双方父母都保守的，千万不要婚前同居！！！！就算同居了，做好防护措施，别怀孕！！！这个是重点，不然就会面临，男方父母在准备结婚这些事情中的态度高高在上（少部分不会，但大部分都会打压女方这边的,我也准备结婚了，已经感觉到婚前买房以及彩礼之类的消费，双方父母总是会有矛盾，我爸和他爸爸吵架，我爸喊我分手，我和我男朋友在中间周旋了很久，互相说好话，才和平共处了，婚前买房也是，他爸妈也很担心我要去掺和什么（加名字之类的），我爸又怕我吃亏，总之就是双方各防各的，以及如果父母很开明，婚前同居没关系，要是双方父母都保守的，千万不要婚前同居！！！！就算同居了，做好防护措施，别怀孕！！！这个是重点，不然就会面临，男方父母在准备结婚这些事情中的态度高高在上（少部分不会，但大部分都会打压女方这边的,0.40159477065724175,1.0,0.734282652531991
我觉得吧，你这视频里全是毒鸡汤，拉一群牡丹的人陪着你单着，点外卖怎么就是廉价的关心了？？一个陌生人会给你点外卖？？关心还分等级？？父母问候你一分钱都没花，这怎么算？？爱情需要理由吗？？自己就在物化爱情。。衡量的标准难道不是真心吗？在自己能力范围内的关心就够了。否则你就不是找对象，找个干爹算了。[辣眼睛],我觉得吧，你这视频里全是毒鸡汤，拉一群牡丹的人陪着你单着，点外卖怎么就是廉价的关心了？？一个陌生人会给你点外卖？？关心还分等级？？父母问候你一分钱都没花，这怎么算？？爱情需要理由吗？？自己就在物化爱情。。衡量的标准难道不是真心吗？在自己能力范围内的关心就够了。否则你就不是找对象，找个干爹算了。,0.3594573740249155,1.0,0.718146112339274
父母催婚其实和让你幸福不幸福无关，大多只是觉得没面子而已。,父母催婚其实和让你幸福不幸福无关，大多只是觉得没面子而已。,0.3594573740249155,1.0,0.537711874994376
说一个被大家忽视或者说是不愿意提起来的原因，这些对婚姻丧失了积极兴趣的人群，很大一部分从来没有在原生家庭里得到过关婚姻的正能量积极性和谐性信息，相反他们亲眼目睹了所谓的夫妻同床异梦互相攻击谩骂羞辱，亲眼目睹所谓的给孩子一个家给的是终生伴随的心理创伤，活生生的硬扛了十几年二十几年甚至更长时间，在他们手脚并用拼命攀爬终于离开了出生即存在的人间炼狱后，父母们觉得他们还有可能为了所谓的幸福重新跌落回去吗？？？实话说这是一场前所未有的滞后表现出来的集体大逃离，而造成这一幕的正是所谓的为了你好的父母们！,说一个被大家忽视或者说是不愿意提起来的原因，这些对婚姻丧失了积极兴趣的人群，很大一部分从来没有在原生家庭里得到过关婚姻的正能量积极性和谐性信息，相反他们亲眼目睹了所谓的夫妻同床异梦互相攻击谩骂羞辱，亲眼目睹所谓的给孩子一个家给的是终生伴随的心理创伤，活生生的硬扛了十几年二十几年甚至更长时间，在他们手脚并用拼命攀爬终于离开了出生即存在的人间炼狱后，父母们觉得他们还有可能为了所谓的幸福重新跌落回去吗？？？实话说这是一场前所未有的滞后表现出来的集体大逃离，而造成这一幕的正是所谓的为了你好的父母们！,0.3594573740249155,1.0,0.8287316831783882
父母为啥催你结婚。我父母说别人都结婚了你没结，别人笑话你。（其实我不在意）但父母那一代把面子看到比命重要。,父母为啥催你结婚。我父母说别人都结婚了你没结，别人笑话你。（其实我不在意）但父母那一代把面子看到比命重要。,0.3594573740249155,1.0,0.6740263174650079
"婚姻是两家的事情，谈恋爱是两个人的事情，婚姻从大局出发，双方父母都认可。
我父母也是这么跟我说的，包括我的长辈，他们不同意，原因是从浙江到广西太远了，我以为这只是少部分人这么想，看到这句话在视频里说出来，扎心。真的是这样吗？结婚难道不是两个人过日子吗，又不是跟父母住在一起，为什么还要两家人都同意？她的父母没有表示反对，让谈着试试，但是我爸却说谈恋爱跟谈对象不一样，让我积累经验，玩玩就好。
我不理解。实在是不理解。怎么我父亲会说出这种话，我想的是等我回国就结婚。现在看来困难重重。我这边的家庭阻力太大了。但是我想追求我喜欢的，而不是“搭伙过日子”。",婚姻是两家的事情，谈恋爱是两个人的事情，婚姻从大局出发，双方父母都认可。 我父母也是这么跟我说的，包括我的长辈，他们不同意，原因是从浙江到广西太远了，我以为这只是少部分人这么想，看到这句话在视频里说出来，扎心。真的是这样吗？结婚难道不是两个人过日子吗，又不是跟父母住在一起，为什么还要两家人都同意？她的父母没有表示反对，让谈着试试，但是我爸却说谈恋爱跟谈对象不一样，让我积累经验，玩玩就好。 我不理解。实在是不理解。怎么我父亲会说出这种话，我想的是等我回国就结婚。现在看来困难重重。我这边的家庭阻力太大了。但是我想追求我喜欢的，而不是“搭伙过日子”。,0.3594573740249155,1.0,0.8911151532488197
"出柜的目的是什么？我个人认为是——告知。告知父母真实的自己是什么样的人，然后成为为自己负责的“成年人”。

告知一定会获得他人认可吗？当然不是，他人，包括自己的亲生父母有不认可自己恋爱方式的权利。就像我不认同他们退休后还每天必须七点起床吃早餐，起床后必须铺被子的习惯一样。

为什么让孩子尊重父母的生活方式更容易，但相反，让父母接受孩子的生活方式常常更难？我认为这是因为，我们，包括我们的家人，常常缺乏健康的边界感。",出柜的目的是什么？我个人认为是——告知。告知父母真实的自己是什么样的人，然后成为为自己负责的“成年人”。 告知一定会获得他人认可吗？当然不是，他人，包括自己的亲生父母有不认可自己恋爱方式的权利。就像我不认同他们退休后还每天必须七点起床吃早餐，起床后必须铺被子的习惯一样。 为什么让孩子尊重父母的生活方式更容易，但相反，让父母接受孩子的生活方式常常更难？我认为这是因为，我们，包括我们的家人，常常缺乏健康的边界感。,0.3594573740249155,0.33622659986374615,0.5513184450818819
没用！感情不是能套用公式的。爱他因为他父母不怎么好相处就分手？爱他还能理智分析他的三观。三观不合你能爱上他？诚信，哄你算不算诚信？讲道理算不算诚信？,没用！感情不是能套用公式的。爱他因为他父母不怎么好相处就分手？爱他还能理智分析他的三观。三观不合你能爱上他？诚信，哄你算不算诚信？讲道理算不算诚信？,0.3594573740249155,1.0,0.6902648659064123
"我过来人来告诉大家结婚的好处
1、如果没结婚，我银行卡里至少有70W，现在只有2W多，还是在父母资助了10W左右下，要不然是负的。
2、如果没结婚，天天可以想玩什么玩什么，不像现在，下班回家玩游戏被一直说。",我过来人来告诉大家结婚的好处 、如果没结婚，我银行卡里至少有W，现在只有W多，还是在父母资助了W左右下，要不然是负的。 、如果没结婚，天天可以想玩什么玩什么，不像现在，下班回家玩游戏被一直说。,0.0,1.0,0.6260161515123129
想起来拿父母给的钱去和她出去玩会有负罪感。,想起来拿父母给的钱去和她出去玩会有负罪感。,0.40159477065724175,0.33622659986374615,0.34423320928885937
我以前一直不理解朋友正经恋爱不告诉父母的行为 觉得恋爱就要大方的告诉别人 直到我第一次谈恋爱（二十岁）很开心的和父母说 结果被他们每天近似羞辱的说教和规劝 以及日日打探我各种恋爱的细节和“进行到哪一步了” 后来我越来越无助 感觉恋爱中做什么都是恶心的不应该的 然而我真正在感情中遇到问题的时候 他们压根不会关心或者给出建议 所以后来分手了我整个人都扭曲了 再也不敢谈恋爱 甚至不敢把有关男女关系的消息告诉别人,我以前一直不理解朋友正经恋爱不告诉父母的行为 觉得恋爱就要大方的告诉别人 直到我第一次谈恋爱（二十岁）很开心的和父母说 结果被他们每天近似羞辱的说教和规劝 以及日日打探我各种恋爱的细节和“进行到哪一步了” 后来我越来越无助 感觉恋爱中做什么都是恶心的不应该的 然而我真正在感情中遇到问题的时候 他们压根不会关心或者给出建议 所以后来分手了我整个人都扭曲了 再也不敢谈恋爱 甚至不敢把有关男女关系的消息告诉别人,0.3594573740249155,1.0,0.7689454468715748
父母不会劝你恋爱，他们只会劝你结婚生孩子，恋爱不在他们考虑范围内[无语][无语][无语],父母不会劝你恋爱，他们只会劝你结婚生孩子，恋爱不在他们考虑范围内,0.3594573740249155,1.0,0.5770702715120847
"为什么单身至今
因为因为害怕
感性告诉我应该找个女友
可是理性告诉我
没有条件，不能找
自己什么都没有
家庭什么也没有
时时刻刻在考虑
假如有一天有了一个女友
该怎么给她介绍我的一切
工作，家庭，父母等等各种
和她出去了，她怎么介绍我
她和闺蜜交流起来，会不会很窘迫
别人都出去玩去了，她心里怎么想
别人别人的男友都怎么怎么了，她怎么想
能给她一个什么样的婚礼
拿什么对她的父母说
拿什么给她的父母
等等一切一切
我还没成为想要成为的我，
我还没能力给她我想要给的一切
我想要的很多，却拥有的很少
甚至没有

我知道别人不一定是物质的人
可是，别人物质不物质是别人的事
自己有没有，自己在乎不在乎是自己的事

有人说我想的多，敏感
还不是因为拥有的少么
假如什么都有，或者条件不再这么……谁又会整天想这想那呢

又或许，我并没有那么“好”，并非想给别人什么。只是害怕给的太过“简陋”，怕别人说三道四而已。",为什么单身至今 因为因为害怕 感性告诉我应该找个女友 可是理性告诉我 没有条件，不能找 自己什么都没有 家庭什么也没有 时时刻刻在考虑 假如有一天有了一个女友 该怎么给她介绍我的一切 工作，家庭，父母等等各种 和她出去了，她怎么介绍我 她和闺蜜交流起来，会不会很窘迫 别人都出去玩去了，她心里怎么想 别人别人的男友都怎么怎么了，她怎么想 能给她一个什么样的婚礼 拿什么对她的父母说 拿什么给她的父母 等等一切一切 我还没成为想要成为的我， 我还没能力给她我想要给的一切 我想要的很多，却拥有的很少 甚至没有 我知道别人不一定是物质的人 可是，别人物质不物质是别人的事 自己有没有，自己在乎不在乎是自己的事 有人说我想的多，敏感 还不是因为拥有的少么 假如什么都有，或者条件不再这么……谁又会整天想这想那呢 又或许，我并没有那么“好”，并非想给别人什么。只是害怕给的太过“简陋”，怕别人说三道四而已。,0.3594573740249155,1.0,0.7987229237330711
我相亲的那个就挺不错的，干脆利落的说明我月薪7.5k养不了她，就当是给父母一个交代，见个面，说我赚钱也不容易连饭都没让我请，当然奶茶还是要意思一下的！然后陪她逛了逛江边，好聚好散[笑哭],我相亲的那个就挺不错的，干脆利落的说明我月薪.k养不了她，就当是给父母一个交代，见个面，说我赚钱也不容易连饭都没让我请，当然奶茶还是要意思一下的！然后陪她逛了逛江边，好聚好散,0.3594573740249155,1.0,0.6950894245629208
"肯定不合适了，故事里这女的很小气抠门的，这个男的挺大方的，如果结婚后这男的如果想帮家里，给个多少，女的肯定反对，马上就出问题了。
我单位的一个男的就是这样，和我们出去玩，就我们出钱，他从来不出。我们也不在乎。
我觉得这个男的很难找到女朋友了吧，结果他真的找到了个女朋友，那个女的还说自己应该早点遇到他，太喜欢他了。我都惊呆了，后来才知道这女的也很抠门，他父母也很抠门，女的父母也是亲兄弟姐妹请他吃饭，他的父母从来不回请。男的父母是做生意的，女的父母也是做生意的，做生意的人，真的就是挺小气的。
所以婚姻这事，真不是是非对错，人好人坏这么简单的东西。话说回来，其实想想老天爷很公平呀，什么样的人就让他遇见什么样的人。",肯定不合适了，故事里这女的很小气抠门的，这个男的挺大方的，如果结婚后这男的如果想帮家里，给个多少，女的肯定反对，马上就出问题了。 我单位的一个男的就是这样，和我们出去玩，就我们出钱，他从来不出。我们也不在乎。 我觉得这个男的很难找到女朋友了吧，结果他真的找到了个女朋友，那个女的还说自己应该早点遇到他，太喜欢他了。我都惊呆了，后来才知道这女的也很抠门，他父母也很抠门，女的父母也是亲兄弟姐妹请他吃饭，他的父母从来不回请。男的父母是做生意的，女的父母也是做生意的，做生意的人，真的就是挺小气的。 所以婚姻这事，真不是是非对错，人好人坏这么简单的东西。话说回来，其实想想老天爷很公平呀，什么样的人就让他遇见什么样的人。,0.3594573740249155,1.0,0.8332487259621897
我前段时间有个叔叔给我介绍他妹妹（辈分上）比我大三岁，我俩不在一个地方，然后国庆的时候我去见个面就当给我叔叔一个面子，接触下来就觉得和敏姐说的这个女生很像，她父母虽退居二线，但是手头还算有钱，她工作也是靠父母关系进，花费很大手脚，虽然存在我过去玩人家招待我的原因，但是能感受的出来我俩消费观价值观就不在一个层面，感觉是将来结了婚要当全职太太的，我反正养不起赶紧跑了[撇嘴],我前段时间有个叔叔给我介绍他妹妹（辈分上）比我大三岁，我俩不在一个地方，然后国庆的时候我去见个面就当给我叔叔一个面子，接触下来就觉得和敏姐说的这个女生很像，她父母虽退居二线，但是手头还算有钱，她工作也是靠父母关系进，花费很大手脚，虽然存在我过去玩人家招待我的原因，但是能感受的出来我俩消费观价值观就不在一个层面，感觉是将来结了婚要当全职太太的，我反正养不起赶紧跑了,0.3594573740249155,1.0,0.7468801686222674
"不，在我这不存在婚姻焦虑，我从小到大都是比较独立的那种，高中分科，大学选专业别人家的父母都在“出谋划策”，而我父母任由我开心，选自己喜欢的专业就好，大学毕业甚至还没有毕业，别人家的父母开始催婚，我父母则跟我说：你不要想那么多，毕业之后好好赚钱，去更多的地方看看，婚姻的事急不来。
去年我发小结婚，我回去的时候我又主动和父母聊过这个话题，父母的回答还是和当初一样，他们觉得我现在还是小孩子心态（其实我已经毕业三年了[笑哭]）不能承担家庭的重任，不希望我早早就步入婚姻，甚至有亲戚想给我相亲都被我爸妈拒绝了，他们不在乎我喜欢男生还是女生，不关心我的感情生活，只要我在外面工作能好好照顾自己就好了。至于孩子，我妈一向知道我不喜欢小孩，别人觉得可爱，我只觉得吵闹。自己出来工作也有三年了，多多少少存了点钱，在老家市里面买房的首付也是足够的，但我还是喜欢回村里，因为养了狗狗，而且老家的院子足够大[笑哭]",不，在我这不存在婚姻焦虑，我从小到大都是比较独立的那种，高中分科，大学选专业别人家的父母都在“出谋划策”，而我父母任由我开心，选自己喜欢的专业就好，大学毕业甚至还没有毕业，别人家的父母开始催婚，我父母则跟我说：你不要想那么多，毕业之后好好赚钱，去更多的地方看看，婚姻的事急不来。 去年我发小结婚，我回去的时候我又主动和父母聊过这个话题，父母的回答还是和当初一样，他们觉得我现在还是小孩子心态（其实我已经毕业三年了）不能承担家庭的重任，不希望我早早就步入婚姻，甚至有亲戚想给我相亲都被我爸妈拒绝了，他们不在乎我喜欢男生还是女生，不关心我的感情生活，只要我在外面工作能好好照顾自己就好了。至于孩子，我妈一向知道我不喜欢小孩，别人觉得可爱，我只觉得吵闹。自己出来工作也有三年了，多多少少存了点钱，在老家市里面买房的首付也是足够的，但我还是喜欢回村里，因为养了狗狗，而且老家的院子足够大,0.3594573740249155,0.33622659986374615,0.503207865413885
我妈妈自己看的书多，她就自己经常跟自己打架。一方面担心她和我爸走了之后我在这个世界上没有最亲近的人，一方面又觉得现代人完全可以一个人过的很好。其实父母还是为子女好更胜过从众的，比如我父母认为他们人生最幸福的事情是有了我，他们催我要孩子，其实也是想让我体会这种幸福。(我20岁在大学谈恋爱，我妈给我打电话说，如果不小心有孩子千万不要打掉[笑哭] 虽然我28岁还没有。。。过）,我妈妈自己看的书多，她就自己经常跟自己打架。一方面担心她和我爸走了之后我在这个世界上没有最亲近的人，一方面又觉得现代人完全可以一个人过的很好。其实父母还是为子女好更胜过从众的，比如我父母认为他们人生最幸福的事情是有了我，他们催我要孩子，其实也是想让我体会这种幸福。(我岁在大学谈恋爱，我妈给我打电话说，如果不小心有孩子千万不要打掉 虽然我岁还没有。。。过）,0.3594573740249155,1.0,0.6909743212376176
给漂亮又聪明的up主比心♥️&amp;想问下父母不太同意（父母还是比较开明尊重我的，所以不赞成也没明确反对）的恋爱 小姐姐觉得需要坚持吗？好怕我太年轻以后会恍然大悟父母讲的话这种情况～,给漂亮又聪明的up主比心♥️&amp;想问下父母不太同意（父母还是比较开明尊重我的，所以不赞成也没明确反对）的恋爱 小姐姐觉得需要坚持吗？好怕我太年轻以后会恍然大悟父母讲的话这种情况～,0.3594573740249155,1.0,0.7543598646949099
很多人都在说能结就结呗，反正跟谁都一样。不结婚父母是第一关，结了婚大不了就离呗。反正要走这么一遭。,很多人都在说能结就结呗，反正跟谁都一样。不结婚父母是第一关，结了婚大不了就离呗。反正要走这么一遭。,0.3594573740249155,1.0,0.6816024448730522
"我身边大多数是这样：农村小伙想办法在城市闯一席之地，通过自己努力和掏空父母钱包来在城里买套房，从而扩大自己在婚恋市场的选择范围。
当然，在城里打拼的农村小伙和在城里打拼的农村姑娘结合，也是一种比较普遍的组合，我愿称之为原始股家庭:两个人从无到有在城市闯出一片天(我父母就是这样)[doge]",我身边大多数是这样：农村小伙想办法在城市闯一席之地，通过自己努力和掏空父母钱包来在城里买套房，从而扩大自己在婚恋市场的选择范围。 当然，在城里打拼的农村小伙和在城里打拼的农村姑娘结合，也是一种比较普遍的组合，我愿称之为原始股家庭:两个人从无到有在城市闯出一片天(我父母就是这样),0.3594573740249155,1.0,0.6790790833976729
父母是为了自己的面子，亲戚朋友问起来自己孩子还没结婚就会说三道四，父母会感觉很丢脸，有些人甚至会因为你没后而欺负你，这是父母拼命催婚催生的根本原因，解决这个问题只有远离家乡，说到底父母最在乎的不是孩子是否幸福，而是自己在亲戚朋友面前有没有面子,父母是为了自己的面子，亲戚朋友问起来自己孩子还没结婚就会说三道四，父母会感觉很丢脸，有些人甚至会因为你没后而欺负你，这是父母拼命催婚催生的根本原因，解决这个问题只有远离家乡，说到底父母最在乎的不是孩子是否幸福，而是自己在亲戚朋友面前有没有面子,0.3594573740249155,1.0,0.8070529702425139
人，要有自知之明，物价、房贷、教育、父母医疗等一切未来可预知的消费，我不配结婚,人，要有自知之明，物价、房贷、教育、父母医疗等一切未来可预知的消费，我不配结婚,0.40159477065724175,1.0,0.6594403167064445
女的不孝顺公婆可以打？儿媳女婿对配偶父母只有协助赡养义务吧？允许配偶用共同财产赡养就可以吧？,女的不孝顺公婆可以打？儿媳女婿对配偶父母只有协助赡养义务吧？允许配偶用共同财产赡养就可以吧？,0.0,0.33622659986374615,0.2937817770030957
农村女孩结婚没有嫁妆，父母的物质基础全部给儿子了，可怜吧,农村女孩结婚没有嫁妆，父母的物质基础全部给儿子了，可怜吧,0.3594573740249155,1.0,0.568350590851616
"1 观点一：不管是彩礼还是嫁妆，从双方父母里筹集来的钱必须用在小家庭，小夫妻俩是一条心。这是一切的前提；
2 观点二：农村的彩礼及繁琐流程本质上是一种【离开农村的民俗税】。除非你完全不在乎，双方父母完全不在乎，几十年的观念及  后续几十年乡里乡亲的言语（尤其是女方父母）；
3 观点三：男方家庭也不要打着什么现代的平等要求完全对等。几千年来的男女差别民俗到你父母，你自己这一时代 就完全没有影响了？你问问父母，小夫妻俩生的孩子姓抽签决定试试？",观点一：不管是彩礼还是嫁妆，从双方父母里筹集来的钱必须用在小家庭，小夫妻俩是一条心。这是一切的前提； 观点二：农村的彩礼及繁琐流程本质上是一种【离开农村的民俗税】。除非你完全不在乎，双方父母完全不在乎，几十年的观念及 后续几十年乡里乡亲的言语（尤其是女方父母）； 观点三：男方家庭也不要打着什么现代的平等要求完全对等。几千年来的男女差别民俗到你父母，你自己这一时代 就完全没有影响了？你问问父母，小夫妻俩生的孩子姓抽签决定试试？,0.3594573740249155,1.0,0.7486757719929348
"你好！up主
我想问下，比如我的父母出钱给我首付，女票也帮忙了几万块钱，然后，在房产证上写上我和她的名字，婚后，就一起还房贷，
然后万一离婚了，这个是两个人各50％吗？",你好！up主 我想问下，比如我的父母出钱给我首付，女票也帮忙了几万块钱，然后，在房产证上写上我和她的名字，婚后，就一起还房贷， 然后万一离婚了，这个是两个人各％吗？,0.3594573740249155,1.0,0.6744569282848176
如果婚前父母全款买的房子，过户时女方要求加上她名字，这个离婚怎么分配,如果婚前父母全款买的房子，过户时女方要求加上她名字，这个离婚怎么分配,0.3594573740249155,1.0,0.6263406795532381
短婚两年半，今年5.25离婚，已解脱。各位小兄弟还是先照顾好自己跟父母吧。时代变了，父母那一辈的爱情不存在了。,短婚两年半，今年.离婚，已解脱。各位小兄弟还是先照顾好自己跟父母吧。时代变了，父母那一辈的爱情不存在了。,0.40159477065724175,1.0,0.6648333829313371
