comment,cleaned_comment,score1,score2,combined_score
之前相亲过一个男生 加上微信的第三天就问 我父母工作 我父母收入  我家房产  等等 而且闭口不谈自己家境  我非常非常反感  如果认识好几个月了 问一下很正常 建议各位大兄弟不要一上来就问 而且只问别人 不告知自己的情况  如果要问 可以先附带自己的情况 比如  我父母做什么什么工作 年收入多少  你爸妈什么工作呀？[藏狐],之前相亲过一个男生 加上微信的第三天就问 我父母工作 我父母收入 我家房产 等等 而且闭口不谈自己家境 我非常非常反感 如果认识好几个月了 问一下很正常 建议各位大兄弟不要一上来就问 而且只问别人 不告知自己的情况 如果要问 可以先附带自己的情况 比如 我父母做什么什么工作 年收入多少 你爸妈什么工作呀？,0.3594573740249155,1.0,0.7630852358379969
1500元一桌，我都嫌贵。[笑哭]不是说付不起，而是我觉得被酒楼当成水鱼了。我宁愿把那个钱请我父母和男方父母去个海边吃个丰富的海鲜大餐,元一桌，我都嫌贵。不是说付不起，而是我觉得被酒楼当成水鱼了。我宁愿把那个钱请我父母和男方父母去个海边吃个丰富的海鲜大餐,0.3594573740249155,1.0,0.6426294493615503
关于彩礼，我认为尊重女方那边的习俗，女方家乡普遍给多少就给多少。然后结婚是自己的事情，不能连累父母，自己有能力有条件就结婚，自己没达到这个经济条件就先不结，别用父母的钱结自己的婚，要学会独立自主才能成家立业。,关于彩礼，我认为尊重女方那边的习俗，女方家乡普遍给多少就给多少。然后结婚是自己的事情，不能连累父母，自己有能力有条件就结婚，自己没达到这个经济条件就先不结，别用父母的钱结自己的婚，要学会独立自主才能成家立业。,0.3594573740249155,1.0,0.6966576691112146
说下我吧，我是90后，我和我老公是婚前各有一台车一套房（老家），彩礼10万，婚礼前过我父母手，婚礼那天直接给到我老公手里了，我老公又给了我。陪嫁我们那习俗不讲给钱，给买东西。因为在工作地准备攒钱（首付和贷款）一起买房，所以一切从简，以后买的房子我两边父母再出装修钱。为了攒首付他已经把婚前房子给卖了,说下我吧，我是后，我和我老公是婚前各有一台车一套房（老家），彩礼万，婚礼前过我父母手，婚礼那天直接给到我老公手里了，我老公又给了我。陪嫁我们那习俗不讲给钱，给买东西。因为在工作地准备攒钱（首付和贷款）一起买房，所以一切从简，以后买的房子我两边父母再出装修钱。为了攒首付他已经把婚前房子给卖了,0.3594573740249155,1.0,0.7629828205346184
"小时候父母所有的时间都用来吵架，能感受到的关爱少的可怜，缺爱的人很难成立一个幸福的家庭，我弟为了爱太迁就女人，找了个泼妇，欺负一家老小，有时我还挺幸灾乐祸，你们不是能吵吗，现在请了个夏金桂，以一敌三，老两口乖乖伺候着儿媳还要受人家的辱骂
我呢，还是单身适合我，没有勇气走进婚姻",小时候父母所有的时间都用来吵架，能感受到的关爱少的可怜，缺爱的人很难成立一个幸福的家庭，我弟为了爱太迁就女人，找了个泼妇，欺负一家老小，有时我还挺幸灾乐祸，你们不是能吵吗，现在请了个夏金桂，以一敌三，老两口乖乖伺候着儿媳还要受人家的辱骂 我呢，还是单身适合我，没有勇气走进婚姻,0.3594573740249155,1.0,0.650415633791061
我觉得初高中恋爱没事儿，但孩子应该要清楚自己那个阶段的主要任务不是恋爱，如果他们在恋爱之余认真对待自己的人生，成绩没有下滑，也没有过早xing行为，我认为父母还是不要处理的太急比较好⋯⋯,我觉得初高中恋爱没事儿，但孩子应该要清楚自己那个阶段的主要任务不是恋爱，如果他们在恋爱之余认真对待自己的人生，成绩没有下滑，也没有过早xing行为，我认为父母还是不要处理的太急比较好⋯⋯,0.3594573740249155,0.33622659986374615,0.37710699619079024
在结婚向的相亲市场上，有一堆女生是不想结婚的，属于搅屎棍，而且还不少。被父母催着来相亲的，这些女生不适合结婚，她们只想谈恋爱[吃瓜],在结婚向的相亲市场上，有一堆女生是不想结婚的，属于搅屎棍，而且还不少。被父母催着来相亲的，这些女生不适合结婚，她们只想谈恋爱,0.3594573740249155,1.0,0.5693519132103704
那些说结婚和谈恋爱不一样的人，家庭多半不幸福，父母在孩子面前说对方不是自己最爱的人[捂脸],那些说结婚和谈恋爱不一样的人，家庭多半不幸福，父母在孩子面前说对方不是自己最爱的人,0.3594573740249155,1.0,0.6130992846233223
“为什么我们的父母的婚姻已经鸡飞狗跳，却还要催促我们结婚”，说到这个，我的父母从来不觉得婚姻是个很享受的事情，他们觉得这只是布置任务，而且认为我应该知道这只是个任务而已,“为什么我们的父母的婚姻已经鸡飞狗跳，却还要催促我们结婚”，说到这个，我的父母从来不觉得婚姻是个很享受的事情，他们觉得这只是布置任务，而且认为我应该知道这只是个任务而已,0.3594573740249155,1.0,0.6279762657412695
我个人觉得，大部分父母在生了女儿之后就已经有了“嫁出去”的准备，所以女方父母不会过多干涉女儿家庭。但是，男方父母会觉得自己“娶回来”一个儿媳，就觉得孩子的家庭仍然需要他们的“指导”。希望所有父母都能意识到，孩子结婚是从本身的家庭中割裂出一部分，去组建一个新的家庭，不是一个人加入另一个家庭。男方父母，女方父母，男方女方，这是三个家庭，它们是较为独立的，身为父母要懂得放手。,我个人觉得，大部分父母在生了女儿之后就已经有了“嫁出去”的准备，所以女方父母不会过多干涉女儿家庭。但是，男方父母会觉得自己“娶回来”一个儿媳，就觉得孩子的家庭仍然需要他们的“指导”。希望所有父母都能意识到，孩子结婚是从本身的家庭中割裂出一部分，去组建一个新的家庭，不是一个人加入另一个家庭。男方父母，女方父母，男方女方，这是三个家庭，它们是较为独立的，身为父母要懂得放手。,0.3594573740249155,1.0,0.6953194709465709
双方父母干涉太多了，影响了两个人判断能力。一听就知道，双方的耳根子都软，只是软在自己的父母，对彼此之间的感情并没有把控住。从利益大于感情开始，双方就不可能走向婚姻。,双方父母干涉太多了，影响了两个人判断能力。一听就知道，双方的耳根子都软，只是软在自己的父母，对彼此之间的感情并没有把控住。从利益大于感情开始，双方就不可能走向婚姻。,0.3594573740249155,1.0,0.6082192955788419
"我想结婚了嘿嘿
然后接下来
彩礼
婚房
车子
工作稳定
养活父母 还有父母
孩子养活得一个亿
去他妈的结婚，溜达溜达刻个墓碑一个人挺好[歪嘴]",我想结婚了嘿嘿 然后接下来 彩礼 婚房 车子 工作稳定 养活父母 还有父母 孩子养活得一个亿 去他妈的结婚，溜达溜达刻个墓碑一个人挺好,0.3594573740249155,1.0,0.6738260732194715
哈哈哈，谈了一年对方父母都见过了变成男闺蜜了,哈哈哈，谈了一年对方父母都见过了变成男闺蜜了,0.3594573740249155,1.0,0.5459166855756706
让我知道了三年的真心，戒指，订婚，双方父母见面，一起回老家，陪她治病，带她玩遍整个昆明这么多的一切原来真的比不上新鲜感。,让我知道了三年的真心，戒指，订婚，双方父母见面，一起回老家，陪她治病，带她玩遍整个昆明这么多的一切原来真的比不上新鲜感。,0.3594573740249155,1.0,0.6815007911490517
不结婚时对不起父母，结婚对不起自己，离婚对不起孩子,不结婚时对不起父母，结婚对不起自己，离婚对不起孩子,0.3594573740249155,1.0,0.5894809467929296
"相信大部分的人跟我都差不多
读初中要中考，高中又要高考，父母就说好好学习不要谈恋爱
读大学也经常说好好学习，读完大学之后父母又说快点结婚
父母是直接打破了能量守恒定律，女朋友会凭空出现一样的",相信大部分的人跟我都差不多 读初中要中考，高中又要高考，父母就说好好学习不要谈恋爱 读大学也经常说好好学习，读完大学之后父母又说快点结婚 父母是直接打破了能量守恒定律，女朋友会凭空出现一样的,0.3594573740249155,1.0,0.7238782528596754
结婚对象是家人父母的事，谈恋爱是自己和自己爱的人的事,结婚对象是家人父母的事，谈恋爱是自己和自己爱的人的事,0.3594573740249155,1.0,0.5710109833734311
抱抱。但至少你的故事里没有任何欺骗。而我:  那种高中时代一起陪伴成长的，他硕，我博。我高校教师，他自主创业。我知道创业的风险。所以在他买房的同一小区也买了一套，以后父母住，抵押贷款抵抗风险都用的上。他的婚房我也没要求加名，他家里最低首付，自己还贷。我父母心疼我，所以我自己那套是父母全款买的。车他一辆，我一辆。事业生活模式一步步都在按照我们读书时畅想那样发展。但是，直到20年10🈷️他摊牌，有个小一轮的小闺女怀孕🤰了。哈哈哈哈哈😄然后我才听到诸如“跟我在一起压力大啥的…………一些我不知道所谓善意谎言……我突然就不认识这个认识18年的“男人”了。而且甩锅，说我在同一小区买房不考虑他的感受。What？？？？所以，女孩子不要轻易陪伴一个男生成长…………,抱抱。但至少你的故事里没有任何欺骗。而我: 那种高中时代一起陪伴成长的，他硕，我博。我高校教师，他自主创业。我知道创业的风险。所以在他买房的同一小区也买了一套，以后父母住，抵押贷款抵抗风险都用的上。他的婚房我也没要求加名，他家里最低首付，自己还贷。我父母心疼我，所以我自己那套是父母全款买的。车他一辆，我一辆。事业生活模式一步步都在按照我们读书时畅想那样发展。但是，直到年🈷️他摊牌，有个小一轮的小闺女怀孕🤰了。哈哈哈哈哈😄然后我才听到诸如“跟我在一起压力大啥的…………一些我不知道所谓善意谎言……我突然就不认识这个认识年的“男人”了。而且甩锅，说我在同一小区买房不考虑他的感受。What？？？？所以，女孩子不要轻易陪伴一个男生成长…………,0.3594573740249155,1.0,1.0
"这张截图是我们刚一起听音乐的时候截的。12000公里，这个距离真的是...[无语]看到我的IP应该就不用怀疑真实性了。快乐还是挺快乐的，我对她生活没有任何隐瞒，可能只有过去的事还没怎么说。这个么...也许可以作为后备的话题在没有东西可聊的时候拿出一两件说说。
其实异地恋最难搞的不是对方，是对方的父母。如果对方的父母是管教很严的人，AKA控制欲强的人，那么异地恋就要有坎坷了。不管是当地还是异地，父母都是很大的阻碍，这点在视频中提及太少了，但确实国内普遍存在的问题。无论是教育差别、文化差别还是家境差别，如果对方父母觉得双方不搭的，那之后的感情就会很困难。所以啊，努力让自己变好，努力让双方变好，共同进步。只要大家的成就超过了双方父母，我不信他们还能左右我们的未来！[OK]突破桎梏，方得永恒。

（题外话：左边的二次元是我，头像是传说之下二创Glitchtale里的G爹和Jessica[doge]）",这张截图是我们刚一起听音乐的时候截的。公里，这个距离真的是...看到我的IP应该就不用怀疑真实性了。快乐还是挺快乐的，我对她生活没有任何隐瞒，可能只有过去的事还没怎么说。这个么...也许可以作为后备的话题在没有东西可聊的时候拿出一两件说说。 其实异地恋最难搞的不是对方，是对方的父母。如果对方的父母是管教很严的人，AKA控制欲强的人，那么异地恋就要有坎坷了。不管是当地还是异地，父母都是很大的阻碍，这点在视频中提及太少了，但确实国内普遍存在的问题。无论是教育差别、文化差别还是家境差别，如果对方父母觉得双方不搭的，那之后的感情就会很困难。所以啊，努力让自己变好，努力让双方变好，共同进步。只要大家的成就超过了双方父母，我不信他们还能左右我们的未来！突破桎梏，方得永恒。 （题外话：左边的二次元是我，头像是传说之下二创Glitchtale里的G爹和Jessica）,1.0,1.0,0.8040176376621337
可是我也有自己的追求，读完研想在自己喜欢的城市离父母近的地方安居，但是他不会来到我所在城市，而我也不想因为他去他所在的地方,可是我也有自己的追求，读完研想在自己喜欢的城市离父母近的地方安居，但是他不会来到我所在城市，而我也不想因为他去他所在的地方,0.3594573740249155,1.0,0.5367381577556574
"我只想说，父母有，兄弟姐妹有。男朋友只是其中一环。
    你会孤独不可能只是其中一环的问题。所谓的孤独，纯粹是吃饱了闲的。
     没人会把自己的生活全部用感情充满，大多数人都是说自己找个爱好。兴趣。工作。
      感到孤独你会想换男朋友，但是不会想换闺蜜。父母兄弟。这个概念。成年人了。多了解自己吧。",我只想说，父母有，兄弟姐妹有。男朋友只是其中一环。 你会孤独不可能只是其中一环的问题。所谓的孤独，纯粹是吃饱了闲的。 没人会把自己的生活全部用感情充满，大多数人都是说自己找个爱好。兴趣。工作。 感到孤独你会想换男朋友，但是不会想换闺蜜。父母兄弟。这个概念。成年人了。多了解自己吧。,0.3594573740249155,1.0,0.7592889978226147
"纸张，拥有自由恋爱的权力久了，竟然把包办婚姻的悲剧忘光了。
你想想包办婚姻为什么能成立？因为父母对子女有绝对的控、制、权！父母可以按他们的心意摆布你的终生大事，当然也可以操控你的各种小事，你会沦为父母的附属品，低父母一等。家庭中的等级观会卷土重来。
有些人居然认为，包办婚姻等于门当户对，太搞笑了。前面已经说过，包办婚姻下孩子是父母的物件，没有人格上的平等，那父母对孩子就不会像今天这样，尊重孩子、事事为孩子考虑。因此，父母在考虑子女婚姻时，会以自己的利益而不是子女的利益为先。门当户对？不如想法子把孩子塞给有钱人做小，这样还能多拿钱。
历史上，包办婚姻造成了大量不般配的夫妻。老夫少妻、童养媳、等郎媳大量存在。因为父母只是要传宗接代和有人为自己干活，至于你们两口子处得好不好，谁管呢。
觉得包办婚姻会让两口子互相忠诚的，是没读过书的。历史告诉我们，越是搞包办，男女关系就越混乱。人的本能，人的感情，是没法用不合意的婚姻束缚住的。越不合意，人越会出轨。
包办婚姻的本质，是强迫、控制、特权、等级！现在你们觉得所谓好的“包办婚姻”，根本就不是包办婚姻，只不过是你在自由恋爱中，更多地自愿地考虑了父母的意见。父母都没办法逼你扯证，这是哪门子包办。",纸张，拥有自由恋爱的权力久了，竟然把包办婚姻的悲剧忘光了。 你想想包办婚姻为什么能成立？因为父母对子女有绝对的控、制、权！父母可以按他们的心意摆布你的终生大事，当然也可以操控你的各种小事，你会沦为父母的附属品，低父母一等。家庭中的等级观会卷土重来。 有些人居然认为，包办婚姻等于门当户对，太搞笑了。前面已经说过，包办婚姻下孩子是父母的物件，没有人格上的平等，那父母对孩子就不会像今天这样，尊重孩子、事事为孩子考虑。因此，父母在考虑子女婚姻时，会以自己的利益而不是子女的利益为先。门当户对？不如想法子把孩子塞给有钱人做小，这样还能多拿钱。 历史上，包办婚姻造成了大量不般配的夫妻。老夫少妻、童养媳、等郎媳大量存在。因为父母只是要传宗接代和有人为自己干活，至于你们两口子处得好不好，谁管呢。 觉得包办婚姻会让两口子互相忠诚的，是没读过书的。历史告诉我们，越是搞包办，男女关系就越混乱。人的本能，人的感情，是没法用不合意的婚姻束缚住的。越不合意，人越会出轨。 包办婚姻的本质，是强迫、控制、特权、等级！现在你们觉得所谓好的“包办婚姻”，根本就不是包办婚姻，只不过是你在自由恋爱中，更多地自愿地考虑了父母的意见。父母都没办法逼你扯证，这是哪门子包办。,0.3594573740249155,1.0,0.7389353866465913
所以很多父母以此为借口，催婚逼婚，最后呢？这个视频本身是为了讽刺当今的廉价爱情，而不是那些父母催婚逼婚的借口。,所以很多父母以此为借口，催婚逼婚，最后呢？这个视频本身是为了讽刺当今的廉价爱情，而不是那些父母催婚逼婚的借口。,0.3594573740249155,1.0,0.6281438188365502
其实父母强制介入包办婚姻是违法的，但生活里到处都有这样的棒打鸳鸯的父母，如果另一半为了你足够强硬，那恭喜你，如果你的另一半选择顺从，和父母替你找的那个在一块了……这种事太考验感情了，借口千千万，唯有不变的真心的最可贵[笑],其实父母强制介入包办婚姻是违法的，但生活里到处都有这样的棒打鸳鸯的父母，如果另一半为了你足够强硬，那恭喜你，如果你的另一半选择顺从，和父母替你找的那个在一块了……这种事太考验感情了，借口千千万，唯有不变的真心的最可贵,0.3594573740249155,1.0,0.7726901321112156
[囧]真羡慕这种父母认识互相喜欢门当户对的人，但是绝大多数人都是要么喜欢，家庭差距大家里人不同意。或者家里喜欢，你不喜欢。这就是很多人单身的原因。能在一起的不喜欢，不能在一起的喜欢。毕竟爱情是奢侈品，就很少人能遇到。,真羡慕这种父母认识互相喜欢门当户对的人，但是绝大多数人都是要么喜欢，家庭差距大家里人不同意。或者家里喜欢，你不喜欢。这就是很多人单身的原因。能在一起的不喜欢，不能在一起的喜欢。毕竟爱情是奢侈品，就很少人能遇到。,0.3594573740249155,1.0,0.724085625191778
"小仙女身子都给你，孩子不是你的怎么就不行了 渣男！
 一看彩礼当初要的还是少了，所以姐妹们 结婚时 彩礼绝对不能少要 可不能让你们父母白养你啊！！[doge]",小仙女身子都给你，孩子不是你的怎么就不行了 渣男！ 一看彩礼当初要的还是少了，所以姐妹们 结婚时 彩礼绝对不能少要 可不能让你们父母白养你啊！！,0.3594573740249155,1.0,0.5844811397922794
希望对象能像父母一样爱你的先想想自己能不能像对方父母一样的爱他,希望对象能像父母一样爱你的先想想自己能不能像对方父母一样的爱他,0.3594573740249155,1.0,0.6290891114931574
父母:谁要你幸福，我们只要你交差,父母:谁要你幸福，我们只要你交差,0.0,0.4632039205553255,0.34337476389165655
父母说，没结婚他们的任务就没完成，哪怕先结婚了再离也行，只要结过就行[难过],父母说，没结婚他们的任务就没完成，哪怕先结婚了再离也行，只要结过就行,0.3594573740249155,1.0,0.5415084468520953
我和老公95后 高中同学 大一恋爱 毕业就结婚 一起读研。现在我们养了一只猫猫 房子在装修 离爸妈 公婆家都不远。我觉得结婚很棒，很大一部分原因是父母为我们提供了很多物质帮助，有各自父母做后盾，我们没有那么多经济压力，只用做自己就可以。哪怕离婚了，回到家依然是家里最爱的孩子，依然有自己的工作，房子，家人。 我的父母婚姻也很幸福，50多岁了天天一起遛狗 养猫。 爷爷奶奶也是 ，我爷爷给我奶奶做了一院子的健身器。 我本来以为我这种家庭很普通，但是上了大学和同学聊天才知道 他们的爸爸都不做家务，甚至会不让妈妈买太多新衣服。,我和老公后 高中同学 大一恋爱 毕业就结婚 一起读研。现在我们养了一只猫猫 房子在装修 离爸妈 公婆家都不远。我觉得结婚很棒，很大一部分原因是父母为我们提供了很多物质帮助，有各自父母做后盾，我们没有那么多经济压力，只用做自己就可以。哪怕离婚了，回到家依然是家里最爱的孩子，依然有自己的工作，房子，家人。 我的父母婚姻也很幸福，多岁了天天一起遛狗 养猫。 爷爷奶奶也是 ，我爷爷给我奶奶做了一院子的健身器。 我本来以为我这种家庭很普通，但是上了大学和同学聊天才知道 他们的爸爸都不做家务，甚至会不让妈妈买太多新衣服。,1.0,1.0,0.8485767885020441
我选择摄影和钓鱼，刚准备请女生吃饭，看着身边朋友送两千多的礼物还被阴阳了一顿，我赶紧给我的尼康换了个Z24—120的镜头，剩下的奖学金还能给父母换部手机[呲牙]，真开心,我选择摄影和钓鱼，刚准备请女生吃饭，看着身边朋友送两千多的礼物还被阴阳了一顿，我赶紧给我的尼康换了个Z—的镜头，剩下的奖学金还能给父母换部手机，真开心,0.3594573740249155,0.33622659986374615,0.36385725514564093
