comment,cleaned_comment,score1,score2,combined_score
跟人相处很难，跟一个人建立亲密关系更难。且不说虚无缥缈的爱情，和一个人签订契约过一生必然需要信任，理解，真诚和尊重，试问现在的小情侣有哪一对能真的做到这四点。,跟人相处很难，跟一个人建立亲密关系更难。且不说虚无缥缈的爱情，和一个人签订契约过一生必然需要信任，理解，真诚和尊重，试问现在的小情侣有哪一对能真的做到这四点。,0.3594573740249155,1.0,0.6185561908374113
找对象是真的难啊，想遇到一个真心实意喜欢，我也喜欢他的太难了,找对象是真的难啊，想遇到一个真心实意喜欢，我也喜欢他的太难了,0.3594573740249155,1.0,0.6659462741857862
这不是科幻片！！！[保卫萝卜_哭哭][保卫萝卜_哭哭]我和我初恋从初中谈到现在读大学，观念上真的和视频里说到的几乎一模一样，一直很稳定而且幸福[保卫萝卜_哭哭]平时看到身边那些随意且快餐式的恋爱方式是真的百思不得其解，但选择尊重,这不是科幻片！！！我和我初恋从初中谈到现在读大学，观念上真的和视频里说到的几乎一模一样，一直很稳定而且幸福平时看到身边那些随意且快餐式的恋爱方式是真的百思不得其解，但选择尊重,1.0,1.0,0.7190438960073293
我和我现在的男友三观都挺正的，他真的很好，把我从一个敏感自负的人给矫正回来了，我的初恋算上一个非常糟糕而且不健康的关系[Kizuna AI_嘤嘤嘤]，但是我的现任教会了我很多，之前我也感觉我自己配不上那么优秀的他，但是现在我觉得，我至少得去努力，哪怕最后真的会分开，但我也不会后悔[Kizuna AI _嗨多摩]，一段健康的恋爱关系真的很重要，真的很重要！,我和我现在的男友三观都挺正的，他真的很好，把我从一个敏感自负的人给矫正回来了，我的初恋算上一个非常糟糕而且不健康的关系，但是我的现任教会了我很多，之前我也感觉我自己配不上那么优秀的他，但是现在我觉得，我至少得去努力，哪怕最后真的会分开，但我也不会后悔，一段健康的恋爱关系真的很重要，真的很重要！,0.3594573740249155,1.0,0.6612896216075992
老师说的很对，老师说的那些我都经历过，一定要有自己的自我，谈恋爱不要恋爱脑，不要太过卑微，要带点理智。爱是双向和相互给予对方爱的反馈的，也希望更多妹子能看看，我身边真的有一些恋爱脑，还有觉得谈恋爱就应该无时无刻的在一起的，也有一些觉得想要恋爱先得给够一定的金钱才愿意恋爱的。找个共同进步的人真的很香，不仅双方可以互相促进对方成长，你也能在另一方学习到别人一些好的品质，哪怕以后因为一些原因可能不在一起了，但至少对事物的看法会变得成熟了。一个成熟的恋爱观真的很重要[拥抱],老师说的很对，老师说的那些我都经历过，一定要有自己的自我，谈恋爱不要恋爱脑，不要太过卑微，要带点理智。爱是双向和相互给予对方爱的反馈的，也希望更多妹子能看看，我身边真的有一些恋爱脑，还有觉得谈恋爱就应该无时无刻的在一起的，也有一些觉得想要恋爱先得给够一定的金钱才愿意恋爱的。找个共同进步的人真的很香，不仅双方可以互相促进对方成长，你也能在另一方学习到别人一些好的品质，哪怕以后因为一些原因可能不在一起了，但至少对事物的看法会变得成熟了。一个成熟的恋爱观真的很重要,0.3594573740249155,1.0,0.953346502266763
23岁牡丹真的好奇恋爱究竟是在谈什么，因为感觉自己一个人生活也没问题到现在都没起过谈恋爱的念头，但到时候被家人催现在就开始焦虑了。,岁牡丹真的好奇恋爱究竟是在谈什么，因为感觉自己一个人生活也没问题到现在都没起过谈恋爱的念头，但到时候被家人催现在就开始焦虑了。,0.3594573740249155,1.0,0.7029768204904094
真的要谈，不谈你根本不知道你在亲密关系中是什么样子，你以为那些道理你都懂，但是可能处理实际问题时你就会不知所措。谈了才能发现自身在亲密关系中的问题，但是不建议去乱谈，是真的喜欢才去谈,真的要谈，不谈你根本不知道你在亲密关系中是什么样子，你以为那些道理你都懂，但是可能处理实际问题时你就会不知所措。谈了才能发现自身在亲密关系中的问题，但是不建议去乱谈，是真的喜欢才去谈,0.3594573740249155,0.33622659986374615,0.3917524429565278
我从大学毕业谈的 现在已经谈了三年多了，所以不结婚真的耽误时间吗…我现在有点怀疑自己了[笑哭],我从大学毕业谈的 现在已经谈了三年多了，所以不结婚真的耽误时间吗…我现在有点怀疑自己了,0.3594573740249155,1.0,0.5368680144763317
真的很怕对方突然扯到结婚这个话题，我只想及时行乐也不想那么早就步入婚姻，但是他却那么认真那么着急，这种无形压力真的很累orz,真的很怕对方突然扯到结婚这个话题，我只想及时行乐也不想那么早就步入婚姻，但是他却那么认真那么着急，这种无形压力真的很累orz,0.3594573740249155,1.0,0.7791131668660571
告诉自己不谈恋爱，也不是真的不谈，就是表面不谈，在等一个人，等一个让我会有想和她谈恋爱的人，我谈恋爱是因为你，而不是因为孤独或者单纯的为了恋爱而恋爱。,告诉自己不谈恋爱，也不是真的不谈，就是表面不谈，在等一个人，等一个让我会有想和她谈恋爱的人，我谈恋爱是因为你，而不是因为孤独或者单纯的为了恋爱而恋爱。,0.3594573740249155,1.0,0.5948249153632582
母单谈恋爱是真的难，遇到心动的人很容易退缩，然后就错过了[囧],母单谈恋爱是真的难，遇到心动的人很容易退缩，然后就错过了,0.3594573740249155,0.33622659986374615,0.3278679102432041
我真的和up一样一样的[无语]但目前我还单身，中间有谈过不算恋爱的恋爱，后来只要一到那些男生开始对我表示明确的好感的时候，我就开始想逃……就感觉很有压力，感觉自己的生活会被打乱（其实并没有什么规律的生活）[无语]被家里人逼着也有去相亲，相完回来更认定自己可能要单身一辈子了，是真的聊不来啊[大哭]现在是想恋爱了，但是真的好难遇到，有想脱单的男孩子可以看过来嘛（自己给自己相亲）[脱单doge],我真的和up一样一样的但目前我还单身，中间有谈过不算恋爱的恋爱，后来只要一到那些男生开始对我表示明确的好感的时候，我就开始想逃……就感觉很有压力，感觉自己的生活会被打乱（其实并没有什么规律的生活）被家里人逼着也有去相亲，相完回来更认定自己可能要单身一辈子了，是真的聊不来啊现在是想恋爱了，但是真的好难遇到，有想脱单的男孩子可以看过来嘛（自己给自己相亲）,0.3594573740249155,1.0,0.7978299552710761
母单想找个母单，但是男生母单真的太少了，何况我日常就见不到男的，又相信感觉相信缘分，最近被催到注册交友app，事实证明划来划去的真的不适合我这种相信命中注定的人,母单想找个母单，但是男生母单真的太少了，何况我日常就见不到男的，又相信感觉相信缘分，最近被催到注册交友app，事实证明划来划去的真的不适合我这种相信命中注定的人,0.3594573740249155,0.4320558161628193,0.48787928051965357
对啊  年纪轻轻不要动不动就说结婚  勇敢去爱 享受当下  合得来时机成熟了  结婚是自然而然的事情啊！（真的很讨厌“适合结婚“这一说）,对啊 年纪轻轻不要动不动就说结婚 勇敢去爱 享受当下 合得来时机成熟了 结婚是自然而然的事情啊！（真的很讨厌“适合结婚“这一说）,0.3594573740249155,1.0,0.6282500197934276
我觉得如果遇到一个我喜欢的人，同时他又喜欢我，而且他还主动追我，然后相处也很好，真的很不容易的，这就是缘分，有太多都是有缘无分。如果这样，还不如一开始就不谈。真正有缘分的人在一起，应该好好珍惜。,我觉得如果遇到一个我喜欢的人，同时他又喜欢我，而且他还主动追我，然后相处也很好，真的很不容易的，这就是缘分，有太多都是有缘无分。如果这样，还不如一开始就不谈。真正有缘分的人在一起，应该好好珍惜。,0.3594573740249155,1.0,0.7382091786498544
真的很相信因果，例如我读书没读到没学历那就工资低，这就是因果，所以我就想如果我贫穷没用如果结婚肯定也是物以类聚又嫁穷人生出一个穷孩，这种日子是百分百的。所以就要杜绝，不要跟那些随便生孩子又拿孩子出来卖惨天天在小红书要人捐钱捐衣服。即使有钱也不能捐给那些人,真的很相信因果，例如我读书没读到没学历那就工资低，这就是因果，所以我就想如果我贫穷没用如果结婚肯定也是物以类聚又嫁穷人生出一个穷孩，这种日子是百分百的。所以就要杜绝，不要跟那些随便生孩子又拿孩子出来卖惨天天在小红书要人捐钱捐衣服。即使有钱也不能捐给那些人,0.3594573740249155,0.33622659986374615,0.4004031301094109
我感觉这20段&#34;恋爱&#34;顶多算是20次深入接触吧。。。真的被爱时不会天天想着换的。。。,我感觉这段&#;恋爱&#;顶多算是次深入接触吧。。。真的被爱时不会天天想着换的。。。,0.3594573740249155,1.0,0.6719925982209268
反正结不结婚都要赚钱，顺其自然吧，真的不是每个人都能扮演好丈夫一角色,反正结不结婚都要赚钱，顺其自然吧，真的不是每个人都能扮演好丈夫一角色,0.3594573740249155,1.0,0.7489637155502495
竹竹我真的觉得可以多出一点双方家庭相处或者情感方面的视频，觉得之前看竹竹疫情那篇视频，就感觉你们家的人都很温暖很善解人意，所以感觉竹竹的内核也很稳定，处理问题的角度能给我们有很多启发。当我听到鼻涕纸可以扔在地上，其实先是一惊，然后想起我生病的时候，被嫌弃为啥会生病给我爸他添麻烦，在医院大庭广众羞辱我，我发着高烧一个人逃出医院躲起来。加上其实我妈去世的早，我甚至不知道母爱是什么感受的。真的不知道原来生病可以被这样照顾。其实很多像我一样原生家庭问题很尖锐的情况也很多，没见过或者都不知道正常的相处模式是什么样的。所以我一开始与人接触也很扭曲，让人不舒适，是那个只会索取能量的人，只能自己一步一步摸索。但我很想多了解一点正常的相处模式，与家人、朋友、对象的相处方式，希望竹竹能多出类似的视频。,竹竹我真的觉得可以多出一点双方家庭相处或者情感方面的视频，觉得之前看竹竹疫情那篇视频，就感觉你们家的人都很温暖很善解人意，所以感觉竹竹的内核也很稳定，处理问题的角度能给我们有很多启发。当我听到鼻涕纸可以扔在地上，其实先是一惊，然后想起我生病的时候，被嫌弃为啥会生病给我爸他添麻烦，在医院大庭广众羞辱我，我发着高烧一个人逃出医院躲起来。加上其实我妈去世的早，我甚至不知道母爱是什么感受的。真的不知道原来生病可以被这样照顾。其实很多像我一样原生家庭问题很尖锐的情况也很多，没见过或者都不知道正常的相处模式是什么样的。所以我一开始与人接触也很扭曲，让人不舒适，是那个只会索取能量的人，只能自己一步一步摸索。但我很想多了解一点正常的相处模式，与家人、朋友、对象的相处方式，希望竹竹能多出类似的视频。,0.3594573740249155,1.0,0.9410347970052291
我只想脱贫不想脱单，一个阿姨四十多岁没结婚在北京有房有车有存款，长辈都说不结婚生小孩就没价值不幸福，赚再多钱都没用，但我真的好羡慕这种生活，我的梦想是有一个属于自己的房子，一个只属于自己的家,我只想脱贫不想脱单，一个阿姨四十多岁没结婚在北京有房有车有存款，长辈都说不结婚生小孩就没价值不幸福，赚再多钱都没用，但我真的好羡慕这种生活，我的梦想是有一个属于自己的房子，一个只属于自己的家,0.3594573740249155,1.0,0.6876064956351358
上海女生怎么会嫁给外地人，真的有点难以相信,上海女生怎么会嫁给外地人，真的有点难以相信,0.3594573740249155,1.0,0.5389116708129376
"我倒是希望女生只是高攀金钱，学历之类的。那样我就能找到好多女孩儿了。
奈何她们还要颜值，要身高，要家庭背景，要性格温柔无条件宠溺，有责任心，有上进心，家务全包，彩礼三金，买房买车。
我可以很努力呀，但是颜值和身高真的没办法呀[大哭][大哭][大哭]所以果然我还是单着吧，一个人过也挺好的。",我倒是希望女生只是高攀金钱，学历之类的。那样我就能找到好多女孩儿了。 奈何她们还要颜值，要身高，要家庭背景，要性格温柔无条件宠溺，有责任心，有上进心，家务全包，彩礼三金，买房买车。 我可以很努力呀，但是颜值和身高真的没办法呀所以果然我还是单着吧，一个人过也挺好的。,0.3594573740249155,1.0,0.6514224452089326
吃饭约会看电影之类的吧，礼物真的要看个人了。一直有个疑问，214送礼314回应，这一个月等的不急死个人吗[惊讶]我选择当场处决来个痛快[OK],吃饭约会看电影之类的吧，礼物真的要看个人了。一直有个疑问，送礼回应，这一个月等的不急死个人吗我选择当场处决来个痛快,0.3594573740249155,1.0,0.7019157376133629
别说找对象了，就算交朋友都一定要找个共情能力强的人，有些事虽然做不到感同身受，但是至少会真的努力的换位思考，试着理解你发自内心的心疼你。,别说找对象了，就算交朋友都一定要找个共情能力强的人，有些事虽然做不到感同身受，但是至少会真的努力的换位思考，试着理解你发自内心的心疼你。,0.3594573740249155,1.0,0.7538511574000117
不给花钱是真的很伤人心，我没谈过恋爱，但是我家穷，除了吃穿住行，学费，必需用品之类的，我妈在我身上付出不到五百把，电脑自己打工挣得，父母可能贴了一些 但是我计算机系的 应该算必需里边把 我拿出来不算。手机自己买的便宜货。我也跟我老妈仔细谈过了，我是真知道穷，但是前段时间又老说自己有钱[捂脸]我知道是觉得我自卑 觉得家里没钱所以不敢谈恋爱，然后那段时间真的很伤心。索性开学前跟老妈谈了一次心，都解释清楚了 那天我三点半睡着 我妈两点多才睡着。第二天开学走人 恢复正常。,不给花钱是真的很伤人心，我没谈过恋爱，但是我家穷，除了吃穿住行，学费，必需用品之类的，我妈在我身上付出不到五百把，电脑自己打工挣得，父母可能贴了一些 但是我计算机系的 应该算必需里边把 我拿出来不算。手机自己买的便宜货。我也跟我老妈仔细谈过了，我是真知道穷，但是前段时间又老说自己有钱我知道是觉得我自卑 觉得家里没钱所以不敢谈恋爱，然后那段时间真的很伤心。索性开学前跟老妈谈了一次心，都解释清楚了 那天我三点半睡着 我妈两点多才睡着。第二天开学走人 恢复正常。,0.3594573740249155,0.4320558161628193,0.5831596489513576
男女思维差异真的很大。真的就是曲曲说的那样的，男的都觉得不需要再沟通了，女的还想沟通[doge],男女思维差异真的很大。真的就是曲曲说的那样的，男的都觉得不需要再沟通了，女的还想沟通,0.3594573740249155,1.0,0.698365781590153
？？？ 这次真的不能认同桃大，并不是什么事情都是能够以结果为导向的，最终没有走到一起不代表开始就是不应该的，年轻的时候不去经历去感受，什么时候去呢？？只有功成名就才是人生的终极目标嘛？人是目的而非手段,？？？ 这次真的不能认同桃大，并不是什么事情都是能够以结果为导向的，最终没有走到一起不代表开始就是不应该的，年轻的时候不去经历去感受，什么时候去呢？？只有功成名就才是人生的终极目标嘛？人是目的而非手段,0.3594573740249155,0.33622659986374615,0.4715162213592495
不同意 大学应该尽量能去谈恋爱 但是不提倡为了恋爱要死要活 该分手该考研就果断 不要拉拉扯扯 人生体验真的很宝贵,不同意 大学应该尽量能去谈恋爱 但是不提倡为了恋爱要死要活 该分手该考研就果断 不要拉拉扯扯 人生体验真的很宝贵,0.3594573740249155,1.0,0.5307301196627316
"我最近真的在想这些事情[笑哭]
母胎单身，大学快毕业了[笑哭]",我最近真的在想这些事情 母胎单身，大学快毕业了,1.0,1.0,0.6735126692631763
"感觉现在大学生谈一场正真恋爱，真的不容易～
漂亮的有，帅气的有，
但合适的少～",感觉现在大学生谈一场正真恋爱，真的不容易～ 漂亮的有，帅气的有， 但合适的少～,0.3594573740249155,1.0,0.5898784346844369
就应该是这样，现代的那种快餐式恋爱我真的看不懂，感觉不尊重自己也不尊重别人,就应该是这样，现代的那种快餐式恋爱我真的看不懂，感觉不尊重自己也不尊重别人,0.3594573740249155,1.0,0.6597364086935756
"什么社团什么协会什么组织 可以去玩一年
但真的不建议不建议不建议留任
甚至我觉得这段经历并不会给你的简历
增添什么有效内容或者怎样 
康康说的双向奔赴真的很重要 爱情友情都是
得不到回应的热情要适可而止啦
自己一个人也可以过得高高兴兴的
多去做自己喜欢的 找自己喜欢的事情去做～
这个很重要 关系到自己以后的方向吧
最后但同样重要的是 
好好学习",什么社团什么协会什么组织 可以去玩一年 但真的不建议不建议不建议留任 甚至我觉得这段经历并不会给你的简历 增添什么有效内容或者怎样 康康说的双向奔赴真的很重要 爱情友情都是 得不到回应的热情要适可而止啦 自己一个人也可以过得高高兴兴的 多去做自己喜欢的 找自己喜欢的事情去做～ 这个很重要 关系到自己以后的方向吧 最后但同样重要的是 好好学习,0.3594573740249155,0.33622659986374615,0.32204304642911424
所以到底怎么谈的啊，我感觉突然和一个陌生人建立起亲密关系真的好难啊，看别人认识几天都能成，我感觉我认识个新朋友都好难，而且同性还好，异性真的太难了说啥都尴尬[笑哭][笑哭],所以到底怎么谈的啊，我感觉突然和一个陌生人建立起亲密关系真的好难啊，看别人认识几天都能成，我感觉我认识个新朋友都好难，而且同性还好，异性真的太难了说啥都尴尬,0.3594573740249155,1.0,0.7044832902006657
宁缺毋滥真的，不理解那种快餐式恋爱，就感觉很随便，为了恋爱而恋爱，好像周围人谈了，自己不谈没面子不合群一样，真的是很浪费感情，也不珍惜自己的行为。,宁缺毋滥真的，不理解那种快餐式恋爱，就感觉很随便，为了恋爱而恋爱，好像周围人谈了，自己不谈没面子不合群一样，真的是很浪费感情，也不珍惜自己的行为。,0.3594573740249155,1.0,0.7116697886717547
很难抛开自己的欲望去想是不是真的喜欢她，抛开了之后觉得好像并不是真正的喜欢,很难抛开自己的欲望去想是不是真的喜欢她，抛开了之后觉得好像并不是真正的喜欢,0.3594573740249155,1.0,0.6644687842906157
正真的爱情，不是追求，而是等待。当你提升自我到一定高度，一切都将水到渠成。,正真的爱情，不是追求，而是等待。当你提升自我到一定高度，一切都将水到渠成。,0.3594573740249155,1.0,0.681251844887311
挺烦舔狗这个词的，这个词其实只存在美女身边，像我这种长的一般的母单根本就不会有所谓的舔狗，就算有也很可能被抛弃，只有提前消灭对爱情的渴望才不会伤害自己，好好提高能力才是真的，能知世故不世故最好,挺烦舔狗这个词的，这个词其实只存在美女身边，像我这种长的一般的母单根本就不会有所谓的舔狗，就算有也很可能被抛弃，只有提前消灭对爱情的渴望才不会伤害自己，好好提高能力才是真的，能知世故不世故最好,0.3594573740249155,1.0,0.8485034084058504
27岁之后，真的很难心动，对婚姻的考虑也添加了很多附加条件,岁之后，真的很难心动，对婚姻的考虑也添加了很多附加条件,0.40159477065724175,1.0,0.5900691949097663
我只说一个：结婚一定要找吵架时愿意退一步的人，然后真的吵架时，你也要随时做好退一步的准备。,我只说一个：结婚一定要找吵架时愿意退一步的人，然后真的吵架时，你也要随时做好退一步的准备。,0.3594573740249155,1.0,0.5757958199735445
"姐姐们都太优秀了，这期真的一直在听故事听观点，卧底什么的已经不重要了[打call-圣诞]
另外，作为一个gay，我确实很想报名gay圈狼人杀，但是。。。完全找不到可以独处的时间和空间[捂脸-圣诞][捂脸-圣诞]",姐姐们都太优秀了，这期真的一直在听故事听观点，卧底什么的已经不重要了 另外，作为一个gay，我确实很想报名gay圈狼人杀，但是。。。完全找不到可以独处的时间和空间,0.3594573740249155,0.19541385856867788,0.284600367525368
赞同，不比较那个事真的做不到，顶多只能做到尽量发现苗条就忍住不去想，然而没男人给我实践🤷,赞同，不比较那个事真的做不到，顶多只能做到尽量发现苗条就忍住不去想，然而没男人给我实践🤷,0.40159477065724175,1.0,0.6401645414561097
是的，其实要让男人融入到生活，了解其中心酸。这很重要。说实话，你在对他奉献的同时，也要让他看到你的功劳。默默无闻真的没啥用。刷刷存在感,是的，其实要让男人融入到生活，了解其中心酸。这很重要。说实话，你在对他奉献的同时，也要让他看到你的功劳。默默无闻真的没啥用。刷刷存在感,0.3594573740249155,1.0,0.7008125826605613
已婚人士可能会很有共鸣，但未婚人士看过之后对婚姻对配偶也会有更多思考，人真的是复杂的动物，就算一开始觉得选择了像是对的那个人，但是不和那人一起生活过的话也不能真正了解他的为人。,已婚人士可能会很有共鸣，但未婚人士看过之后对婚姻对配偶也会有更多思考，人真的是复杂的动物，就算一开始觉得选择了像是对的那个人，但是不和那人一起生活过的话也不能真正了解他的为人。,0.3594573740249155,1.0,0.7313654038119568
真的会遇到相互喜欢的人吗我也一直想问 我总觉得这是偶像剧情节[笑哭],真的会遇到相互喜欢的人吗我也一直想问 我总觉得这是偶像剧情节,0.3594573740249155,1.0,0.7521367905522495
谢谢阿思回答了我的所有问题！上周小论文接收了（领域顶刊），然后沉浸于搞学业的快乐，一点都不纠结结婚了哈哈哈，真的是一阵儿一阵儿的想法[笑哭],谢谢阿思回答了我的所有问题！上周小论文接收了（领域顶刊），然后沉浸于搞学业的快乐，一点都不纠结结婚了哈哈哈，真的是一阵儿一阵儿的想法,0.3594573740249155,0.33622659986374615,0.3710311451290303
大哥真实了，结婚后真的鸡毛蒜皮，洗衣服，做饭，搞卫生，买菜，双方亲戚赶人情，有个病有个灾的都得去看下，家里买东西……就然后你还得上班焦头烂额的，不要几年，几个月，那种风花雪月的感情全部磨没，有时候吵架都懒得吵，亲戚朋友有2个已经离婚了……有时候想想真不怪那些有钱人出轨的。另:我现在真的好喜欢神木麗,大哥真实了，结婚后真的鸡毛蒜皮，洗衣服，做饭，搞卫生，买菜，双方亲戚赶人情，有个病有个灾的都得去看下，家里买东西……就然后你还得上班焦头烂额的，不要几年，几个月，那种风花雪月的感情全部磨没，有时候吵架都懒得吵，亲戚朋友有个已经离婚了……有时候想想真不怪那些有钱人出轨的。另:我现在真的好喜欢神木麗,0.3594573740249155,1.0,0.7433399866334507
现代社会婚姻真的是件很糟糕的买卖啊，自己赚钱自己花他不香吗？,现代社会婚姻真的是件很糟糕的买卖啊，自己赚钱自己花他不香吗？,0.3594573740249155,1.0,0.7496821124388479
