comment,cleaned_comment,score1,score2,combined_score
"今年年初刚来个女同事，一开始没有在意她。我空窗期太长了，现在20多岁了，只谈过一个女朋友。但是从七月初开始我俩就开始聊起来了，都是她主动找我，互相分享，互相聊天可以到晚上12点，也出来一起玩过，简直是暧昧关系。但是从八月中旬开始，渐渐没什么话可以聊了，但是我却发现好像喜欢上她了，但是我变成了主动的那个人，她也可能发觉我喜欢她了，有时候好长时间才回我消息，也不主动发消息了。但是我好像真的真的喜欢上他了，但是她却失去热情了好像，我感觉是不是我错过了表白的机会，还是人生三大错觉之一“她喜欢我”人家只是一开始把我当做一个分享的人。
每天看她和别的同事有说有笑，我真的心里很难受。都影响到了工作。成了我精神内耗的最大因素。
但是却不知道怎么办
有时候才发现是不是只有我这样，新鲜过后，和朋友再也不是无话不说，而且无话可说
有时候我只是需要一个可以听我絮叨的人，一个给我絮叨的人，想一下世界上两个人可以互相絮叨在我看来真的才是真的浪漫。
但是我现在好像逐渐失去了她，她成功吸引了我的兴趣，而我在兴趣达到峰值时，她却转身离开，留下我一人",今年年初刚来个女同事，一开始没有在意她。我空窗期太长了，现在多岁了，只谈过一个女朋友。但是从七月初开始我俩就开始聊起来了，都是她主动找我，互相分享，互相聊天可以到晚上点，也出来一起玩过，简直是暧昧关系。但是从八月中旬开始，渐渐没什么话可以聊了，但是我却发现好像喜欢上她了，但是我变成了主动的那个人，她也可能发觉我喜欢她了，有时候好长时间才回我消息，也不主动发消息了。但是我好像真的真的喜欢上他了，但是她却失去热情了好像，我感觉是不是我错过了表白的机会，还是人生三大错觉之一“她喜欢我”人家只是一开始把我当做一个分享的人。 每天看她和别的同事有说有笑，我真的心里很难受。都影响到了工作。成了我精神内耗的最大因素。 但是却不知道怎么办 有时候才发现是不是只有我这样，新鲜过后，和朋友再也不是无话不说，而且无话可说 有时候我只是需要一个可以听我絮叨的人，一个给我絮叨的人，想一下世界上两个人可以互相絮叨在我看来真的才是真的浪漫。 但是我现在好像逐渐失去了她，她成功吸引了我的兴趣，而我在兴趣达到峰值时，她却转身离开，留下我一人,0.3594573740249155,1.0,0.8551693593075523
太感触了。和前女友在一起四年，最后却因为看不到未来的异地而分开。能遇到过一个可以分享一切的人真的很幸福。,太感触了。和前女友在一起四年，最后却因为看不到未来的异地而分开。能遇到过一个可以分享一切的人真的很幸福。,0.3594573740249155,1.0,0.6339184044079572
真实啊，两个人的三观是否同频真的很重要[思考],真实啊，两个人的三观是否同频真的很重要,0.3594573740249155,1.0,0.7194362649566811
结婚真的得在意对方家庭条件吗,结婚真的得在意对方家庭条件吗,0.3594573740249155,1.0,0.6017182524289003
我这连网恋都被拒，甚至连微信都要不到，她连我什么样什么条件都不知道，就因为我主动追她，直接就pass掉，一点机会都不给[大哭]我真的快要气死了,我这连网恋都被拒，甚至连微信都要不到，她连我什么样什么条件都不知道，就因为我主动追她，直接就pass掉，一点机会都不给我真的快要气死了,0.3594573740249155,1.0,0.7203978375444684
鸡汤永远不可能变成良药，在这个快节奏生活里，不会真的以为那个对的人在未来等你吧，幸福还是要去争取，要知道自己真正想要的是什么，是短暂的新鲜感，还是想要一生的陪伴，勇敢去追寻，用心去感受，每个人都能找到心目中的另一半[doge],鸡汤永远不可能变成良药，在这个快节奏生活里，不会真的以为那个对的人在未来等你吧，幸福还是要去争取，要知道自己真正想要的是什么，是短暂的新鲜感，还是想要一生的陪伴，勇敢去追寻，用心去感受，每个人都能找到心目中的另一半,0.3594573740249155,1.0,0.7670513875711232
太认同了！之前的一段恋爱就是因为孤独寂寞所以随便抓住一个人就谈  谈的一团糟 以前认为真的爱 后面慢慢长大才发现是自己太孤独了,太认同了！之前的一段恋爱就是因为孤独寂寞所以随便抓住一个人就谈 谈的一团糟 以前认为真的爱 后面慢慢长大才发现是自己太孤独了,0.3594573740249155,1.0,0.7043983300871562
"太强了，这样能从头至尾分析cp的视频真的非常少见。
伴随着up的讲述，仿佛又跟着看了一遍鲁鲁修，找到了当年的那份感动，十年前为两位如痴如狂的时刻。
LC也是我二十年来见过最高最美的爱情，它胜过爱情，但又升华了爱情这个词汇，哪怕过了不知多少年，这份感动永远不会忘怀。",太强了，这样能从头至尾分析cp的视频真的非常少见。 伴随着up的讲述，仿佛又跟着看了一遍鲁鲁修，找到了当年的那份感动，十年前为两位如痴如狂的时刻。 LC也是我二十年来见过最高最美的爱情，它胜过爱情，但又升华了爱情这个词汇，哪怕过了不知多少年，这份感动永远不会忘怀。,0.3594573740249155,1.0,0.7013094689357482
"男:生气了吗？
女:没生气
正常人都会觉得对方目前不需要你吧，真的没生气，那没你事。假的那就你生气还说没生气，那就是不想我安慰你，我还自讨没趣?明明自己的问题，总怪对方。直率的表达才是最好的",男:生气了吗？ 女:没生气 正常人都会觉得对方目前不需要你吧，真的没生气，那没你事。假的那就你生气还说没生气，那就是不想我安慰你，我还自讨没趣?明明自己的问题，总怪对方。直率的表达才是最好的,0.3594573740249155,1.0,0.799540364440605
还是不想，真的，我没那个好命遇到不错的男人，又特别爱自由，婚姻的操心和琐碎能让我疯[笑哭],还是不想，真的，我没那个好命遇到不错的男人，又特别爱自由，婚姻的操心和琐碎能让我疯,0.3594573740249155,1.0,0.6936952933327871
真的相亲了十几次，遇到好几个电视剧洗脑的，聊不进去。还有几个年轻的，玩游戏特起劲，根本聊不来。就几个真正的谈下去,真的相亲了十几次，遇到好几个电视剧洗脑的，聊不进去。还有几个年轻的，玩游戏特起劲，根本聊不来。就几个真正的谈下去,0.3594573740249155,1.0,0.7865814575869181
感谢老师，我好像对以前的恋爱关系为啥会分手更清晰了。原来我潜意识里真的意识到了，只是表意识没捅破。,感谢老师，我好像对以前的恋爱关系为啥会分手更清晰了。原来我潜意识里真的意识到了，只是表意识没捅破。,0.3594573740249155,1.0,0.7227213244233235
"我特别想询问一下视频弹幕/评论一个问题。

在一个剖析“具有太强责任感男人”的视频里，为什么会一直搁那攻击这种男人怎么样怎么样？你真的看懂这个视频了么？

第一，有很强责任感=负责任？
这两者强关联？
举个例子，我觉得你是个nt=你真的是个nt？
第二，不同人对责任理解不同。
你对“负责任”的理解就一定是✓的？
第三，视频内容
目标人群是针对“责任感强”的男性，是针对他们的心理行为剖析。
没有任何人是完美的，所以这个视频指出来他们的问题、可能的原因，以及这部分人和女生应该怎么改进。

我就纳了闷了，那些上来就攻击这种男的不负责；最后都是女的错的。
您到底什么智力水平？
能不能公开一下你的年龄，学历，感情婚姻生活，让大家了解和学习一下？
（btw，b站能挂学历了谢谢）
一个视频主题都读不懂，搁这大放厥词谈感情，你们这群人好意思，“配”聊情感问题？",我特别想询问一下视频弹幕/评论一个问题。 在一个剖析“具有太强责任感男人”的视频里，为什么会一直搁那攻击这种男人怎么样怎么样？你真的看懂这个视频了么？ 第一，有很强责任感=负责任？ 这两者强关联？ 举个例子，我觉得你是个nt=你真的是个nt？ 第二，不同人对责任理解不同。 你对“负责任”的理解就一定是✓的？ 第三，视频内容 目标人群是针对“责任感强”的男性，是针对他们的心理行为剖析。 没有任何人是完美的，所以这个视频指出来他们的问题、可能的原因，以及这部分人和女生应该怎么改进。 我就纳了闷了，那些上来就攻击这种男的不负责；最后都是女的错的。 您到底什么智力水平？ 能不能公开一下你的年龄，学历，感情婚姻生活，让大家了解和学习一下？ （btw，b站能挂学历了谢谢） 一个视频主题都读不懂，搁这大放厥词谈感情，你们这群人好意思，“配”聊情感问题？,0.3594573740249155,0.33622659986374615,0.5424846919502171
大龄单身的我看的开始有点慌了，慌了之后又开始很迷茫，不知道该怎么办！觉得人这一生来到这个世界上真的是来受苦的！,大龄单身的我看的开始有点慌了，慌了之后又开始很迷茫，不知道该怎么办！觉得人这一生来到这个世界上真的是来受苦的！,0.3594573740249155,1.0,0.5382023288084277
如果要走入亲密关系，甚至结婚，还是要趁早。因为真的会随着年龄增长，就越来越没有勇气，不想走入那些纷繁复杂的关系了。,如果要走入亲密关系，甚至结婚，还是要趁早。因为真的会随着年龄增长，就越来越没有勇气，不想走入那些纷繁复杂的关系了。,0.3594573740249155,1.0,0.6029277106612789
无论我们最后生疏成什么样子，曾经对你的好都是真的，希望你也不后悔认识我，也真的快乐过，就算终有一散，也别辜负相遇，如果选择重新来过，我选择不认识你，不是因为不想认识你，而是因为我不能面对现在的结局，再见，再也不相见。,无论我们最后生疏成什么样子，曾经对你的好都是真的，希望你也不后悔认识我，也真的快乐过，就算终有一散，也别辜负相遇，如果选择重新来过，我选择不认识你，不是因为不想认识你，而是因为我不能面对现在的结局，再见，再也不相见。,0.3594573740249155,1.0,0.8215197544091317
是的！不要谈恋爱真的太浪费时间了，只会不停的吃亏走弯路,是的！不要谈恋爱真的太浪费时间了，只会不停的吃亏走弯路,0.3594573740249155,1.0,0.5451303781580761
"回避型来学习了[给心心]
回避型是真的容易躲着问题，时不时就想静静，然后静静的这段时间，就足够焦虑型脑补出一场大戏了[tv_笑哭]",回避型来学习了 回避型是真的容易躲着问题，时不时就想静静，然后静静的这段时间，就足够焦虑型脑补出一场大戏了,0.40159477065724175,0.33622659986374615,0.301512586034476
"我一边看一边爆哭😭😭😭
最近因为分手了又深深的陷入了对自己的否定中，up 真的好懂焦虑型的人，有被哄好[笑哭]",我一边看一边爆哭😭😭😭 最近因为分手了又深深的陷入了对自己的否定中，up 真的好懂焦虑型的人，有被哄好,0.3594573740249155,1.0,0.5736827068408044
hhhh我跟我男友一起看黄片，我们比较相似而且包容对方，所以我们很少立规矩，大家本来就喜欢对方的样子了，所以不需要那么多条条框框。另外Blake的视频真的很有趣，你也很有人格魅力，不知道为什么这么久还没有火起来，明明真的做得很用心视频质量也很不错。可能还差一点时机吧。但是你真的很独特，无论是说话的语音语调还是视频制作的风格、选题之类的，我关注上千个up，你是让我印象最深的up之一。,hhhh我跟我男友一起看黄片，我们比较相似而且包容对方，所以我们很少立规矩，大家本来就喜欢对方的样子了，所以不需要那么多条条框框。另外Blake的视频真的很有趣，你也很有人格魅力，不知道为什么这么久还没有火起来，明明真的做得很用心视频质量也很不错。可能还差一点时机吧。但是你真的很独特，无论是说话的语音语调还是视频制作的风格、选题之类的，我关注上千个up，你是让我印象最深的up之一。,0.3594573740249155,0.4632039205553255,0.5666315866340923
"上一段感情很累，互相的要求都没办法做到，每天都在互相折磨，他需要自己的空间，我需要陪伴，我尝试过妥协，换来的只是更大的心理不平衡，最终一次次爆发无果，知道真的不合适，分了。
分手换了一个合适的人以后，生活一下子美好了。性格，生活习惯合适，从吃穿到各种需求都能互相满足，最重要的是我们都愿意包容对方，我不用再一个人承受所有。前所未有的轻松愉悦，我谈了很多次都没有过的感觉。
所以我现在深深地觉得，就是人的相性问题。适合与不适合，差异真的太大了。有的错的人，哪怕约定好了，他也不一定会做到的。",上一段感情很累，互相的要求都没办法做到，每天都在互相折磨，他需要自己的空间，我需要陪伴，我尝试过妥协，换来的只是更大的心理不平衡，最终一次次爆发无果，知道真的不合适，分了。 分手换了一个合适的人以后，生活一下子美好了。性格，生活习惯合适，从吃穿到各种需求都能互相满足，最重要的是我们都愿意包容对方，我不用再一个人承受所有。前所未有的轻松愉悦，我谈了很多次都没有过的感觉。 所以我现在深深地觉得，就是人的相性问题。适合与不适合，差异真的太大了。有的错的人，哪怕约定好了，他也不一定会做到的。,0.3594573740249155,1.0,0.84297505231908
"我是希望自己心动了再谈，因为不心动所以对方做什么都无法打动我。
上次在广州地铁遇到个让我特别心动的男生，就感觉自己单身二十多年的心脏活过来了，我是个不怎么主动的人，也很社恐，在终点站鼓起勇气等大家都下车了再和他要微信，第一次没听清但看他摆手拒绝了，我很我失落，但想了想还是不想放弃，再次鼓起勇气问他：真的不可以加微信吗？这时我才听清楚他说的是：不好意思我有女朋友了。
轰的一下脑子懵懵的，我的脸一下子发热爆红！！[热]幸好戴着口罩。我立马跑到了另一个站台，为自己刚刚的行为感到羞耻和尴尬，看着地铁门上倒影着自己，想着是不是自己不够瘦，是不是自己不够好看，是不是自己穿的很普通，想着想着就哭了，真的很尴尬，在人挤人的3号线偷偷哭，还好戴着眼睛口罩没人发现[大笑][大笑]",我是希望自己心动了再谈，因为不心动所以对方做什么都无法打动我。 上次在广州地铁遇到个让我特别心动的男生，就感觉自己单身二十多年的心脏活过来了，我是个不怎么主动的人，也很社恐，在终点站鼓起勇气等大家都下车了再和他要微信，第一次没听清但看他摆手拒绝了，我很我失落，但想了想还是不想放弃，再次鼓起勇气问他：真的不可以加微信吗？这时我才听清楚他说的是：不好意思我有女朋友了。 轰的一下脑子懵懵的，我的脸一下子发热爆红！！幸好戴着口罩。我立马跑到了另一个站台，为自己刚刚的行为感到羞耻和尴尬，看着地铁门上倒影着自己，想着是不是自己不够瘦，是不是自己不够好看，是不是自己穿的很普通，想着想着就哭了，真的很尴尬，在人挤人的号线偷偷哭，还好戴着眼睛口罩没人发现,0.3594573740249155,1.0,0.7803876231821802
这么多属于后者的吗？我是前者耶，但是我20多年的人生真的没有遇到过这样的人出现[大哭],这么多属于后者的吗？我是前者耶，但是我多年的人生真的没有遇到过这样的人出现,0.0,0.33622659986374615,0.3374129023283359
其实剩男剩女过的挺幸福的，反观一些想离婚还离不了的，那才叫真的痛苦,其实剩男剩女过的挺幸福的，反观一些想离婚还离不了的，那才叫真的痛苦,0.0,1.0,0.644311735184323
其实我觉得第一个女生五官挺好看的 收拾下真的会更抢眼 婚介那人说话太难听,其实我觉得第一个女生五官挺好看的 收拾下真的会更抢眼 婚介那人说话太难听,0.0,0.4632039205553255,0.39870586522499485
这女生跟我前男友挺配的，我那个前男友是真上进，我喜欢躺平真的接受不了[笑哭]，然后我觉得跟他在一起很累，他可能也觉得对我恨铁不成钢，所以最后分开各自安好吧,这女生跟我前男友挺配的，我那个前男友是真上进，我喜欢躺平真的接受不了，然后我觉得跟他在一起很累，他可能也觉得对我恨铁不成钢，所以最后分开各自安好吧,0.3594573740249155,1.0,0.6263614199922009
我觉得真的挺搞笑的，结婚率生小孩数量不能直接从网上看到吗，要是结婚生小孩好的很，还用催吗，还用号召吗，人生来就是趋利避害的，现在大环境都不好，许多许多人自己生存都有问题，那个有心思去结婚生小孩呢，再说了，你家有皇位等着等着继承吗，你生个小孩以后和你过着相似的生活，不生也是一种善良。,我觉得真的挺搞笑的，结婚率生小孩数量不能直接从网上看到吗，要是结婚生小孩好的很，还用催吗，还用号召吗，人生来就是趋利避害的，现在大环境都不好，许多许多人自己生存都有问题，那个有心思去结婚生小孩呢，再说了，你家有皇位等着等着继承吗，你生个小孩以后和你过着相似的生活，不生也是一种善良。,0.3594573740249155,1.0,0.7967148437441967
"很多女孩确实是这样，主要现在好女孩太少了，出门相亲或者互相认识的话，很少有坦诚相待和为对方着想的，我很庆幸我碰到了我对象[初音未来_大笑]，谈了一年多只有我把她惹哭过两次，剩下的时候都是她在迁就我因为我脾气不太好，也没怎么吵过架，我自己本身就不太想吵架，跟她讲道理她会听也会好好跟我说，然后说她为什么生气我俩互相好好讨论理解最后我嘻嘻哈哈把她逗笑就过去了。我俩是大学认识的，而且也是双方第一次好好谈恋爱（我高中跟几个女生纷纷扰扰不太正经），之前三月份的时候吧，我俩一起在学校食堂吃饭，她发现我胡子没剃干净就摸了摸说怎么没剃干净啊，我说哎呀那个剃须刀高中五金店随便20块买的，今天下午睡午觉了，出来见你也忙就没怎么收拾。后来一次都没提过关于胡子剃须刀的任何事，因为那是我当时随口一说的话，但是她一直记着并且在七夕节的时候悄悄给我买了飞科礼盒花了几百，收到礼物那天我真的很开心，因为这是我第一次名正言顺的被另一半爱着惦记着（之前高中的前对象一直对我不好，还跟男生玩的好）。而且她性格跟我真的很像简直就是除去性别剩下的基本大差不差，家庭也挺相似，我说今年我家要给我全款买房150平的，但是装修就得稍微等等，她现在在学校安排的幼儿园里实习，就跟我说那我给咱家攒钱本来幼儿园一天管早上中午晚上，晚上吃的很早因为幼儿园五点就吃饭然后收拾放学了，一般晚上她都会回家的时候加餐或者买好吃的，现在都不买了她说反正我也不追星不玩游戏（只玩一个光遇还是我带入坑的，也不怎么买化妆品乱花钱买衣服），就给咱攒攒钱。
我真的很感激她，让我明白了爱与被爱，再过十几天就是她的生日了，我知道她有点懒就悄悄给她买了电动牙刷，毕竟我现在全职备考她也知道我忙，得知我给她买了电动牙刷后说没事儿，其实我只记得你的生日了（打电话的时候说的）。而且她干什么事，或者吃什么饭什么状态都会跟我说，我说我占有欲没那么强你要是忙啥的就不用老惦记我给我发，她说没事我又不是很忙我想跟你说话，她也不要求我啥节日给她买啥，能抽时间陪她就行[初音未来_大笑]。我真的很爱她。",很多女孩确实是这样，主要现在好女孩太少了，出门相亲或者互相认识的话，很少有坦诚相待和为对方着想的，我很庆幸我碰到了我对象，谈了一年多只有我把她惹哭过两次，剩下的时候都是她在迁就我因为我脾气不太好，也没怎么吵过架，我自己本身就不太想吵架，跟她讲道理她会听也会好好跟我说，然后说她为什么生气我俩互相好好讨论理解最后我嘻嘻哈哈把她逗笑就过去了。我俩是大学认识的，而且也是双方第一次好好谈恋爱（我高中跟几个女生纷纷扰扰不太正经），之前三月份的时候吧，我俩一起在学校食堂吃饭，她发现我胡子没剃干净就摸了摸说怎么没剃干净啊，我说哎呀那个剃须刀高中五金店随便块买的，今天下午睡午觉了，出来见你也忙就没怎么收拾。后来一次都没提过关于胡子剃须刀的任何事，因为那是我当时随口一说的话，但是她一直记着并且在七夕节的时候悄悄给我买了飞科礼盒花了几百，收到礼物那天我真的很开心，因为这是我第一次名正言顺的被另一半爱着惦记着（之前高中的前对象一直对我不好，还跟男生玩的好）。而且她性格跟我真的很像简直就是除去性别剩下的基本大差不差，家庭也挺相似，我说今年我家要给我全款买房平的，但是装修就得稍微等等，她现在在学校安排的幼儿园里实习，就跟我说那我给咱家攒钱本来幼儿园一天管早上中午晚上，晚上吃的很早因为幼儿园五点就吃饭然后收拾放学了，一般晚上她都会回家的时候加餐或者买好吃的，现在都不买了她说反正我也不追星不玩游戏（只玩一个光遇还是我带入坑的，也不怎么买化妆品乱花钱买衣服），就给咱攒攒钱。 我真的很感激她，让我明白了爱与被爱，再过十几天就是她的生日了，我知道她有点懒就悄悄给她买了电动牙刷，毕竟我现在全职备考她也知道我忙，得知我给她买了电动牙刷后说没事儿，其实我只记得你的生日了（打电话的时候说的）。而且她干什么事，或者吃什么饭什么状态都会跟我说，我说我占有欲没那么强你要是忙啥的就不用老惦记我给我发，她说没事我又不是很忙我想跟你说话，她也不要求我啥节日给她买啥，能抽时间陪她就行。我真的很爱她。,0.3594573740249155,1.0,0.9742716608050215
其实还是要自己好才是真的好，把婚姻当成改命机会，一开始可能会泡沫期，正如一句话，退潮后，谁在裸泳，一看便知[doge],其实还是要自己好才是真的好，把婚姻当成改命机会，一开始可能会泡沫期，正如一句话，退潮后，谁在裸泳，一看便知,0.3594573740249155,1.0,0.608591633656791
感觉这期噜噜情绪不开心哎，我觉得要是伴侣真的不喜欢你做某件事，还是就不要做了吧……,感觉这期噜噜情绪不开心哎，我觉得要是伴侣真的不喜欢你做某件事，还是就不要做了吧……,0.3594573740249155,0.4320558161628193,0.39968774903936755
我和男朋友谈了五年，他985本硕博，我211本，他工资是我四五倍，但他一直觉得我比他聪明，家务也是他做得多，不抽烟喝酒打牌，甚至不喜欢出去聚餐什么的，而且真的能从他的眼神和行为里感受到他对我浓浓的爱意，但他也爱生闷气，而且在我情绪不好的时候从来不知道怎么安慰我，木讷且浪漫过敏。所以说哪有完美的人，大方向好就很难得了，互相体谅就好了,我和男朋友谈了五年，他本硕博，我本，他工资是我四五倍，但他一直觉得我比他聪明，家务也是他做得多，不抽烟喝酒打牌，甚至不喜欢出去聚餐什么的，而且真的能从他的眼神和行为里感受到他对我浓浓的爱意，但他也爱生闷气，而且在我情绪不好的时候从来不知道怎么安慰我，木讷且浪漫过敏。所以说哪有完美的人，大方向好就很难得了，互相体谅就好了,0.3594573740249155,1.0,0.6600411267037187
