comment,cleaned_comment,score1,score2,combined_score
对女性来说，生完孩子和夫家抗衡，真的需要大智慧。很多人说要经济对等，才能谈判。但是一位生养中的母亲，要和丈夫经济对等，这是很大的不平等。,对女性来说，生完孩子和夫家抗衡，真的需要大智慧。很多人说要经济对等，才能谈判。但是一位生养中的母亲，要和丈夫经济对等，这是很大的不平等。,0.3594573740249155,1.0,0.7393929717358815
嗯嗯，爱一个人从给对方高潮开始，无论男女都要努力学习锻炼，相互取悦，生活本就很苦了，没有性，亲密关系调节，真的是爱会慢慢消失,嗯嗯，爱一个人从给对方高潮开始，无论男女都要努力学习锻炼，相互取悦，生活本就很苦了，没有性，亲密关系调节，真的是爱会慢慢消失,0.3594573740249155,1.0,0.7662538873793066
老师，我恋爱和婚姻都会选择B吧，作为一个刚满24岁的母胎单身狗，真的发现遇到一个心动的两情相悦的人真的是太难了，有些人可能终其一生都不会遇见。和心动的人在一起无论发生什么事情我只需要和外界的人或者事作斗争，吃普通的饭菜住普通的房子我也能吃出心神荡漾的幸福感；但是和我没有爱情的人在一起，我需要作斗争的人是我自己呀，一辈子说长不长说短不短的，在实现自我价值孝敬父母爱护亲人朋友不违法道德和法律的情况下，想要为自己而活。,老师，我恋爱和婚姻都会选择B吧，作为一个刚满岁的母胎单身狗，真的发现遇到一个心动的两情相悦的人真的是太难了，有些人可能终其一生都不会遇见。和心动的人在一起无论发生什么事情我只需要和外界的人或者事作斗争，吃普通的饭菜住普通的房子我也能吃出心神荡漾的幸福感；但是和我没有爱情的人在一起，我需要作斗争的人是我自己呀，一辈子说长不长说短不短的，在实现自我价值孝敬父母爱护亲人朋友不违法道德和法律的情况下，想要为自己而活。,0.3594573740249155,1.0,0.8855342321631743
真的，前男友一直不理解，他把恋爱当有ddl的工作任务，是高强度持续投入一整段方块时间，然后就像完成了一样可以去投入另一个工作项目而完全不再在恋爱这个项目里投入精力的人，等别的项目完成了再回来。我真的不理解怎么有人谈恋爱是一段一段断开来谈的，世界奇人异闻了属于是。,真的，前男友一直不理解，他把恋爱当有ddl的工作任务，是高强度持续投入一整段方块时间，然后就像完成了一样可以去投入另一个工作项目而完全不再在恋爱这个项目里投入精力的人，等别的项目完成了再回来。我真的不理解怎么有人谈恋爱是一段一段断开来谈的，世界奇人异闻了属于是。,0.3594573740249155,1.0,0.6434336311817794
我想问问，她是我初恋，前几天刚分手，她是单亲家庭，我因为同情心过强和她在一起，后面我发现和她在一起我特别痛苦，她是那种高高在上的那种，说什么都是随你，屁，滚，我以为是她没走出来，平时都是一直安慰她，后面我发现我不是真的了解她，我因为是初恋，所以就只甘愿付出的那种，后面发现我越来越痛苦，越来越卑微，周围的人都叫我放手，我以为我了解她，还是坚持，后面让我破防的是她连情侣头像空间这些都不和我换，还说一定要这些嘛，在吵架时我说尽了心声，到底线了不能再退了，她依旧一句话都吐不出来，但她有悄悄发过话，撤回了，我现在觉得她应该是有情感障碍，但我确实接近过她的内心，只不过后面因为可能触犯到她她又疏远我了，她是那种时常忧郁时常暴躁，双向情感障碍，我真的太痛苦了，差点走不出来，但我还是同情她，她应该没被关爱过，也没被人管过，可能她说的很多都是真的，特例吧，不算感情骗子，但被pua是真的太痛苦了，虽然即使可能不是她本意，就是推开，我可能也不是她的拯救者。唉。,我想问问，她是我初恋，前几天刚分手，她是单亲家庭，我因为同情心过强和她在一起，后面我发现和她在一起我特别痛苦，她是那种高高在上的那种，说什么都是随你，屁，滚，我以为是她没走出来，平时都是一直安慰她，后面我发现我不是真的了解她，我因为是初恋，所以就只甘愿付出的那种，后面发现我越来越痛苦，越来越卑微，周围的人都叫我放手，我以为我了解她，还是坚持，后面让我破防的是她连情侣头像空间这些都不和我换，还说一定要这些嘛，在吵架时我说尽了心声，到底线了不能再退了，她依旧一句话都吐不出来，但她有悄悄发过话，撤回了，我现在觉得她应该是有情感障碍，但我确实接近过她的内心，只不过后面因为可能触犯到她她又疏远我了，她是那种时常忧郁时常暴躁，双向情感障碍，我真的太痛苦了，差点走不出来，但我还是同情她，她应该没被关爱过，也没被人管过，可能她说的很多都是真的，特例吧，不算感情骗子，但被pua是真的太痛苦了，虽然即使可能不是她本意，就是推开，我可能也不是她的拯救者。唉。,0.5350482592176715,1.0,0.7064062711051722
我真的是不想恋爱，以前特别渴望一段爱情，现在感觉不是厌男了，感觉是厌人。这逼生活就已经很累，谈恋爱情绪也不稳定，我想我会一直孤独[星星眼][星星眼],我真的是不想恋爱，以前特别渴望一段爱情，现在感觉不是厌男了，感觉是厌人。这逼生活就已经很累，谈恋爱情绪也不稳定，我想我会一直孤独,0.3594573740249155,1.0,0.7492226309359908
不过吧，真的发现，最好的状态就是心里没有人的时候。,不过吧，真的发现，最好的状态就是心里没有人的时候。,0.40159477065724175,0.4320558161628193,0.42780580968008797
确实，所以我一直觉得我跟老婆相遇真的是我目前最大的奇迹[笑哭],确实，所以我一直觉得我跟老婆相遇真的是我目前最大的奇迹,0.40159477065724175,1.0,0.7164299623189635
自己表现的最真实最自然的一面能被ta接受的话，真的是上辈子集来的福气,自己表现的最真实最自然的一面能被ta接受的话，真的是上辈子集来的福气,0.3594573740249155,1.0,0.7471523636300189
结婚绝对没有单身轻松，结婚要的是一种责任感，想要结婚比单身舒服的人真的别结婚,结婚绝对没有单身轻松，结婚要的是一种责任感，想要结婚比单身舒服的人真的别结婚,0.3594573740249155,1.0,0.8119448893419396
经典大学生，那人家也花了四年啊...不喜欢就不喜欢，不合适早点分开好。痴情真的幼稚又恐怖，要不是缠着要不是寻短见，自己爽了，怎么样都能缠对方一辈子...,经典大学生，那人家也花了四年啊...不喜欢就不喜欢，不合适早点分开好。痴情真的幼稚又恐怖，要不是缠着要不是寻短见，自己爽了，怎么样都能缠对方一辈子...,0.3594573740249155,1.0,0.5728818378450022
我现在29了，有了自己独立的人格和三观，可这一路走来的经历告诉我，婚姻对于女生来说代价远大于收益，我真的不需要也不期待爱情了，真的，到最后都那样，憧憬婚姻的只有当初那个20出头的我，我觉得当女性清醒时，是不会想要婚姻的,我现在了，有了自己独立的人格和三观，可这一路走来的经历告诉我，婚姻对于女生来说代价远大于收益，我真的不需要也不期待爱情了，真的，到最后都那样，憧憬婚姻的只有当初那个出头的我，我觉得当女性清醒时，是不会想要婚姻的,0.3594573740249155,1.0,0.7915970284171441
有的，你俩真的把很多心里懂，心里知道这就是自己想要的亲密关系，说不出来的那些，很直观的给到了我们！,有的，你俩真的把很多心里懂，心里知道这就是自己想要的亲密关系，说不出来的那些，很直观的给到了我们！,0.3594573740249155,1.0,0.606843234920055
这应该是从小美到大的[笑哭]这种遭遇真的一辈子阴影，祝愿能找个相爱的[吃瓜],这应该是从小美到大的这种遭遇真的一辈子阴影，祝愿能找个相爱的,0.3594573740249155,1.0,0.6898764415349437
大晚上的看到这些真的很唏嘘，我自己上一段感情也和这个大兄弟差不多，女方的反应和小敏叙述的基本上一模一样，经过她一理顺，我就明白了，真的是撤的及时啊。拎不清三个字太符合了，我当时可能做出的让步比这男的还要大，结果对面家庭可能就是觉得我嫁个女儿牛上天了的那种感觉，我原先觉得可以忍受，后来发现是真的一点都忍受不了，自己的身心被折磨的不成样子，还陷入了抑郁，现在想想感谢父母帮助了我，也感谢我自己对自己不放弃吧。希望大家一定要保护好自己和家人，祝愿这些xxn们都能不抛弃、不放弃，坚持自己的选择不动摇,大晚上的看到这些真的很唏嘘，我自己上一段感情也和这个大兄弟差不多，女方的反应和小敏叙述的基本上一模一样，经过她一理顺，我就明白了，真的是撤的及时啊。拎不清三个字太符合了，我当时可能做出的让步比这男的还要大，结果对面家庭可能就是觉得我嫁个女儿牛上天了的那种感觉，我原先觉得可以忍受，后来发现是真的一点都忍受不了，自己的身心被折磨的不成样子，还陷入了抑郁，现在想想感谢父母帮助了我，也感谢我自己对自己不放弃吧。希望大家一定要保护好自己和家人，祝愿这些xxn们都能不抛弃、不放弃，坚持自己的选择不动摇,0.3594573740249155,1.0,0.8147091544271358
真的不想单身，可是相亲男方总要求我买房买车，车子型号都说了，还要求必须我承担所有家务，我受不了，长这么大一次恋爱没谈过，以后估计也没有，现在老了是真的害怕了[辣眼睛],真的不想单身，可是相亲男方总要求我买房买车，车子型号都说了，还要求必须我承担所有家务，我受不了，长这么大一次恋爱没谈过，以后估计也没有，现在老了是真的害怕了,0.3594573740249155,1.0,0.7350870266071974
每次听姐姐和我们聊天都有豁然开朗的感觉，总能给我的思想和实际生活带来很多好的引导，希望自己一直保持真诚，也希望在爱情上可以遇到同样真诚的人吧（真的讨厌一些故意推拉ㅠㅠ）另外姐姐可以分享一下耳环链接吗我真的一直盯……好好看[保卫萝卜_哭哭],每次听姐姐和我们聊天都有豁然开朗的感觉，总能给我的思想和实际生活带来很多好的引导，希望自己一直保持真诚，也希望在爱情上可以遇到同样真诚的人吧（真的讨厌一些故意推拉ㅠㅠ）另外姐姐可以分享一下耳环链接吗我真的一直盯……好好看,0.3594573740249155,0.33622659986374615,0.38471398228238085
感觉真的很矛盾，大家都说真诚是很宝贵的，但是你一付出真诚，你基本就是弱势的一方了。因为你已经把最宝贵的东西交出去了。那这段感情的未来基本就已经在对方的控制下了。对方是回以真诚，还是因此看轻你，真的很难判断，和赌博差不多了。,感觉真的很矛盾，大家都说真诚是很宝贵的，但是你一付出真诚，你基本就是弱势的一方了。因为你已经把最宝贵的东西交出去了。那这段感情的未来基本就已经在对方的控制下了。对方是回以真诚，还是因此看轻你，真的很难判断，和赌博差不多了。,0.3594573740249155,1.0,0.6775183761795993
这不是教人谈恋爱，这是交人怎么越来越不会谈恋爱，类似up主的这种拉扯两性关系的言论太恶心了。up这种言论可能一是为了数据，二是可能真的没谈过&#34;恋爱&#34;，但是真的会让很多不懂的男孩子或者还没有遇到对的人的男孩子走上另外一条路，真的太可怕了…希望大家相信恋爱是存在冲动的，恋爱的感觉也是存在心动的，恋爱的快乐不是up列出的1234可以解释和实现的。看到这种视频真的好生气好无奈…这世界上哪有那么多舔狗哪有那么多渣男，更多的是不合适的两个人而已，如果真的因为这个视频被影响了恋爱观，一辈子带着1234的表格去看待女性，我的天啊，那这个世界会变成什么样子啊？我都不想逐条反驳，就问什么叫跟王思聪一样有钱的话哪怕睡了1000个，女人也不在乎？这是人说的话吗？1000个会得病的知道吗？这灌输的人人的价值观吗…我的天啊真的太气人了！,这不是教人谈恋爱，这是交人怎么越来越不会谈恋爱，类似up主的这种拉扯两性关系的言论太恶心了。up这种言论可能一是为了数据，二是可能真的没谈过&#;恋爱&#;，但是真的会让很多不懂的男孩子或者还没有遇到对的人的男孩子走上另外一条路，真的太可怕了…希望大家相信恋爱是存在冲动的，恋爱的感觉也是存在心动的，恋爱的快乐不是up列出的可以解释和实现的。看到这种视频真的好生气好无奈…这世界上哪有那么多舔狗哪有那么多渣男，更多的是不合适的两个人而已，如果真的因为这个视频被影响了恋爱观，一辈子带着的表格去看待女性，我的天啊，那这个世界会变成什么样子啊？我都不想逐条反驳，就问什么叫跟王思聪一样有钱的话哪怕睡了个，女人也不在乎？这是人说的话吗？个会得病的知道吗？这灌输的人人的价值观吗…我的天啊真的太气人了！,1.0,1.0,0.8565629100936641
我发现我真的有挖野菜的潜质，上一秒还和朋友说智者不入爱河，下一秒就跳了下去...不是夸张，真的是只能用秒来形容，然后半个月就被冲上岸了，好难过，从来没有那么难受过[大哭],我发现我真的有挖野菜的潜质，上一秒还和朋友说智者不入爱河，下一秒就跳了下去...不是夸张，真的是只能用秒来形容，然后半个月就被冲上岸了，好难过，从来没有那么难受过,0.3594573740249155,1.0,0.7649848540897326
让我知道了三年的真心，戒指，订婚，双方父母见面，一起回老家，陪她治病，带她玩遍整个昆明这么多的一切原来真的比不上新鲜感。,让我知道了三年的真心，戒指，订婚，双方父母见面，一起回老家，陪她治病，带她玩遍整个昆明这么多的一切原来真的比不上新鲜感。,0.3594573740249155,1.0,0.6854791566529819
被前男友pua冷暴力悟出来的，感情不是付出越多回报就越多，不能因为爱情就一味的付出，放低姿态，拉低底线，榨干自己，你真的做的够好了，若干年后对方会意识到你才是教会对方什么是珍惜的人，看，你多伟大[吃瓜]我们总是看不到自己的光，自己的需求，看不到我其实是一个多可爱多优秀多珍贵多值得被爱的人，眼里只有别人，爱别人胜过自己，其实他真的有那么好吗？是被你自己镀上的一层金好吧[doge]个人观点，谈恋爱一定要找最起码可以对你的付出有同等回报的人，凭什么你就是那个委屈焦虑的人？遇到珍惜你的人你才能知道，啊，原来我真的可以什么都不用做，什么都不用努力，讨好，我可以不用那么美那么淑女，还是会有一个人无条件的爱你，看过你狼狈不堪的样子，还是光想着把糖和肩膀都给你[喜欢],被前男友pua冷暴力悟出来的，感情不是付出越多回报就越多，不能因为爱情就一味的付出，放低姿态，拉低底线，榨干自己，你真的做的够好了，若干年后对方会意识到你才是教会对方什么是珍惜的人，看，你多伟大我们总是看不到自己的光，自己的需求，看不到我其实是一个多可爱多优秀多珍贵多值得被爱的人，眼里只有别人，爱别人胜过自己，其实他真的有那么好吗？是被你自己镀上的一层金好吧个人观点，谈恋爱一定要找最起码可以对你的付出有同等回报的人，凭什么你就是那个委屈焦虑的人？遇到珍惜你的人你才能知道，啊，原来我真的可以什么都不用做，什么都不用努力，讨好，我可以不用那么美那么淑女，还是会有一个人无条件的爱你，看过你狼狈不堪的样子，还是光想着把糖和肩膀都给你,1.0,1.0,0.8052589876799914
第一！这个系列的视频对母单真的太有用了，夭夭说话的节奏听着也很舒服，一定能越做越好的！加油！[打call],第一！这个系列的视频对母单真的太有用了，夭夭说话的节奏听着也很舒服，一定能越做越好的！加油！,0.40159477065724175,0.33622659986374615,0.3806350401023569
这些人真的不可以戴套吗？能不能什么都做好了，比如结婚证，婚检，能不能查一查有没有欠债，是不是失信人员啊。稀里糊涂结了婚，又有了孩子，谁能为小孩子负负责啊！！！,这些人真的不可以戴套吗？能不能什么都做好了，比如结婚证，婚检，能不能查一查有没有欠债，是不是失信人员啊。稀里糊涂结了婚，又有了孩子，谁能为小孩子负负责啊！！！,0.3594573740249155,1.0,0.7399217091185212
分房睡  除了孩子没什么话题  都快一年多了  我是真的没法子 凯哥能不能帮我一下,分房睡 除了孩子没什么话题 都快一年多了 我是真的没法子 凯哥能不能帮我一下,0.3594573740249155,1.0,0.711269700914347
up主同情能力好高啊，江先生真的很幸运很幸福能娶到你。我觉得现在共情能力高的人很少了，有些人觉得自己吃了苦，那凭什么别人那么幸福，还有一些人觉得他人怎样跟自己一点关系也没有。像这种自己吃的苦不希望对方也吃，真的太温暖了。,up主同情能力好高啊，江先生真的很幸运很幸福能娶到你。我觉得现在共情能力高的人很少了，有些人觉得自己吃了苦，那凭什么别人那么幸福，还有一些人觉得他人怎样跟自己一点关系也没有。像这种自己吃的苦不希望对方也吃，真的太温暖了。,0.3594573740249155,1.0,0.7322461970697799
我身边的一位姐姐离了，真的替她高兴！男的渣的一批，明明有孩子还婚内出轨找女人生男娃（小三第一胎验出来是女的就打了），给小三买车，还没离婚就到处带小三出去见人甚至和夫妻双方都认识的人说这是我夫人！无语那男的什么破三观,我身边的一位姐姐离了，真的替她高兴！男的渣的一批，明明有孩子还婚内出轨找女人生男娃（小三第一胎验出来是女的就打了），给小三买车，还没离婚就到处带小三出去见人甚至和夫妻双方都认识的人说这是我夫人！无语那男的什么破三观,0.3594573740249155,1.0,0.6682811087171165
笑死男朋友出轨找了个男朋友[笑哭][笑哭][笑哭][笑哭]真的怎么办,笑死男朋友出轨找了个男朋友真的怎么办,0.3594573740249155,1.0,0.5489192768297065
我讲真的，我可以接受另一半不工作在家里，因为持家不容易的，我是说持家哈不是躺着出轨[冰墩墩],我讲真的，我可以接受另一半不工作在家里，因为持家不容易的，我是说持家哈不是躺着出轨,0.3594573740249155,1.0,0.5826713356909876
吵架四年最终离婚收场，都是平时一点点小事累积的，虽然无法回到过去，还是希望想挽回的朋友不要轻易离婚，离婚后真的太难了，个人孩子都是承受着代价，过来人的经验，愿大家都好！,吵架四年最终离婚收场，都是平时一点点小事累积的，虽然无法回到过去，还是希望想挽回的朋友不要轻易离婚，离婚后真的太难了，个人孩子都是承受着代价，过来人的经验，愿大家都好！,0.3594573740249155,1.0,0.7466141761009681
真的很爱她，还有为了孩子我也不能离,真的很爱她，还有为了孩子我也不能离,0.0,1.0,0.6231470556724893
从小缺爱真的很可怕，一点点爱就能让你恋恋不舍,从小缺爱真的很可怕，一点点爱就能让你恋恋不舍,0.3594573740249155,1.0,0.543606323285233
可能，爱情，在这个时代，真的稀缺，我是说，真正的爱情,可能，爱情，在这个时代，真的稀缺，我是说，真正的爱情,0.3594573740249155,1.0,0.7166683147126991
我和我前任还是互相爱的。谈了4年8个月22天。她也很不喜欢现在的老公。但是没办法。拿不出钱结婚。虽然合起来也就二十万。但是一个人才毕业不久真的很难掏。也许有些事情从来就不该发生。。,我和我前任还是互相爱的。谈了年个月天。她也很不喜欢现在的老公。但是没办法。拿不出钱结婚。虽然合起来也就二十万。但是一个人才毕业不久真的很难掏。也许有些事情从来就不该发生。。,0.3594573740249155,1.0,0.6235864798653538
真的是，双鱼男表示，因为门当户对，连颜值都不看了。就是这么现实。。。,真的是，双鱼男表示，因为门当户对，连颜值都不看了。就是这么现实。。。,0.3594573740249155,1.0,0.7800508443069436
爱纯就是很明确的冲宽植这个人，才嫁给他的。她也知道他们家不算好婆家。但是她就是冲他这个人本身就是特别好。爱纯也说过：“他可能会让我饿肚子，但是他绝对不会让我伤心。”所以爱纯真的很坚定的选了一个很好的人。金明是看着爸爸长大的。宽植真的在女儿心里树立了一个很好的男性形象。只要金明擦亮眼睛，孰优孰劣，她一定会看清楚的。,爱纯就是很明确的冲宽植这个人，才嫁给他的。她也知道他们家不算好婆家。但是她就是冲他这个人本身就是特别好。爱纯也说过：“他可能会让我饿肚子，但是他绝对不会让我伤心。”所以爱纯真的很坚定的选了一个很好的人。金明是看着爸爸长大的。宽植真的在女儿心里树立了一个很好的男性形象。只要金明擦亮眼睛，孰优孰劣，她一定会看清楚的。,0.3594573740249155,1.0,0.7187292689631499
你爱的人，不喜欢你的围巾，是摘下围巾容易还是改变他的审美容易？这个例子真的让我学到了。我总想改变他，但是那么多年的习惯哪里改变的了呢，如果不涉及原则的问题我为什么一直钻牛角尖去较真呢。钻牛角尖，较真，只会不断挑他的问题，放大一些负面情绪，比如说我总觉得他不改变就不在乎我，而且我说了那么多次了他还不改自己的内心就更确定他就是不在乎我。一点点的不信任，其实不是他给我的不安全感，都是自己想象出来的吧。谢谢up，让我学到了，让我学会了怎么对待自己的另一半，怎么舒缓自己较真的情绪。希望我能收获幸福吧。,你爱的人，不喜欢你的围巾，是摘下围巾容易还是改变他的审美容易？这个例子真的让我学到了。我总想改变他，但是那么多年的习惯哪里改变的了呢，如果不涉及原则的问题我为什么一直钻牛角尖去较真呢。钻牛角尖，较真，只会不断挑他的问题，放大一些负面情绪，比如说我总觉得他不改变就不在乎我，而且我说了那么多次了他还不改自己的内心就更确定他就是不在乎我。一点点的不信任，其实不是他给我的不安全感，都是自己想象出来的吧。谢谢up，让我学到了，让我学会了怎么对待自己的另一半，怎么舒缓自己较真的情绪。希望我能收获幸福吧。,0.3594573740249155,1.0,0.7629465047748925
世界上，两个人相爱走到一起真的很不容易。希望可以从姐姐这里沾沾幸福。,世界上，两个人相爱走到一起真的很不容易。希望可以从姐姐这里沾沾幸福。,0.3594573740249155,1.0,0.5878436327376254
没有什么比爱更值得深陷和体验，遇到爱本身就真的非常幸运了。,没有什么比爱更值得深陷和体验，遇到爱本身就真的非常幸运了。,0.3594573740249155,1.0,0.6532889718414071
我也想不通爱情长跑，你真的很喜欢一个人会一直好几年不结婚吗？三四年还不够谈恋爱吗？还不够彼此都确定吗？,我也想不通爱情长跑，你真的很喜欢一个人会一直好几年不结婚吗？三四年还不够谈恋爱吗？还不够彼此都确定吗？,0.3594573740249155,1.0,0.5764730070199499
太科幻了[笑哭][笑哭][笑哭][笑哭]现在真的还有这种爱情吗？但还是祝福up[打call][打call][打call][打call],太科幻了现在真的还有这种爱情吗？但还是祝福up,0.3594573740249155,1.0,0.7493234223691503
被相处8年的前女友分手，一年后前女友 未婚先孕 奉子成婚 闪婚  我真的是恶心想吐 真不知道怎么想的 多伤父母心以及会其他人说闲话的,被相处年的前女友分手，一年后前女友 未婚先孕 奉子成婚 闪婚 我真的是恶心想吐 真不知道怎么想的 多伤父母心以及会其他人说闲话的,0.3594573740249155,1.0,0.5619437242294778
