comment,cleaned_comment,score1,score2,combined_score
对于焦虑型，最好的办法就是做自己，找到自己喜爱的事情，分散注意力，收回一些爱给自己，他冷漠的时候你不必理会，其实就是没有那么爱你而已，一个人喜欢一个人恨不得扑上去，他在其他事情上回避但不会拒绝真爱，不用去等待他反省是否爱你，多交朋友，输出情绪，不然真的会崩，回避型的恋人也真的不用你去操心他的未来[笑哭],对于焦虑型，最好的办法就是做自己，找到自己喜爱的事情，分散注意力，收回一些爱给自己，他冷漠的时候你不必理会，其实就是没有那么爱你而已，一个人喜欢一个人恨不得扑上去，他在其他事情上回避但不会拒绝真爱，不用去等待他反省是否爱你，多交朋友，输出情绪，不然真的会崩，回避型的恋人也真的不用你去操心他的未来,0.3594573740249155,1.0,0.7388307731058178
Ky讲的我真的太深有体会了[无语]。和前男友就是这么个情况，他是疏离型我是焦虑型，更糟糕的是还搞了个异国恋，我有什么想和他说清楚的事情就经常已读不回，以前不理解，现在觉得他面对我应该挺煎熬的，但我也很累，感觉说话总是得不到回应。这样的两类人聚在一起真的很累，除非你抱着付出很多努力去改变一切的觉悟，否则恋爱前建议先观察好。,Ky讲的我真的太深有体会了。和前男友就是这么个情况，他是疏离型我是焦虑型，更糟糕的是还搞了个异国恋，我有什么想和他说清楚的事情就经常已读不回，以前不理解，现在觉得他面对我应该挺煎熬的，但我也很累，感觉说话总是得不到回应。这样的两类人聚在一起真的很累，除非你抱着付出很多努力去改变一切的觉悟，否则恋爱前建议先观察好。,0.3594573740249155,1.0,0.8576381162340334
害怕被遗弃是真的，但放手是不是更明智的选择？做朋友就不会有被遗弃感了不是吗。,害怕被遗弃是真的，但放手是不是更明智的选择？做朋友就不会有被遗弃感了不是吗。,0.3594573740249155,1.0,0.6579230125821423
蛮有趣的，我是典型的回避型，男友是典型安全型，所以感情生活真的很幸福，但是同时，我最要好的闺蜜也是典型的回避型，相处非常轻松融洽！[doge],蛮有趣的，我是典型的回避型，男友是典型安全型，所以感情生活真的很幸福，但是同时，我最要好的闺蜜也是典型的回避型，相处非常轻松融洽！,0.3594573740249155,1.0,0.685051781576071
"想请教一个问题，看了咕咕的视频觉得我自己是回避型依恋，一直不热衷于交朋友，有了比较熟的朋友有时会一起去食堂或者讨论题目什么的，但会有意识地控制频率，害怕形成一定要一直在一起的习惯，或者就是单纯的害怕再进一步的亲密关系。
但是我有一个同学，她应该是比较典型的焦虑型依恋，特别粘人，我跟她根本不在一个班，甚至根本不在一个楼层，但每天午休和下午放学她一定会来我们班找我，而且不是正常的问好什么的，而是会直接进我们班，用特别细的声音哼哼唧唧，然后拽着我的手非常用劲地快速晃（有时候我还在写字）。她几乎是什么都想跟我聊，会哼哼唧唧地找话题，现在还会非常直接地问“你爱我吗”“我可爱吗”之类的问题。（我是女生）我寻思我们关系也没那么近为什么不停地问这么直接的问题。
我知道她一直内向，几乎没什么朋友，但她对我的态度真的一直让我觉得非常不舒服。我猜她一直找我可能是因为我从没有明确地拒绝过她，但那最多是出于同情，我真的非常不喜欢她对我的这种过于亲密的方式。我一直在躲她，但她常常会在我的各种必经之路上专门等我，一定要聊几句，赖到不得不走（比如上课了）才肯罢休。我不只是讨厌过于亲密的关系，而且真的很忙，除了文化课还有很多事情必须要做，告知了她她也依然粘人。
这种关系真的让我觉得很不舒服，我该怎么办呢？",想请教一个问题，看了咕咕的视频觉得我自己是回避型依恋，一直不热衷于交朋友，有了比较熟的朋友有时会一起去食堂或者讨论题目什么的，但会有意识地控制频率，害怕形成一定要一直在一起的习惯，或者就是单纯的害怕再进一步的亲密关系。 但是我有一个同学，她应该是比较典型的焦虑型依恋，特别粘人，我跟她根本不在一个班，甚至根本不在一个楼层，但每天午休和下午放学她一定会来我们班找我，而且不是正常的问好什么的，而是会直接进我们班，用特别细的声音哼哼唧唧，然后拽着我的手非常用劲地快速晃（有时候我还在写字）。她几乎是什么都想跟我聊，会哼哼唧唧地找话题，现在还会非常直接地问“你爱我吗”“我可爱吗”之类的问题。（我是女生）我寻思我们关系也没那么近为什么不停地问这么直接的问题。 我知道她一直内向，几乎没什么朋友，但她对我的态度真的一直让我觉得非常不舒服。我猜她一直找我可能是因为我从没有明确地拒绝过她，但那最多是出于同情，我真的非常不喜欢她对我的这种过于亲密的方式。我一直在躲她，但她常常会在我的各种必经之路上专门等我，一定要聊几句，赖到不得不走（比如上课了）才肯罢休。我不只是讨厌过于亲密的关系，而且真的很忙，除了文化课还有很多事情必须要做，告知了她她也依然粘人。 这种关系真的让我觉得很不舒服，我该怎么办呢？,0.3594573740249155,1.0,0.982720083624855
说跑就完了的我是不理解你谈恋爱是为了谈恋爱而谈恋爱还是因为喜欢对方而谈恋爱，“跑就完了”这种事情谁能做得到，如果真的爱对方的话最开始肯定是想修补的啊，修补不成功了受到伤害了才存在一个“跑”吧。我是不觉得有人能做到看到所爱的人有某种方面的问题就直接跑的。,说跑就完了的我是不理解你谈恋爱是为了谈恋爱而谈恋爱还是因为喜欢对方而谈恋爱，“跑就完了”这种事情谁能做得到，如果真的爱对方的话最开始肯定是想修补的啊，修补不成功了受到伤害了才存在一个“跑”吧。我是不觉得有人能做到看到所爱的人有某种方面的问题就直接跑的。,0.3594573740249155,1.0,0.7278748860984977
我是真的遇到渣男了，被我发现脚踩两条船，还跟我说要我相信他最喜欢的是我，后来从另一人那里知道他跟别人处对象但是一直对外保密，不知情的朋友给我俩牵线，他就顺理成章跟我交往了，我就这么被小三了，真是太狗血了，导致我现在对人不信任，容易往阴暗面想。,我是真的遇到渣男了，被我发现脚踩两条船，还跟我说要我相信他最喜欢的是我，后来从另一人那里知道他跟别人处对象但是一直对外保密，不知情的朋友给我俩牵线，他就顺理成章跟我交往了，我就这么被小三了，真是太狗血了，导致我现在对人不信任，容易往阴暗面想。,0.3594573740249155,1.0,0.7401059730275062
我觉得 现在很多人 不论男女 还有他们的父母 还没谈婚论嫁呢 就开始算计了 什么财产啊怎么才能不被别人分走 怎么才能让别人的财产属于自己-_-|| 也可能因为我是相亲吧 感觉大家都注重条件 我感觉爱情真的挺难的,我觉得 现在很多人 不论男女 还有他们的父母 还没谈婚论嫁呢 就开始算计了 什么财产啊怎么才能不被别人分走 怎么才能让别人的财产属于自己-_-|| 也可能因为我是相亲吧 感觉大家都注重条件 我感觉爱情真的挺难的,0.3594573740249155,1.0,0.7858264246354885
不爱沟通这个我真的窒息，我就想立马解决，他就是不主动沟通，我最后很累了，我宁愿吵一架拉倒，也不愿意冷战！,不爱沟通这个我真的窒息，我就想立马解决，他就是不主动沟通，我最后很累了，我宁愿吵一架拉倒，也不愿意冷战！,0.3594573740249155,1.0,0.724742674663422
唉，真的好烦啊，感觉就是什么东西都能条条框框了，我一直认为爱情这种东西是不被定义的，但是你这样讲的话就感觉他也是被定义了，哎，真的是算了，反正这个世界全部都是长方形的,唉，真的好烦啊，感觉就是什么东西都能条条框框了，我一直认为爱情这种东西是不被定义的，但是你这样讲的话就感觉他也是被定义了，哎，真的是算了，反正这个世界全部都是长方形的,0.40159477065724175,0.33622659986374615,0.2914934303558976
[灵魂出窍]稍微了解男人，或者了解人性后，真的对婚姻失望了。,稍微了解男人，或者了解人性后，真的对婚姻失望了。,0.3594573740249155,1.0,0.5899793075683785
我本科也是学经济的，非常认同UP的这些观点，因为道理真的是相通的，很多人都知道入市有风险投资需谨慎，为什么有人面对婚姻这么大的事可以那么随意，夫妻就是利益共同体，你不考虑你的合伙人资质、能力、秉性等，那就要靠运气了，可是谁敢说自己就是幸运儿，运气不好迟早暴雷。,我本科也是学经济的，非常认同UP的这些观点，因为道理真的是相通的，很多人都知道入市有风险投资需谨慎，为什么有人面对婚姻这么大的事可以那么随意，夫妻就是利益共同体，你不考虑你的合伙人资质、能力、秉性等，那就要靠运气了，可是谁敢说自己就是幸运儿，运气不好迟早暴雷。,0.3594573740249155,1.0,0.8640608467552195
真的很佩服这样的老一辈的教育家，用她们的知识灌溉了年轻一代，然后我们又接下责任教育好我们的下一代。李老师真的是用真心在讲解，希望年轻的一代在面对亲密关系的时候不要怕但是要有方法。最后真的很感激像李老师这样老一辈的还在继续传授经验与知识的教育者，希望有一天我也可以像你们一样。,真的很佩服这样的老一辈的教育家，用她们的知识灌溉了年轻一代，然后我们又接下责任教育好我们的下一代。李老师真的是用真心在讲解，希望年轻的一代在面对亲密关系的时候不要怕但是要有方法。最后真的很感激像李老师这样老一辈的还在继续传授经验与知识的教育者，希望有一天我也可以像你们一样。,0.3594573740249155,0.33622659986374615,0.528115784992544
我是江西的，从结婚那天开始，我就后悔了……她的假笑真的让我感觉吐了，两年时间，从发现精神出轨（深度追星半夜能喊出名字的那种），我一直都觉得两人待一起很怪，就是一点都不像情侣的那种！但是她觉得很正常，让我一度认为或许婚姻就是这样的，只是有人幸福指数高一点，有人低一点，然后第一次意外发现，她撒谎自己在哪，第一次发现，夜不归宿，第一次发现她是个混迹某博红薯的中度女权人士，附带精致利己主义者，第一次发现她也会穿吊带超短裙（我提醒过一次，穿可以，正常应该可以加一个防护会好一点，结果跟我说，不尊重女性～唉，我跟她说，这已经是我第三次好心提醒你了，第一次透明的裙子，第二次超短裤，我都是挡住，回家侧面提醒，露出来了，如果是别人，我真的懒得管）这些，我觉得还可以慢慢来，毕竟都30多的人了，流量明星会塌房，时间也会慢慢融洽到一起，加把劲，多挣点钱，生活更好了，应该就会变好的……直到最近，在她包里发现情趣用品，还是便携装还有小雨伞……我还是希望她可以说实话，我还是可以过去，我没有戳破，第二天她没有带那个包回来，我再次聊起了，她以往很反感关于性的问题，继续深入问到类似的情趣用品的问题，直接被打断，说我怎么这么恶心，说我有病！并强调自己不会用那些东西，（以前我买过，直接给我扔了，那时候我就很诧异，她怎么会一眼就认识的）然后我给她看照片，问她，不是我们用的，也不是你自己用的，那……只是反复强调为什么翻她包什么的……那一刻，我真感觉自己是个笑话！我真的对不起爸妈为我结婚支持的房车彩礼，本来这些钱我是准备拿去做事的……,我是江西的，从结婚那天开始，我就后悔了……她的假笑真的让我感觉吐了，两年时间，从发现精神出轨（深度追星半夜能喊出名字的那种），我一直都觉得两人待一起很怪，就是一点都不像情侣的那种！但是她觉得很正常，让我一度认为或许婚姻就是这样的，只是有人幸福指数高一点，有人低一点，然后第一次意外发现，她撒谎自己在哪，第一次发现，夜不归宿，第一次发现她是个混迹某博红薯的中度女权人士，附带精致利己主义者，第一次发现她也会穿吊带超短裙（我提醒过一次，穿可以，正常应该可以加一个防护会好一点，结果跟我说，不尊重女性～唉，我跟她说，这已经是我第三次好心提醒你了，第一次透明的裙子，第二次超短裤，我都是挡住，回家侧面提醒，露出来了，如果是别人，我真的懒得管）这些，我觉得还可以慢慢来，毕竟都多的人了，流量明星会塌房，时间也会慢慢融洽到一起，加把劲，多挣点钱，生活更好了，应该就会变好的……直到最近，在她包里发现情趣用品，还是便携装还有小雨伞……我还是希望她可以说实话，我还是可以过去，我没有戳破，第二天她没有带那个包回来，我再次聊起了，她以往很反感关于性的问题，继续深入问到类似的情趣用品的问题，直接被打断，说我怎么这么恶心，说我有病！并强调自己不会用那些东西，（以前我买过，直接给我扔了，那时候我就很诧异，她怎么会一眼就认识的）然后我给她看照片，问她，不是我们用的，也不是你自己用的，那……只是反复强调为什么翻她包什么的……那一刻，我真感觉自己是个笑话！我真的对不起爸妈为我结婚支持的房车彩礼，本来这些钱我是准备拿去做事的……,0.3594573740249155,1.0,0.9946259669076071
真的从前一直压力好大，大学啊，结婚啊，周围人眼光啊一堆压力，自从躺平之后，真的欲望都变少了，人也容易满足容易快乐了。反正就是打工人，世界没有我的位置，我就躺平，超容易满足，也超级快乐[doge],真的从前一直压力好大，大学啊，结婚啊，周围人眼光啊一堆压力，自从躺平之后，真的欲望都变少了，人也容易满足容易快乐了。反正就是打工人，世界没有我的位置，我就躺平，超容易满足，也超级快乐,0.3594573740249155,0.33622659986374615,0.33865350773885233
"我只看到你还没屁眼大的眼睛里装的全是钱[笑]
谈恋爱你半个字不提“爱”，还类比“投资”。我虽然不谈恋爱，甚至厌男，但我还真的从来没有如此践踏过恋爱、看轻过“爱情”。可不可耻啊你，还好意思把你这放不上台面的“三观”摆出来“仅供娱乐”",我只看到你还没屁眼大的眼睛里装的全是钱 谈恋爱你半个字不提“爱”，还类比“投资”。我虽然不谈恋爱，甚至厌男，但我还真的从来没有如此践踏过恋爱、看轻过“爱情”。可不可耻啊你，还好意思把你这放不上台面的“三观”摆出来“仅供娱乐”,0.3594573740249155,1.0,0.6148864092169587
"“必须先让自己安定下来”，非常赞同这一点。我理解为必须先有自己的生活。这是做出一切选择的基础。
做为80后，一路走到现在，我是非常不理解80 90后的父母辈的催婚行为的，其实更明智的做法是尽早让孩子有自己的生活……
我在疫情后搬出父母家，开始独居生活。时间一长，有很多事真的就慢慢变了……人一旦有了自己的生活，就会自然而然理解很多事情。从一开始的兴奋，到热度消退，再到习以为常，现在甚至有点麻木，开始明白父母辈的心情……
只有真正的经历过一个人的生活，才会真正思考一个终身伴侣对自己有多重要。年轻时候的口舌之快，往往经不住时间的鞭笞，他人生活的喜怒哀乐，有时会成为逃避自我的借口。
我是真的觉得一个人安定下来之后，自然而然就会知道自己想要什么。这个社会总是有这样那样的声音告诉我们应该这样那样，但其实我们就在这里，就在离自己心声最近的那个地方——名为“我”的存在的地方",“必须先让自己安定下来”，非常赞同这一点。我理解为必须先有自己的生活。这是做出一切选择的基础。 做为后，一路走到现在，我是非常不理解 后的父母辈的催婚行为的，其实更明智的做法是尽早让孩子有自己的生活…… 我在疫情后搬出父母家，开始独居生活。时间一长，有很多事真的就慢慢变了……人一旦有了自己的生活，就会自然而然理解很多事情。从一开始的兴奋，到热度消退，再到习以为常，现在甚至有点麻木，开始明白父母辈的心情…… 只有真正的经历过一个人的生活，才会真正思考一个终身伴侣对自己有多重要。年轻时候的口舌之快，往往经不住时间的鞭笞，他人生活的喜怒哀乐，有时会成为逃避自我的借口。 我是真的觉得一个人安定下来之后，自然而然就会知道自己想要什么。这个社会总是有这样那样的声音告诉我们应该这样那样，但其实我们就在这里，就在离自己心声最近的那个地方——名为“我”的存在的地方,0.3594573740249155,1.0,0.8923786020544845
up，你这个视频真的触动了我，我在去年11月开始了我人生中第一场恋爱，她是我的同事她追的我，在最开始的时候我真的感受到了爱，因为我这个人不是很高，她会安抚我说身高又不是最重要的，在我提出需要我们不在一起的时候也需要她的陪伴的时候，她也会改变自己给我分享她的日常。可在我沉浸于现实中规划未来的时候，过完年她跟我提出分手，她说在权衡利弊之后觉得我不是她真正喜欢的那个人，她说我在这段感情中没有做错，只是她对我的喜欢没到达恋人的程度。一开始我疯狂的找自己的原因，后面跟她沟通过后她说我没办法满足她喜欢的点，这些都是我没办法改变的。这三个月真的跟做梦一样，我以最热烈的真诚换来无疾而终的恋爱，自我感觉非常可惜。我用了11天，也就是到今天才真正的放下，终于可以抵御回忆，一遍又一遍告诉自己只是遇人不淑而已。视频的结尾是汉堡黄巡演，巧的是我最深最美好的记忆就是汉堡黄东莞巡演和她一起观看，获得了最美好的跨年记忆，但这也像烟花一样，在最灿烂的时刻戛然而止。,up，你这个视频真的触动了我，我在去年月开始了我人生中第一场恋爱，她是我的同事她追的我，在最开始的时候我真的感受到了爱，因为我这个人不是很高，她会安抚我说身高又不是最重要的，在我提出需要我们不在一起的时候也需要她的陪伴的时候，她也会改变自己给我分享她的日常。可在我沉浸于现实中规划未来的时候，过完年她跟我提出分手，她说在权衡利弊之后觉得我不是她真正喜欢的那个人，她说我在这段感情中没有做错，只是她对我的喜欢没到达恋人的程度。一开始我疯狂的找自己的原因，后面跟她沟通过后她说我没办法满足她喜欢的点，这些都是我没办法改变的。这三个月真的跟做梦一样，我以最热烈的真诚换来无疾而终的恋爱，自我感觉非常可惜。我用了天，也就是到今天才真正的放下，终于可以抵御回忆，一遍又一遍告诉自己只是遇人不淑而已。视频的结尾是汉堡黄巡演，巧的是我最深最美好的记忆就是汉堡黄东莞巡演和她一起观看，获得了最美好的跨年记忆，但这也像烟花一样，在最灿烂的时刻戛然而止。,1.0,1.0,0.9439944148622902
"说的太好了
她真的就像一面镜子，照见了我的的内心
看见了最真实的自己。
可能因为太久不照镜子，脸上的痘痘越来越多，但是自己并不自知，突然看到镜中的自己，脆弱，阴暗，懒惰，敏感，自我，固执……真的，被吓到了，但是这有什么办法呢？这就是真实的自己，我必须要去面对。
爱人先爱己，这是这段关系中我学到的，想要别人接纳你，喜欢你，爱护你，首先得要自己先做到，先做到自我满足，他人带给我们的处处是惊喜",说的太好了 她真的就像一面镜子，照见了我的的内心 看见了最真实的自己。 可能因为太久不照镜子，脸上的痘痘越来越多，但是自己并不自知，突然看到镜中的自己，脆弱，阴暗，懒惰，敏感，自我，固执……真的，被吓到了，但是这有什么办法呢？这就是真实的自己，我必须要去面对。 爱人先爱己，这是这段关系中我学到的，想要别人接纳你，喜欢你，爱护你，首先得要自己先做到，先做到自我满足，他人带给我们的处处是惊喜,0.3594573740249155,1.0,0.8104750434208658
刚失恋不久，想说如果有个人让你感觉不到爱，相信自己的感觉，而不是说服自己去理解他。有可能他真的不爱你，或者他爱你但是你们不合适。这都是可以分开的理由。一开始就找更合适自己更能让自己感受到爱的，比磨合着磨合着感情没了更好，明明一开始彼此相爱但是因为各种差异需要去磨合最后两个人都很疲惫互相怨恨分开真的太伤了,刚失恋不久，想说如果有个人让你感觉不到爱，相信自己的感觉，而不是说服自己去理解他。有可能他真的不爱你，或者他爱你但是你们不合适。这都是可以分开的理由。一开始就找更合适自己更能让自己感受到爱的，比磨合着磨合着感情没了更好，明明一开始彼此相爱但是因为各种差异需要去磨合最后两个人都很疲惫互相怨恨分开真的太伤了,0.7361487306815024,1.0,0.7786149347711164
"这个真的适合直男看（而且还渴望爱情的直男却不知怎么追），强烈安利做笔记
好处多多",这个真的适合直男看（而且还渴望爱情的直男却不知怎么追），强烈安利做笔记 好处多多,0.3594573740249155,1.0,0.6702668345700247
我是对方太亲密了我会疏远，疏远了又会想ta真的就这样淡了吗？如果是，我可能会难过一下然后说服自己:嗯没关系，反正我也不需要，该干啥干啥,我是对方太亲密了我会疏远，疏远了又会想ta真的就这样淡了吗？如果是，我可能会难过一下然后说服自己:嗯没关系，反正我也不需要，该干啥干啥,0.3594573740249155,1.0,0.7418837301448333
和我的初恋也是男朋友，现在已经谈了很多年了，这5点基本上没有发生过，感觉自己特别幸福[脱单doge]感觉自己真的很幸运,和我的初恋也是男朋友，现在已经谈了很多年了，这点基本上没有发生过，感觉自己特别幸福感觉自己真的很幸运,0.3594573740249155,1.0,0.6078681308216927
