comment,cleaned_comment,score1,score2,combined_score
别的家务我都能接受，我最喜欢洗厕所！晾衣服！香香的～但我很讨厌扫地拖地，我跟我老公说买个机器人吧，他说他拖地，过了几天他买了机器人[妙啊],别的家务我都能接受，我最喜欢洗厕所！晾衣服！香香的～但我很讨厌扫地拖地，我跟我老公说买个机器人吧，他说他拖地，过了几天他买了机器人,0.3594573740249155,1.0,0.6458213037530277
片中男主说是祖国人民大自然给他重新开始的勇气，但女主是靠这段盲目的婚姻慢慢变好的。这部电影我没看过只是看了这个视频，挺耐人寻味的哈哈，品到一丝规训的感觉了，感觉现在男性都接受不了女性不无私不奉献的样子[doge],片中男主说是祖国人民大自然给他重新开始的勇气，但女主是靠这段盲目的婚姻慢慢变好的。这部电影我没看过只是看了这个视频，挺耐人寻味的哈哈，品到一丝规训的感觉了，感觉现在男性都接受不了女性不无私不奉献的样子,0.3594573740249155,1.0,0.8624855877685629
我不介意是不是年輕的 我看他本身有什麼值得我交往的。大一點的只要不嘰嘰歪歪，樣貌保持得好，我能接受的。如果年齡小 在搞七搞八 我也不會要的。和年齡無關，和人本身有關,我不介意是不是年輕的 我看他本身有什麼值得我交往的。大一點的只要不嘰嘰歪歪，樣貌保持得好，我能接受的。如果年齡小 在搞七搞八 我也不會要的。和年齡無關，和人本身有關,0.3594573740249155,1.0,0.7175972942170976
消费观念不一样，别勉强。 男方每个月2万，女方5000。一点都不亏。 计较别的，男的接受不了。  换个人，两个人都能过好。,消费观念不一样，别勉强。 男方每个月万，女方。一点都不亏。 计较别的，男的接受不了。 换个人，两个人都能过好。,0.0,0.33622659986374615,0.29577610518451036
我特别好奇，请问这位男士，如果你在和她处了四年之后突然发现她手机里有信息说她堕过胎，你还会像现在一样挽留她吗？不会生气吗？己所不欲勿施于人这句话对谁都适用。奉劝各位，如果恋爱期间发现对方有一个自己很讨厌的缺点，你要考虑之后几十年能否接受这个缺点，不行就撤，别留恋。为了几年感情又搭进去后面几十年，亏不亏啊,我特别好奇，请问这位男士，如果你在和她处了四年之后突然发现她手机里有信息说她堕过胎，你还会像现在一样挽留她吗？不会生气吗？己所不欲勿施于人这句话对谁都适用。奉劝各位，如果恋爱期间发现对方有一个自己很讨厌的缺点，你要考虑之后几十年能否接受这个缺点，不行就撤，别留恋。为了几年感情又搭进去后面几十年，亏不亏啊,0.3594573740249155,1.0,0.903551213380063
我不想生孩子，我博士毕业就28了，辛苦努力学习了这么多年，还没有享受过美好生活，突然就要生孩子，我不能接受。我努力运动，减肥，护肤，生了孩子会功亏一篑。我努力学习，生了孩子会影响我找工作。,我不想生孩子，我博士毕业就了，辛苦努力学习了这么多年，还没有享受过美好生活，突然就要生孩子，我不能接受。我努力运动，减肥，护肤，生了孩子会功亏一篑。我努力学习，生了孩子会影响我找工作。,1.0,1.0,0.7070127698860879
期待up的后续。学生时期我就觉得虽然追我时间久的人好选择，但我始终觉得这是一段不平等关系所以一直没接受。这下说通了，就是如果我接受了对方，对方反而会在后期博弈回来，本能感觉这样很累吧，一开始就不平等的交往还是不要开始的好。后面也是我目前意识到的问题，对这话题很感兴趣。,期待up的后续。学生时期我就觉得虽然追我时间久的人好选择，但我始终觉得这是一段不平等关系所以一直没接受。这下说通了，就是如果我接受了对方，对方反而会在后期博弈回来，本能感觉这样很累吧，一开始就不平等的交往还是不要开始的好。后面也是我目前意识到的问题，对这话题很感兴趣。,0.3594573740249155,1.0,0.9012930560146497
其实可以适当的调和，鉴于看视频的各位都大概知道中美的约会方式，每个人都有自己的接受程度，我相信中国也有很多人完全接受美国的约会节奏，反之亦然。所以还是得看你约会的那个人[脱单doge],其实可以适当的调和，鉴于看视频的各位都大概知道中美的约会方式，每个人都有自己的接受程度，我相信中国也有很多人完全接受美国的约会节奏，反之亦然。所以还是得看你约会的那个人,0.3594573740249155,1.0,0.7494558734689455
我可以接受我的对象跟我住对门，但是同居还是算了，结婚就更不可能了[再见]我是各种意义上的自由人不要来捆绑我谢谢,我可以接受我的对象跟我住对门，但是同居还是算了，结婚就更不可能了我是各种意义上的自由人不要来捆绑我谢谢,0.3594573740249155,1.0,0.7229817045083307
喜欢不一定爱，爱不一定喜欢，爱人先爱己。世间没有那对多六边形战士，看一个不要光看他的优点，要看你能不能接受他的缺点，多数人的一生都是平淡的一生，生活的是柴米油盐酱醋茶，经济基础不做为首要条件但一定要考虑进去。,喜欢不一定爱，爱不一定喜欢，爱人先爱己。世间没有那对多六边形战士，看一个不要光看他的优点，要看你能不能接受他的缺点，多数人的一生都是平淡的一生，生活的是柴米油盐酱醋茶，经济基础不做为首要条件但一定要考虑进去。,0.3594573740249155,1.0,0.779630450118444
坐小桌这事不同意沈老师的说法，这种比较有争议的风俗习惯应该提前告知，接不接受是这个女生的事，就算男生不是主观恶意，但行为上却默认这个女生要接受这个习俗。,坐小桌这事不同意沈老师的说法，这种比较有争议的风俗习惯应该提前告知，接不接受是这个女生的事，就算男生不是主观恶意，但行为上却默认这个女生要接受这个习俗。,0.40159477065724175,0.0,0.35379089535696284
习俗和观念差别太大的话，哪怕将就结婚了也很难过得开心。也没必要都指责这个女生，喜欢这个人但是接受不了他背后的习俗也是挺正常的一件事，毕竟国内几十年不均衡发展，各地差别很大。婚前谨慎，在这件事上她并没有错。,习俗和观念差别太大的话，哪怕将就结婚了也很难过得开心。也没必要都指责这个女生，喜欢这个人但是接受不了他背后的习俗也是挺正常的一件事，毕竟国内几十年不均衡发展，各地差别很大。婚前谨慎，在这件事上她并没有错。,0.3594573740249155,1.0,0.7711865261004383
