comment,cleaned_comment,score1,score2,combined_score
异地恋虽让情侣考验增多，但可能正是如此，也会让真正适合的人感情更坚固。我与女友也是本科、研究生异地，现在已经互相支持着共同走过了8年，我们相信最终会在同一个城市落脚，也相信彼此会陪伴着走完人生路。不巧的是，原本年初要结婚，因为疫情暂时推迟了婚礼，些微遗憾，希望未来的我们也像你们一样美满幸福。[鸡腿],异地恋虽让情侣考验增多，但可能正是如此，也会让真正适合的人感情更坚固。我与女友也是本科、研究生异地，现在已经互相支持着共同走过了年，我们相信最终会在同一个城市落脚，也相信彼此会陪伴着走完人生路。不巧的是，原本年初要结婚，因为疫情暂时推迟了婚礼，些微遗憾，希望未来的我们也像你们一样美满幸福。,1.0,1.0,0.9564843265840481
异地恋，要相信对方，这样四个人的感情都不会破裂,异地恋，要相信对方，这样四个人的感情都不会破裂,0.3594573740249155,1.0,0.7220878504599664
"异地恋一旦欺骗过对方一次，就很难让TA再相信你了 ,尽管只是日常中一些小事 。信任是异地恋长久的最基本条件 ,生活中的每一件小事都应该如实跟TA说","异地恋一旦欺骗过对方一次，就很难让TA再相信你了 ,尽管只是日常中一些小事 。信任是异地恋长久的最基本条件 ,生活中的每一件小事都应该如实跟TA说",0.3594573740249155,1.0,0.6617070857905889
"我是4年的感情，两年异地，因为读大学而开始。本来不相信异地恋的我因为他相信我们可以，觉得一定能走下去而坚定了下来，一个人在离家几千公里的地方上学，默默忍受，期待着毕业后去找他一起过想要的生活。

后来他出轨了，去约炮了。",我是年的感情，两年异地，因为读大学而开始。本来不相信异地恋的我因为他相信我们可以，觉得一定能走下去而坚定了下来，一个人在离家几千公里的地方上学，默默忍受，期待着毕业后去找他一起过想要的生活。 后来他出轨了，去约炮了。,0.3594573740249155,1.0,0.7649284190141044
回信息这种我是跟ben一样的想法 就是如果跟人确认关系會相信别人,回信息这种我是跟ben一样的想法 就是如果跟人确认关系會相信别人,0.40159477065724175,0.4632039205553255,0.4843505236988823
爱情我不谈，它从来都是剖析的禁区，我们可以一面使用公式一样的伎俩去操控它，也要一面去相信它的可能与伟大。,爱情我不谈，它从来都是剖析的禁区，我们可以一面使用公式一样的伎俩去操控它，也要一面去相信它的可能与伟大。,0.3594573740249155,1.0,0.5838402905805926
"1.不要相信别人，相信自己。
今天的你，是那个有勇气离开的你，这是学会相信自己的关键。你已经学会了如何处理某些情况，学会了如何更快离开，学会了识别危险信号。
你不需要相信别人永远不会背叛你，你只需要晓得别人这么做了，你自己可以承受，你可以离开。
2.关于信任的标准
我要的爱情，不能这么窝囊，要给彼此足够大的空间，大到有机会对我不忠，足以伤害我，足以让你做错事，如果你不背叛我仅仅是因为我盯着你，这样要如何了解你的真心呢？我只能给你完全的自由，才可能知道你是否足够忠于我。
所以无论如何我都得相信（对方），不是因为我很确信你绝对不会背叛我，我给你信任，因为这是我想要的感情的最低标准。",.不要相信别人，相信自己。 今天的你，是那个有勇气离开的你，这是学会相信自己的关键。你已经学会了如何处理某些情况，学会了如何更快离开，学会了识别危险信号。 你不需要相信别人永远不会背叛你，你只需要晓得别人这么做了，你自己可以承受，你可以离开。 .关于信任的标准 我要的爱情，不能这么窝囊，要给彼此足够大的空间，大到有机会对我不忠，足以伤害我，足以让你做错事，如果你不背叛我仅仅是因为我盯着你，这样要如何了解你的真心呢？我只能给你完全的自由，才可能知道你是否足够忠于我。 所以无论如何我都得相信（对方），不是因为我很确信你绝对不会背叛我，我给你信任，因为这是我想要的感情的最低标准。,0.3594573740249155,1.0,1.0
无论如何我都得相信，不是因为我很确信你绝对不会背叛我，我信任你因为这是我想要的感情的最低标准。,无论如何我都得相信，不是因为我很确信你绝对不会背叛我，我信任你因为这是我想要的感情的最低标准。,0.3594573740249155,1.0,0.788653360087809
说的太对了 爱 就不要怕被伤害 伤害了 要有勇气转身离开 不是努力去相信对方 而是学会相信自己。,说的太对了 爱 就不要怕被伤害 伤害了 要有勇气转身离开 不是努力去相信对方 而是学会相信自己。,0.3594573740249155,1.0,0.6423355290232692
太棒了！之前的我一直因为害怕感情中的背叛和离开而十分拒绝开始一段恋爱关系。而现在想想，就算最坏又如何，你依旧有选择权，想太多没有用的。最关键的是相信自己呀,太棒了！之前的我一直因为害怕感情中的背叛和离开而十分拒绝开始一段恋爱关系。而现在想想，就算最坏又如何，你依旧有选择权，想太多没有用的。最关键的是相信自己呀,0.3594573740249155,1.0,0.7813528927596534
是的呀，我前女友就觉得，哦我稍微评价一下她的妆，就很不好，很男凝，她很相信网上那些个说法。但仔细一想，我好像也没办法，完全不受网络上一些东西的影响。,是的呀，我前女友就觉得，哦我稍微评价一下她的妆，就很不好，很男凝，她很相信网上那些个说法。但仔细一想，我好像也没办法，完全不受网络上一些东西的影响。,0.3594573740249155,1.0,0.744920198157527
我曾经是焦虑型，无论是朋友还是恋人都会焦虑。后来知道了安全感从来不要期待别人给自己，安全感都是自己给的，对自己越自信，相信自己值得被爱，就越能在亲密关系里面感到安全。之后就好特别多，虽然有时候还是会瞎想，但学会了自我安抚，比如离开了你我也不是不会再被爱，也许这只是我过度担忧之类的，并且我男票也能做出一些举动让我觉得他爱我，在我瞎想的时候打断我，慢慢的我就变成安全型了。虽然我俩都还有很多不足，但我相信只要用心就能慢慢克服。,我曾经是焦虑型，无论是朋友还是恋人都会焦虑。后来知道了安全感从来不要期待别人给自己，安全感都是自己给的，对自己越自信，相信自己值得被爱，就越能在亲密关系里面感到安全。之后就好特别多，虽然有时候还是会瞎想，但学会了自我安抚，比如离开了你我也不是不会再被爱，也许这只是我过度担忧之类的，并且我男票也能做出一些举动让我觉得他爱我，在我瞎想的时候打断我，慢慢的我就变成安全型了。虽然我俩都还有很多不足，但我相信只要用心就能慢慢克服。,0.3594573740249155,1.0,0.9867941024276761
我是第三种，家里缺少强有力的家长，所以我现在谁也不相信，明明我没受过情感伤，但就是莫名其妙不信别人,我是第三种，家里缺少强有力的家长，所以我现在谁也不相信，明明我没受过情感伤，但就是莫名其妙不信别人,0.0,0.33622659986374615,0.33139946560350364
我觉得up说的特别现实就是，那么多特质放一起的人为什么会喜欢我，其实大部分人都是普通人，什么小说男主型的男人真的很少，就算有也很难接触到，所以我觉得性格合得来三观合得来就挺不容易的了[笑哭] 当然我一直都相信只有我自己更优秀了才会遇到更好的人,我觉得up说的特别现实就是，那么多特质放一起的人为什么会喜欢我，其实大部分人都是普通人，什么小说男主型的男人真的很少，就算有也很难接触到，所以我觉得性格合得来三观合得来就挺不容易的了 当然我一直都相信只有我自己更优秀了才会遇到更好的人,0.3594573740249155,1.0,0.8794195332153971
我老公也穷，但上进，能吃苦。日子在一天天变好。公婆也穷，但努力，凭他们能力在城里能买上套几十万的小产权，我觉得已经尽力了。[喜极而泣]所以，穷根本不是事，又懒又穷又理直气壮地躺平才是最可怕的！（顺便夸夸我婆家[doge]除了穷点，真的找不出一点不好[偷笑]我相信也是暂时穷一穷，毕竟从爷爷辈起，根基差到狗都嫌）,我老公也穷，但上进，能吃苦。日子在一天天变好。公婆也穷，但努力，凭他们能力在城里能买上套几十万的小产权，我觉得已经尽力了。所以，穷根本不是事，又懒又穷又理直气壮地躺平才是最可怕的！（顺便夸夸我婆家除了穷点，真的找不出一点不好我相信也是暂时穷一穷，毕竟从爷爷辈起，根基差到狗都嫌）,0.3594573740249155,1.0,0.8638329123977848
"弹幕有一些男生的发言，简直是食古不化。
宁愿坚信自己的偏见，也不愿相信更科学的统计数据。好像把找不到对象的问题推到那些一出生就注定的因素上，把当今社会的女性想的越烂、越现实，就能够继续蒙蔽自己，遮掩自己性格上的缺陷，而不是保持真诚的态度，从切实可以改变的地方着手，提升自己，在自己变得更好的同时，期盼着未来那位优秀的，能够携手并行的伴侣。
真令人惋惜。",弹幕有一些男生的发言，简直是食古不化。 宁愿坚信自己的偏见，也不愿相信更科学的统计数据。好像把找不到对象的问题推到那些一出生就注定的因素上，把当今社会的女性想的越烂、越现实，就能够继续蒙蔽自己，遮掩自己性格上的缺陷，而不是保持真诚的态度，从切实可以改变的地方着手，提升自己，在自己变得更好的同时，期盼着未来那位优秀的，能够携手并行的伴侣。 真令人惋惜。,0.3594573740249155,1.0,0.8893837183516835
我只想以后人工智能配合大数据直接给我分配一个最合适的，我相信一定会比我自己一个人瞎找和相亲找到的合适的多。,我只想以后人工智能配合大数据直接给我分配一个最合适的，我相信一定会比我自己一个人瞎找和相亲找到的合适的多。,0.3594573740249155,1.0,0.7639266713384893
真好，之前是自己说话太重了！对不起学长学姐。两个人都如此相爱并且为了这个家庭愿意解决问题，相信你们的感情一定会越来越好的，希望你们幸福快乐~,真好，之前是自己说话太重了！对不起学长学姐。两个人都如此相爱并且为了这个家庭愿意解决问题，相信你们的感情一定会越来越好的，希望你们幸福快乐~,0.3594573740249155,1.0,0.7504400820821548
"一，如果up主处于长期关系中，不是应该讲实操吗？我如何奴役、控制对方或我如何被奴役被控制，我由此获得怎样的幸福。相信这种视频流量会很高。
二、如果up主不处于长期关系中，说明这套理论up主自己实操不成功。
我的逻辑有问题吗？？？",一，如果up主处于长期关系中，不是应该讲实操吗？我如何奴役、控制对方或我如何被奴役被控制，我由此获得怎样的幸福。相信这种视频流量会很高。 二、如果up主不处于长期关系中，说明这套理论up主自己实操不成功。 我的逻辑有问题吗？？？,0.3594573740249155,1.0,0.8548272039353425
两个人在一起感觉舒服真的巨巨巨重要！！！It just feels right! Naturally. 所以，双方都应该相信自己的直觉。强扭的瓜不甜，不要勉强就是这个道理。,两个人在一起感觉舒服真的巨巨巨重要！！！It just feels right! Naturally. 所以，双方都应该相信自己的直觉。强扭的瓜不甜，不要勉强就是这个道理。,0.3594573740249155,1.0,0.8424506519531938
up主和我有一点近似的情况，我和女朋友也是相遇三年的跨国情侣，我一直在外国读书，去年年底毕业因为一些原因回国，现在虽然有四五个月没见了但是也坚定了对方是我生命里不可缺少的人这个想法，下半年女朋友会来国内，相信我也会从不远的将来从跨国情侣到跨国夫妻。,up主和我有一点近似的情况，我和女朋友也是相遇三年的跨国情侣，我一直在外国读书，去年年底毕业因为一些原因回国，现在虽然有四五个月没见了但是也坚定了对方是我生命里不可缺少的人这个想法，下半年女朋友会来国内，相信我也会从不远的将来从跨国情侣到跨国夫妻。,0.3594573740249155,1.0,0.7766490453206658
女友母亲极度虔诚基督徒，相信神迹，会花钱出去学习所谓的基督课程，晚上睡不着会起来祈祷，每天必去教堂，经常说会看见天使以及去世亲人下炼狱或者上天堂，我都快被整疯了，女友也信神迹，我是无神论，这样能在一起吗？,女友母亲极度虔诚基督徒，相信神迹，会花钱出去学习所谓的基督课程，晚上睡不着会起来祈祷，每天必去教堂，经常说会看见天使以及去世亲人下炼狱或者上天堂，我都快被整疯了，女友也信神迹，我是无神论，这样能在一起吗？,0.3594573740249155,1.0,0.9993414237571632
啊，说的太对了，我就是一有信仰的人，我一直在打破束缚但我还是会在生活的一些方面遵守我的信仰并仍旧受信仰影响，我希望哪怕我自己打破信仰的束缚和我的恋人在一起，他也可以尊重我所坚持的和相信的东西而不是高高在上的去诋毁它们,啊，说的太对了，我就是一有信仰的人，我一直在打破束缚但我还是会在生活的一些方面遵守我的信仰并仍旧受信仰影响，我希望哪怕我自己打破信仰的束缚和我的恋人在一起，他也可以尊重我所坚持的和相信的东西而不是高高在上的去诋毁它们,0.3594573740249155,1.0,0.6732738597206618
比较相信，婚姻想要幸福，男的得是恋爱脑[呲牙],比较相信，婚姻想要幸福，男的得是恋爱脑,0.3594573740249155,1.0,0.7091031412588884
