comment,cleaned_comment,score1,score2,combined_score
原来如此，因为我心里藏着一个人，他不知道，但是我很开心。即使偶尔遇见渣男，我也能笑着转身，因为我心里藏着一个人，没有男人能入心。也就没有人能伤我的心。,原来如此，因为我心里藏着一个人，他不知道，但是我很开心。即使偶尔遇见渣男，我也能笑着转身，因为我心里藏着一个人，没有男人能入心。也就没有人能伤我的心。,0.3594573740249155,1.0,0.6082055220467082
姐姐说得好！女生就是需要有自己的事业实现自己的价值，势均力敌的爱情中需要双方在一个平等的位置上。而事业，财富都是男人绑不住你的资本，如果说男人和事业一个是感性一个是理性，那么理性的事业不会变质，就算感情出了问题女生也照样可以生活得很好。,姐姐说得好！女生就是需要有自己的事业实现自己的价值，势均力敌的爱情中需要双方在一个平等的位置上。而事业，财富都是男人绑不住你的资本，如果说男人和事业一个是感性一个是理性，那么理性的事业不会变质，就算感情出了问题女生也照样可以生活得很好。,0.3594573740249155,1.0,0.6983194685072172
会做家务的男人谁能拒绝。。。,会做家务的男人谁能拒绝。。。,0.40159477065724175,0.4320558161628193,0.336075495725448
确实。男人天性里还是有些大男子主义的。女人不要强行改造得像猫一样的温柔。更别想当自己是女王。男人是你的奴才一样。男人天性还是想拼博赚钱养家糊口。庇佑妻儿的。女人要结婚只要保留一二项核心条件就行了。不要什么都由女人掌握。比喻家庭开支。男人一万月入的。你说明钱怎么怎么花。也适当留一点给男人放松一下。只要男人不涉及你的核心就行了。找几个朋友出去吃个宵夜喝点小酒吹吹牛这些，不要干涉他。反过来。男人也会觉得老婆懂得顾家。不会轻易搞三搞四的。更重要的是在朋友同事面前觉得光荣。这样男人会更爱护家庭的。浪漫一点的还会时不时给女人一些小惊喜[打call]这些才是真正的幸福生活。而不是女人当女王就幸福。你幸福了想过老公没有？真爱老公的会把他当奴隶一样供你享乐？？？,确实。男人天性里还是有些大男子主义的。女人不要强行改造得像猫一样的温柔。更别想当自己是女王。男人是你的奴才一样。男人天性还是想拼博赚钱养家糊口。庇佑妻儿的。女人要结婚只要保留一二项核心条件就行了。不要什么都由女人掌握。比喻家庭开支。男人一万月入的。你说明钱怎么怎么花。也适当留一点给男人放松一下。只要男人不涉及你的核心就行了。找几个朋友出去吃个宵夜喝点小酒吹吹牛这些，不要干涉他。反过来。男人也会觉得老婆懂得顾家。不会轻易搞三搞四的。更重要的是在朋友同事面前觉得光荣。这样男人会更爱护家庭的。浪漫一点的还会时不时给女人一些小惊喜这些才是真正的幸福生活。而不是女人当女王就幸福。你幸福了想过老公没有？真爱老公的会把他当奴隶一样供你享乐？？？,0.3594573740249155,1.0,0.7368477312736877
男人一定要清醒，娶妻娶贤，不要只看脸，不要只看脸，不要只看脸。否则后果自负。,男人一定要清醒，娶妻娶贤，不要只看脸，不要只看脸，不要只看脸。否则后果自负。,0.40159477065724175,1.0,0.6196171579142091
"我其实在恋爱时，大部分时候也是自己解决，一来我觉得看片里那些比女朋友刺激，二来可能是自己不喜欢亏欠感[辣眼睛]。
  因为大部分女性会把自己和男人发生关系，自然的当作一种筹码，我要是求的多就欠的多，也怪自己太要脸了[笑哭]，现在已经喜欢单身，不准备结婚了，和对自己有所求的人住在一起，太累了",我其实在恋爱时，大部分时候也是自己解决，一来我觉得看片里那些比女朋友刺激，二来可能是自己不喜欢亏欠感。 因为大部分女性会把自己和男人发生关系，自然的当作一种筹码，我要是求的多就欠的多，也怪自己太要脸了，现在已经喜欢单身，不准备结婚了，和对自己有所求的人住在一起，太累了,0.3594573740249155,1.0,0.6629157488956571
日本情侣约会更接受aa制的消费观，之前听一个日本妹纸也是这么说。但我们这边有些女的认为约会就应该男人付钱，甚至有男人不愿意为你花钱就是不爱你的说法。,日本情侣约会更接受aa制的消费观，之前听一个日本妹纸也是这么说。但我们这边有些女的认为约会就应该男人付钱，甚至有男人不愿意为你花钱就是不爱你的说法。,0.3594573740249155,1.0,0.7931138434724503
我爸从小给我说上的好不如专业选的好，专业选的好不如工作选的好，工作选的好不如嫁的好[doge][doge]看吧，最终兜兜转转还是要被依附男人，而他却看不到我的专业，我的工作，以前我还小的时候还会听。现在我直接反驳他，无论在什么场合，他说这句话我都会说他是陈旧的思想，现在是新时代，女生也可以通过自己的劳动来创造财富，获得自己想要的生活,我爸从小给我说上的好不如专业选的好，专业选的好不如工作选的好，工作选的好不如嫁的好看吧，最终兜兜转转还是要被依附男人，而他却看不到我的专业，我的工作，以前我还小的时候还会听。现在我直接反驳他，无论在什么场合，他说这句话我都会说他是陈旧的思想，现在是新时代，女生也可以通过自己的劳动来创造财富，获得自己想要的生活,0.3594573740249155,1.0,0.7241933857393922
一定不要对男人太好，他会有恃无恐，然后跑去做时间管理大师,一定不要对男人太好，他会有恃无恐，然后跑去做时间管理大师,0.3594573740249155,1.0,0.6094468419532374
男人对待爱情非常理性残酷，他不喜欢你，勉强和你在一起，以后大概率要出轨，找小三，分手。古往今来皆是如此，如果男的不真心喜欢你还靠近你，你最好保持警惕，那绝对是有利可图才来的。,男人对待爱情非常理性残酷，他不喜欢你，勉强和你在一起，以后大概率要出轨，找小三，分手。古往今来皆是如此，如果男的不真心喜欢你还靠近你，你最好保持警惕，那绝对是有利可图才来的。,0.3594573740249155,1.0,0.7051894133933134
男人专注自身变强就行了，等你某方面强大到自信了自然不缺女人，说简单点学习好或者打游戏好都能吸引女生 ，当然更直观的还是挣钱厉害最好[奥比岛_点赞],男人专注自身变强就行了，等你某方面强大到自信了自然不缺女人，说简单点学习好或者打游戏好都能吸引女生 ，当然更直观的还是挣钱厉害最好,0.40159477065724175,0.4632039205553255,0.4928555312844286
"唉，感触有点多。
源姨说的那个逃跑的父亲，很早之前我看过类似的故事。故事里的男人在车祸来临的时候先护着自己，没首先保护自己怀孕的妻子，危机过去后妻子寒心，要打掉孩子，男人羞愧得上吊自杀。那个时候我就没想明白为什么给这个男人的惩罚要这么重，我并不觉得人在危机时屈服于求生本能是个不可原谅的错误，要是故事停留在妻子打掉孩子离婚是合理的，但上吊自杀，我觉得他罪不至此。
其次，我看着我爸被房贷车贷消耗了大半辈子，我不明白为什么男人总是那么理所当然地被要求当顶梁柱，被要求有车有房，不能逃避，不能软弱，当顶梁柱真的很累啊。
最后，男人总是为难男人，很多时候蔑视，贬低，打击男性的就是另一个男性。更可悲的是，这是种社会共识，被为难的男性自己也认同。他们是受害者，也是加害者。",唉，感触有点多。 源姨说的那个逃跑的父亲，很早之前我看过类似的故事。故事里的男人在车祸来临的时候先护着自己，没首先保护自己怀孕的妻子，危机过去后妻子寒心，要打掉孩子，男人羞愧得上吊自杀。那个时候我就没想明白为什么给这个男人的惩罚要这么重，我并不觉得人在危机时屈服于求生本能是个不可原谅的错误，要是故事停留在妻子打掉孩子离婚是合理的，但上吊自杀，我觉得他罪不至此。 其次，我看着我爸被房贷车贷消耗了大半辈子，我不明白为什么男人总是那么理所当然地被要求当顶梁柱，被要求有车有房，不能逃避，不能软弱，当顶梁柱真的很累啊。 最后，男人总是为难男人，很多时候蔑视，贬低，打击男性的就是另一个男性。更可悲的是，这是种社会共识，被为难的男性自己也认同。他们是受害者，也是加害者。,0.40159477065724175,0.33622659986374615,0.5751996477552366
"啊哈哈哈，科幻片，女朋友老是拿抖音里宣传有利女性的要求来要求我。
1.女朋友跟你作是爱你的表现，真正爱你的男人会包容你的一切
2.吵架的时候不管是谁的错，男生都要先低头，不然他肯定不够爱你。
3.永远不要跟女生讲道理，哄就完了，得包容她的所有小脾气。
4.真爱就是要包容她的所有，宠着她，发脾气他会永远耐心哄你，你做错事了他也永远不舍得生你的气，只会默默处理好后续事情，轻而易举地原谅你。
5.你负责挣钱养家，我负责貌美如花，我打扮漂亮还不是为了给你争面子
6.有心者不用教，无心者教不会，说了你也不懂。
7.你是不是觉得你为我做了很多？你都做过点啥？
8.看你表现吧
9.下一个更好，下一个更乖。
10.嫁给把你当女儿宠的男人，把女朋友宠上天的男人最有责任感
11.结婚后工资全部交给老婆保管
12.恋爱里男女是不平等的，男生就应该多照顾女生，女生应该有特权。",啊哈哈哈，科幻片，女朋友老是拿抖音里宣传有利女性的要求来要求我。 .女朋友跟你作是爱你的表现，真正爱你的男人会包容你的一切 .吵架的时候不管是谁的错，男生都要先低头，不然他肯定不够爱你。 .永远不要跟女生讲道理，哄就完了，得包容她的所有小脾气。 .真爱就是要包容她的所有，宠着她，发脾气他会永远耐心哄你，你做错事了他也永远不舍得生你的气，只会默默处理好后续事情，轻而易举地原谅你。 .你负责挣钱养家，我负责貌美如花，我打扮漂亮还不是为了给你争面子 .有心者不用教，无心者教不会，说了你也不懂。 .你是不是觉得你为我做了很多？你都做过点啥？ .看你表现吧 .下一个更好，下一个更乖。 .嫁给把你当女儿宠的男人，把女朋友宠上天的男人最有责任感 .结婚后工资全部交给老婆保管 .恋爱里男女是不平等的，男生就应该多照顾女生，女生应该有特权。,0.5350482592176715,1.0,0.7989948655160073
男人的鸡贼体现得淋漓尽致，用爱白嫖生育价值。生不生孩子，看的是钱，身体素质，时间，精力，劳动，责任感是否到位，爱是最末位的因素。,男人的鸡贼体现得淋漓尽致，用爱白嫖生育价值。生不生孩子，看的是钱，身体素质，时间，精力，劳动，责任感是否到位，爱是最末位的因素。,0.3594573740249155,1.0,0.6977682866378677
建议大家去玩玩社交软件，去看看真实的男人(大多数)，能很直白的说出“除了生育价值，女的有啥价值。”“家庭主妇就是懒”甚至部分人渣故意找有家庭的女性求交往等等放到这里不让说的价值观。所以奉劝每一位女性想好再谈结婚。,建议大家去玩玩社交软件，去看看真实的男人(大多数)，能很直白的说出“除了生育价值，女的有啥价值。”“家庭主妇就是懒”甚至部分人渣故意找有家庭的女性求交往等等放到这里不让说的价值观。所以奉劝每一位女性想好再谈结婚。,0.3594573740249155,1.0,0.6811848717712696
神特么传统的男人婚后乱搞[笑哭],神特么传统的男人婚后乱搞,0.3594573740249155,1.0,0.550440006691828
那这些处于弱势的女人是怎么来的呢，还不是千百年来男人打压的结果，现在的女人看似得到解放了实际上呢，照样是处于弱势，还有因为资本主义的洗脑变得拜金，就显得更肤浅了而且有太多的家庭都把女人养成所谓的公主，让她们学芭蕾舞学怎么变得美丽，然后外表好看实际是就是一个花瓶，找一个好男人依附一辈子过得体体面面的但是没有任何的抗风险能力，其实这也算是不错了，怕就怕找不到这样的男人或者找到了又因为各种原因而失去了，这才是最糟糕的，我如果有一个女儿我决不让她学那些华而不实的东西我会教她学会坚强，像男人一样坚强就是有独自面对残酷现实的勇气和能力，不一定非要美丽更不一定非要优雅，我只要她坚强,那这些处于弱势的女人是怎么来的呢，还不是千百年来男人打压的结果，现在的女人看似得到解放了实际上呢，照样是处于弱势，还有因为资本主义的洗脑变得拜金，就显得更肤浅了而且有太多的家庭都把女人养成所谓的公主，让她们学芭蕾舞学怎么变得美丽，然后外表好看实际是就是一个花瓶，找一个好男人依附一辈子过得体体面面的但是没有任何的抗风险能力，其实这也算是不错了，怕就怕找不到这样的男人或者找到了又因为各种原因而失去了，这才是最糟糕的，我如果有一个女儿我决不让她学那些华而不实的东西我会教她学会坚强，像男人一样坚强就是有独自面对残酷现实的勇气和能力，不一定非要美丽更不一定非要优雅，我只要她坚强,0.3594573740249155,0.33622659986374615,0.40250049313191727
结了婚的男人，往往自我认同感达到顶峰，哪怕在社会上多无能，多不显眼，他们都可以在家庭中找到自我的认同感，可以在自己的老婆孩子上竖立起威严决断的一家之主形象。所以想要得到男人的喜欢，只有一个办法就是变顺从，无论是真顺从，还是假顺从，必须要让男人感觉到你的顺从，只有女人顺从，他们才能决定自己和你交往是在自己掌控之中的。所以女人其他方面的优秀在男人眼里无足轻重，只要她能给他带来世俗意义上的荣誉，就可以让男人对一个女人倾心，过去希望多子多福，有极大生育价值的女性就是男人的追求，社会看重貌美，美女就是男人的追求，社会风气喜欢小脚女人，无数风流墨客都以小脚为好，还荒唐的写出不少诗词歌赋。至于男人们是否真的喜欢这样的女性，谁又在乎呢？,结了婚的男人，往往自我认同感达到顶峰，哪怕在社会上多无能，多不显眼，他们都可以在家庭中找到自我的认同感，可以在自己的老婆孩子上竖立起威严决断的一家之主形象。所以想要得到男人的喜欢，只有一个办法就是变顺从，无论是真顺从，还是假顺从，必须要让男人感觉到你的顺从，只有女人顺从，他们才能决定自己和你交往是在自己掌控之中的。所以女人其他方面的优秀在男人眼里无足轻重，只要她能给他带来世俗意义上的荣誉，就可以让男人对一个女人倾心，过去希望多子多福，有极大生育价值的女性就是男人的追求，社会看重貌美，美女就是男人的追求，社会风气喜欢小脚女人，无数风流墨客都以小脚为好，还荒唐的写出不少诗词歌赋。至于男人们是否真的喜欢这样的女性，谁又在乎呢？,0.3594573740249155,1.0,0.7588382163789065
赞同，不比较那个事真的做不到，顶多只能做到尽量发现苗条就忍住不去想，然而没男人给我实践🤷,赞同，不比较那个事真的做不到，顶多只能做到尽量发现苗条就忍住不去想，然而没男人给我实践🤷,0.40159477065724175,1.0,0.6194533828107085
给女生的建议。少看抖音微博，少听毒鸡汤，，多注重自身修养，看对男人别找错对象，多跟对象交流，为男人着想，别想高攀，少关注这些up，,给女生的建议。少看抖音微博，少听毒鸡汤，，多注重自身修养，看对男人别找错对象，多跟对象交流，为男人着想，别想高攀，少关注这些up，,0.0,1.0,0.6543036086821576
是的，其实要让男人融入到生活，了解其中心酸。这很重要。说实话，你在对他奉献的同时，也要让他看到你的功劳。默默无闻真的没啥用。刷刷存在感,是的，其实要让男人融入到生活，了解其中心酸。这很重要。说实话，你在对他奉献的同时，也要让他看到你的功劳。默默无闻真的没啥用。刷刷存在感,0.3594573740249155,1.0,0.6711398764663349
都市小女人，父权主义思想严重，想依靠婚姻，或者性别红利获取利益，房，车，又因为受过高等教育，要求男方会玩，会说，懂浪漫，会注重细节。这两者不会存在于一个男人身上，就算存在于一个男人身上，又怎么会钟情于一个女人。她们陷入了两者的矛盾之中[吃瓜],都市小女人，父权主义思想严重，想依靠婚姻，或者性别红利获取利益，房，车，又因为受过高等教育，要求男方会玩，会说，懂浪漫，会注重细节。这两者不会存在于一个男人身上，就算存在于一个男人身上，又怎么会钟情于一个女人。她们陷入了两者的矛盾之中,0.3594573740249155,1.0,0.7070360156007385
长得漂亮确实有点优势，但是男人娶老婆往往找的都是长相普通的女人。,长得漂亮确实有点优势，但是男人娶老婆往往找的都是长相普通的女人。,0.3594573740249155,1.0,0.6806273940485001
农村男人真的惨，农村女人争着往城里嫁，城市女人大都看不起农村男人，所以现在中国很多农村光棍一大把，我也是一个读了大学的普通农村人，真心感觉太难了,农村男人真的惨，农村女人争着往城里嫁，城市女人大都看不起农村男人，所以现在中国很多农村光棍一大把，我也是一个读了大学的普通农村人，真心感觉太难了,0.3594573740249155,0.4320558161628193,0.2909741600899946
"你会找一个比你弱的男人吗？
问题不在这，皮囊，装点都是外务，买东西都得看主要用途好不好呐，何况一起过很长时间的伴侣？
想情况，你找男朋友要干啥？
想爽，找壮的。
想那种爽，找有钱的。
想另一种爽，找玩的花的。
       人不怕找错东西，怕的是看不清自己要啥。",你会找一个比你弱的男人吗？ 问题不在这，皮囊，装点都是外务，买东西都得看主要用途好不好呐，何况一起过很长时间的伴侣？ 想情况，你找男朋友要干啥？ 想爽，找壮的。 想那种爽，找有钱的。 想另一种爽，找玩的花的。 人不怕找错东西，怕的是看不清自己要啥。,0.3594573740249155,1.0,0.6848369786786284
这种男人就是年薪千万都不能要，抠就是男人最大的缺点，记住姐妹。,这种男人就是年薪千万都不能要，抠就是男人最大的缺点，记住姐妹。,0.3594573740249155,1.0,0.6856580398383622
所以说，一个男人，无论受教育程度高低，他最需要的不过是一个通房丫头。贾宝玉即使有了灵魂伴侣林黛玉，他也还是需要袭人。一个男人可以没有林黛玉，但是不能没有袭人啊，因为，有人伺候有人仰视有人顺从就是他们的需求。,所以说，一个男人，无论受教育程度高低，他最需要的不过是一个通房丫头。贾宝玉即使有了灵魂伴侣林黛玉，他也还是需要袭人。一个男人可以没有林黛玉，但是不能没有袭人啊，因为，有人伺候有人仰视有人顺从就是他们的需求。,0.0,1.0,0.7811634154040192
曲曲真的很厉害，的确是的，很多女生其实非常优秀，也有自己的圈子，可是因为恋情不顺，对恋爱的想法不实际，所以总是会被男人的甜言蜜语打动，又缺乏自信，不自知地放低了很多很多标准，甚至失去了底线。有能力的女生还是要保持基本的标准，起码要做到互相欣赏和尊重嘛。,曲曲真的很厉害，的确是的，很多女生其实非常优秀，也有自己的圈子，可是因为恋情不顺，对恋爱的想法不实际，所以总是会被男人的甜言蜜语打动，又缺乏自信，不自知地放低了很多很多标准，甚至失去了底线。有能力的女生还是要保持基本的标准，起码要做到互相欣赏和尊重嘛。,0.3594573740249155,1.0,0.7048746025274116
"正经的男人基本上分为两大类，一种是“居家型”一种是“事业型”。居家型顾名思义，万事都以家庭为核心，家庭才是他活着的核心。而事业型的则完全相反，他们的目标明确且意志坚定，事业成功是他们一生的追求也是他们活着的意义，除此之外都是他们前进路上的风景罢了。

而很多姑娘却不明白“鱼和熊掌不可兼得”这个基本道理，找事业型的男人要家庭，找居家型的男人要事业，这就如同要一只羊去吃肉，要一头狼去啃菜叶子一样，什么都想要的结果就是什么也得不到，因为“我们每个人都只有24小时”！！

举个例子，姑娘你马上就要“诞生新的小生命”了，这时陪伴你的爱人突然接到一个大客户的电话，希望能找他聊聊。如果他去了，他可能在事业上有一个大的飞跃，也有可能只是去聊聊什么也没得到。但是如果选择陪你，那他就等于放弃了这次“有可能”的机会。那么各位，无论你男女，遇到这种情况你会怎么选？

任何人都不可能同时又有时间又有金钱，“事业成功”与“陪伴家人”这是两个完全相反且不可调和的矛盾。你喜欢一个居家型的男人你会享受爱情，但是你就要理解他在事业上并不会有太大的成功，因为你才是他的世界。同样，你想要找一个事业有成的人，你能给予对方事业上的助力吗？你能百依百顺常年独自孤独对你的另一半放任自由吗？

得到什么就要付出什么，这个世界就是公平的。（这也是我为什么希望姑娘们会去找一个老实本分的“家庭型”，因为你喂羊吃肉，羊最多也就是跑开。你喂狼吃菜……狼会吃菜吗？你和菜狼会吃了谁自然不言而喻）

题外话，如果一个男人又有时间又有钱[笑]你猜猜看，他是个时间管理带师呢还是一位理财小能手呢？",正经的男人基本上分为两大类，一种是“居家型”一种是“事业型”。居家型顾名思义，万事都以家庭为核心，家庭才是他活着的核心。而事业型的则完全相反，他们的目标明确且意志坚定，事业成功是他们一生的追求也是他们活着的意义，除此之外都是他们前进路上的风景罢了。 而很多姑娘却不明白“鱼和熊掌不可兼得”这个基本道理，找事业型的男人要家庭，找居家型的男人要事业，这就如同要一只羊去吃肉，要一头狼去啃菜叶子一样，什么都想要的结果就是什么也得不到，因为“我们每个人都只有小时”！！ 举个例子，姑娘你马上就要“诞生新的小生命”了，这时陪伴你的爱人突然接到一个大客户的电话，希望能找他聊聊。如果他去了，他可能在事业上有一个大的飞跃，也有可能只是去聊聊什么也没得到。但是如果选择陪你，那他就等于放弃了这次“有可能”的机会。那么各位，无论你男女，遇到这种情况你会怎么选？ 任何人都不可能同时又有时间又有金钱，“事业成功”与“陪伴家人”这是两个完全相反且不可调和的矛盾。你喜欢一个居家型的男人你会享受爱情，但是你就要理解他在事业上并不会有太大的成功，因为你才是他的世界。同样，你想要找一个事业有成的人，你能给予对方事业上的助力吗？你能百依百顺常年独自孤独对你的另一半放任自由吗？ 得到什么就要付出什么，这个世界就是公平的。（这也是我为什么希望姑娘们会去找一个老实本分的“家庭型”，因为你喂羊吃肉，羊最多也就是跑开。你喂狼吃菜……狼会吃菜吗？你和菜狼会吃了谁自然不言而喻） 题外话，如果一个男人又有时间又有钱你猜猜看，他是个时间管理带师呢还是一位理财小能手呢？,0.3594573740249155,1.0,0.8415213522866791
