comment,cleaned_comment,score1,score2,combined_score
"评论区表示男人要挣钱要有车有房 要阳刚等等
你们也不过是被男权社会束缚了
真的是只有身为女子，才能明白那种来自亲友的歧视的感觉。平权路漫漫，希望我们能一起好么，蓝孩子们。@蓝孩子",评论区表示男人要挣钱要有车有房 要阳刚等等 你们也不过是被男权社会束缚了 真的是只有身为女子，才能明白那种来自亲友的歧视的感觉。平权路漫漫，希望我们能一起好么，蓝孩子们。@蓝孩子,0.3594573740249155,1.0,0.7847181251322304
突然想到，真的希望女频小说改变吧改变吧！！多写一写怎么怎么努力让自己变得更好，而不是因为自己美貌，自己的身材赢得了男人欣赏。我是农村孩子，在我没有手机接触到外界的时候，看到的第一本看外书是言情小说[保卫萝卜_哭哭][保卫萝卜_哭哭]，那个时候我六年级，因为本身家庭条件不好[保卫萝卜_哭哭][保卫萝卜_哭哭]，我开始发现我的理想变成了要找一个有钱帅男人做依附[保卫萝卜_哭哭][保卫萝卜_哭哭]，而不是学习更努力一点，考最好的大学，然后开始早恋谈恋爱，恋爱观也不成熟，一因为小说传递的都是娇妻人设[保卫萝卜_哭哭][保卫萝卜_哭哭]，后来我以为男人帮自己做着做哪才是爱，可是等我失恋分手和不停接触女权思想，我发现我不过是以自己的懒惰找借口，以为这种是爱[保卫萝卜_哭哭][保卫萝卜_哭哭]，天爷，因为我的懒惰我没了能力，也不愿努力了，加上大环境我觉得结婚嫁对人才是我最好的归宿，因为我已经投入了太多时间去爱男人，而不是花时间学习，和陪伴我的朋友家人，然后我的生活半径只有一米，就是围绕着这个男人，而不是提升自己[保卫萝卜_哭哭][保卫萝卜_哭哭][保卫萝卜_哭哭]，25岁了，分了一年，还是会恋爱脑想找男人依附[保卫萝卜_哭哭][保卫萝卜_哭哭]，每天都在努力的改变，姐妹们也都醒醒啊，我们不努力，选择了懒惰，选择了依附，不把时间花在提升自己上，那我们下一辈女性怎么办[大哭][大哭]，要加油啊[给心心][给心心],突然想到，真的希望女频小说改变吧改变吧！！多写一写怎么怎么努力让自己变得更好，而不是因为自己美貌，自己的身材赢得了男人欣赏。我是农村孩子，在我没有手机接触到外界的时候，看到的第一本看外书是言情小说，那个时候我六年级，因为本身家庭条件不好，我开始发现我的理想变成了要找一个有钱帅男人做依附，而不是学习更努力一点，考最好的大学，然后开始早恋谈恋爱，恋爱观也不成熟，一因为小说传递的都是娇妻人设，后来我以为男人帮自己做着做哪才是爱，可是等我失恋分手和不停接触女权思想，我发现我不过是以自己的懒惰找借口，以为这种是爱，天爷，因为我的懒惰我没了能力，也不愿努力了，加上大环境我觉得结婚嫁对人才是我最好的归宿，因为我已经投入了太多时间去爱男人，而不是花时间学习，和陪伴我的朋友家人，然后我的生活半径只有一米，就是围绕着这个男人，而不是提升自己，岁了，分了一年，还是会恋爱脑想找男人依附，每天都在努力的改变，姐妹们也都醒醒啊，我们不努力，选择了懒惰，选择了依附，不把时间花在提升自己上，那我们下一辈女性怎么办，要加油啊,0.3594573740249155,1.0,0.8785227001028407
这……，阿婆主说话自相矛盾啊！开头说离婚率上涨大多数都是女人提出的，然后又说因为女人胡搅蛮缠才被男人抛弃，到底是女的想离婚，还是男的想离婚，逻辑上的不通，这讲什么呢[囧][囧],这……，阿婆主说话自相矛盾啊！开头说离婚率上涨大多数都是女人提出的，然后又说因为女人胡搅蛮缠才被男人抛弃，到底是女的想离婚，还是男的想离婚，逻辑上的不通，这讲什么呢,0.40159477065724175,1.0,0.6846975710881539
"说是女生都希望男生把自己当女儿疼，但事实上更多的是女人给男人洗袜子洗内裤做饭做家务看孩子，还要教老公什么叫责任感完全是像带了个儿子，不是所有的女人都想要变成男生的女儿，那只是我们想要被疼爱，试问谁会想要看自己撒泼打滚的变成个泼妇？说女生性别优势的制高点，那“女司机”、“年纪大了没人要”、“女生找个稳定的工作就行了方便照顾家，事业还是要靠我们男人”、“离婚了的女的就不值钱了”这些话我相信没人没听过，这也是我们站在了性别的优势上吗，离婚率高居不下是因为“年纪到了”所以结婚成家，我们勤劳的上一辈把自己的孩子疼爱了二十年然后突然让两个孩子成家独立，可惜爱不能发电，锅碗瓢盆柴米油盐酱醋茶也得开销，再蕙质兰心气质出众的女人也不能日复一日的容忍妥协，在望不到尽头的琐事中变成怨妇也更是常见，个人认为，成熟的男人可能不会把你当女儿一样疼，但一定不会让你一个人支撑一个家，婚姻一定是因为两个人走比一个人走更开心、更美好、更能进步、更能相互理解相互体谅、更能有动力遇见更好的自己。如果不是因为我们全部的身心和物质准备好了，做好了不畏辛苦的努力向前，努力成立一个小家过上比今天更好的明天，那么请先不要结婚了，因为那是不负责任的行为。
      以上个人观点，不喜勿喷，杠就是你对✓✓✓[tv_可爱][tv_可爱][tv_可爱]",说是女生都希望男生把自己当女儿疼，但事实上更多的是女人给男人洗袜子洗内裤做饭做家务看孩子，还要教老公什么叫责任感完全是像带了个儿子，不是所有的女人都想要变成男生的女儿，那只是我们想要被疼爱，试问谁会想要看自己撒泼打滚的变成个泼妇？说女生性别优势的制高点，那“女司机”、“年纪大了没人要”、“女生找个稳定的工作就行了方便照顾家，事业还是要靠我们男人”、“离婚了的女的就不值钱了”这些话我相信没人没听过，这也是我们站在了性别的优势上吗，离婚率高居不下是因为“年纪到了”所以结婚成家，我们勤劳的上一辈把自己的孩子疼爱了二十年然后突然让两个孩子成家独立，可惜爱不能发电，锅碗瓢盆柴米油盐酱醋茶也得开销，再蕙质兰心气质出众的女人也不能日复一日的容忍妥协，在望不到尽头的琐事中变成怨妇也更是常见，个人认为，成熟的男人可能不会把你当女儿一样疼，但一定不会让你一个人支撑一个家，婚姻一定是因为两个人走比一个人走更开心、更美好、更能进步、更能相互理解相互体谅、更能有动力遇见更好的自己。如果不是因为我们全部的身心和物质准备好了，做好了不畏辛苦的努力向前，努力成立一个小家过上比今天更好的明天，那么请先不要结婚了，因为那是不负责任的行为。 以上个人观点，不喜勿喷，杠就是你对✓✓✓,0.3594573740249155,1.0,0.8053527805550351
还决定分手离婚难呢，我连男人追求我都不敢明目张胆直白的表达我的拒绝，得委婉委婉再委婉，斟酌再三言辞。。因为你不知道对面是个什么样的人。万一他怀恨报复，给我泼硫酸，尾随我什么的，那可太恐怖了。回头上了新闻，网上的男人还得说我们俩肯定有恩怨，我肯定花了他的钱啦之类的。,还决定分手离婚难呢，我连男人追求我都不敢明目张胆直白的表达我的拒绝，得委婉委婉再委婉，斟酌再三言辞。。因为你不知道对面是个什么样的人。万一他怀恨报复，给我泼硫酸，尾随我什么的，那可太恐怖了。回头上了新闻，网上的男人还得说我们俩肯定有恩怨，我肯定花了他的钱啦之类的。,0.3594573740249155,1.0,0.6819712007907224
其实我一直都不理解既然男人抱怨现在女人一生臭毛病还事多，要的彩礼又多，那他们完全可以不结婚啊？何必给自己找罪受呢？又渴女又厌女不要太神经好吧？,其实我一直都不理解既然男人抱怨现在女人一生臭毛病还事多，要的彩礼又多，那他们完全可以不结婚啊？何必给自己找罪受呢？又渴女又厌女不要太神经好吧？,0.3594573740249155,1.0,0.6276483557691566
"马思：《随便唠唠》
女人一定要自己去认清男人，而不是等着男人来选你。不要连这种选择的权利都交给男人，这世上舔狗没那么多。​",马思：《随便唠唠》 女人一定要自己去认清男人，而不是等着男人来选你。不要连这种选择的权利都交给男人，这世上舔狗没那么多。​,0.3594573740249155,1.0,0.7060215496016498
好男人好女人一直都是少数吧。。。尤其是现在社会快节奏，都没啥共鸣共同经历相亲相爱，就要上赶子结婚生娃，婚后遇到事能替对方承担责任吗，还是觉得对方就是个累赘,好男人好女人一直都是少数吧。。。尤其是现在社会快节奏，都没啥共鸣共同经历相亲相爱，就要上赶子结婚生娃，婚后遇到事能替对方承担责任吗，还是觉得对方就是个累赘,0.3594573740249155,1.0,0.6577511308168555
他并没有不爱你了，他依然爱你。只是他的疯恋激素只有6个月，后面就回归正常，但是他依然爱你。女人有18个月的疯恋期，比男人长12个月，后面就会不断的想去确认男人是否依然爱你。他并没有不爱你了，他依然爱你。,他并没有不爱你了，他依然爱你。只是他的疯恋激素只有个月，后面就回归正常，但是他依然爱你。女人有个月的疯恋期，比男人长个月，后面就会不断的想去确认男人是否依然爱你。他并没有不爱你了，他依然爱你。,0.3594573740249155,1.0,0.6274082193241439
婚前多数压力都集中在男人身上，有小孩之后女人压力也不小。,婚前多数压力都集中在男人身上，有小孩之后女人压力也不小。,0.3594573740249155,1.0,0.5651033406264104
作为一个普通男人，如果你找了个女朋友，你将经历什么：1． 她总是不表达自己的意思，而是让你去猜测。2． 每逢节日，你都要送给她礼物或者给她钱3． 如果你们之间发生了矛盾，她会默认这一定你的错，所以她认为你应该向她服软并补偿她4． 如果她心情不好，她会认为你应该去哄她开心，因为你是他男朋友5． 经常莫名其妙的就生气，并认为这一定是你的错，所以你应该去哄她开心6． 聊天像是在做阅读理解，并且还没有标准答案；万一哪句话说不好，她就会和你闹脾气。7． 如果你没钱，她会嫌你不上进；如果你努力工作去挣钱，她会嫌你没时间陪她。8． 很多两个人共同的消费你要一个人来承担。9． 如果她身边出现了比你强一个等级并愿意要她的男人，那么她心里已经开始计划如何体面的离开你了。10． 总是拿其他男人的长处比你的短处，并得出“你不如他”的结论，然后还美其名曰“激励你”。11． 如果你们能走到结婚那步，那么你需要买房、买车、给她的父母彩礼，这些都是大额费用（这还没算上婚礼及其过程中的杂七杂八的费用）。并且，有些女孩还要求你把你买的房子赠送给她；不要指望她看在你们多年感情的分上会给你放宽条件，这种时候感情是感情，钱是钱。12． 以上这些条，你也许不会全经历，但你一定不可能全不经历。至于你会经历几条，看你运气,作为一个普通男人，如果你找了个女朋友，你将经历什么：． 她总是不表达自己的意思，而是让你去猜测。． 每逢节日，你都要送给她礼物或者给她钱． 如果你们之间发生了矛盾，她会默认这一定你的错，所以她认为你应该向她服软并补偿她． 如果她心情不好，她会认为你应该去哄她开心，因为你是他男朋友． 经常莫名其妙的就生气，并认为这一定是你的错，所以你应该去哄她开心． 聊天像是在做阅读理解，并且还没有标准答案；万一哪句话说不好，她就会和你闹脾气。． 如果你没钱，她会嫌你不上进；如果你努力工作去挣钱，她会嫌你没时间陪她。． 很多两个人共同的消费你要一个人来承担。． 如果她身边出现了比你强一个等级并愿意要她的男人，那么她心里已经开始计划如何体面的离开你了。． 总是拿其他男人的长处比你的短处，并得出“你不如他”的结论，然后还美其名曰“激励你”。． 如果你们能走到结婚那步，那么你需要买房、买车、给她的父母彩礼，这些都是大额费用（这还没算上婚礼及其过程中的杂七杂八的费用）。并且，有些女孩还要求你把你买的房子赠送给她；不要指望她看在你们多年感情的分上会给你放宽条件，这种时候感情是感情，钱是钱。． 以上这些条，你也许不会全经历，但你一定不可能全不经历。至于你会经历几条，看你运气,0.3594573740249155,1.0,0.8865422729662829
婚姻给男人带来什么,婚姻给男人带来什么,0.3594573740249155,1.0,0.5665321626674684
"还有精力打官司呢，这女的不缺钱。
她这明显是个吸渣体质，这种情况就该断绝跟男人的所有超出友谊的关系，好好关注自己才对。
女人无底线的让步，就是在培养男人成为渣男。接受男人的小恩小惠，去选择放弃自己底线的，也是渣男的猎物。",还有精力打官司呢，这女的不缺钱。 她这明显是个吸渣体质，这种情况就该断绝跟男人的所有超出友谊的关系，好好关注自己才对。 女人无底线的让步，就是在培养男人成为渣男。接受男人的小恩小惠，去选择放弃自己底线的，也是渣男的猎物。,0.3594573740249155,1.0,0.7662889535698488
男人是个好人，总感觉没有男人的气质，琐碎的事情摸摸索索，大事情都不会考虑。听到他说话就烦，好像没话找话的样子，全是尬聊。二十来年了，说出来的话好像不认识一样。想要离婚，好像又有些担心，不知道一个人会不会很寂寞。,男人是个好人，总感觉没有男人的气质，琐碎的事情摸摸索索，大事情都不会考虑。听到他说话就烦，好像没话找话的样子，全是尬聊。二十来年了，说出来的话好像不认识一样。想要离婚，好像又有些担心，不知道一个人会不会很寂寞。,0.3594573740249155,1.0,0.7398424457663954
我与老公是校园恋爱到结婚，期间同居过几年，在同居期间暴露出很多问题，一直也没有得到解决，后来我们还是结婚了，并且现在一直异地。我领证一年了，过的不能说不幸，但也可以说是不开心。婚姻是否有必要存在，或许以后会有不同的答案了。就我个人体验而说，婚姻对于女性既不是保障，也不是温床，你必须一直保持学习的心态去面对生活。有这个男人你可以好，没这个男人你也可以好，你才会真的好…这样的心态下，婚姻确实是没必要的，它只会影响你拔刀的速度，难以给你慰藉…,我与老公是校园恋爱到结婚，期间同居过几年，在同居期间暴露出很多问题，一直也没有得到解决，后来我们还是结婚了，并且现在一直异地。我领证一年了，过的不能说不幸，但也可以说是不开心。婚姻是否有必要存在，或许以后会有不同的答案了。就我个人体验而说，婚姻对于女性既不是保障，也不是温床，你必须一直保持学习的心态去面对生活。有这个男人你可以好，没这个男人你也可以好，你才会真的好…这样的心态下，婚姻确实是没必要的，它只会影响你拔刀的速度，难以给你慰藉…,0.7361487306815024,1.0,0.7057989020467712
我不能确定下一个男人会比现在这一个好，但是我知道离开他我就很好，分居一年亲测的,我不能确定下一个男人会比现在这一个好，但是我知道离开他我就很好，分居一年亲测的,0.3594573740249155,1.0,0.6623864846812084
自己足够强大的时候男人才会给你依靠，自己足够强大了优秀了婚姻才能顺利合作,自己足够强大的时候男人才会给你依靠，自己足够强大了优秀了婚姻才能顺利合作,0.3594573740249155,1.0,0.6056615508846849
为啥好女人和好男人不能匹配上呢[笑哭],为啥好女人和好男人不能匹配上呢,0.3594573740249155,1.0,0.5516953186333104
"婚姻制度难。90%男人都没把老婆看成合伙人。
老婆给你谈个人利益，你和老婆谈共同利益画大饼
老婆付出也没看做公司股份持有人。
把老婆当成合伙人一样去维护关系。。。",婚姻制度难。%男人都没把老婆看成合伙人。 老婆给你谈个人利益，你和老婆谈共同利益画大饼 老婆付出也没看做公司股份持有人。 把老婆当成合伙人一样去维护关系。。。,0.3594573740249155,1.0,0.577982413737725
男人或者女人只要不愿意为了你们之间关系负责 让你正大光明的有正经身份的出现在他生活圈子里 就是渣  贪图你对ta的好 本质上是对你来说自私的坏人  只愿为了ta自己的利益 根本看不上你 也就把你当作消遣 别再说对方是好人了 对方怎么好 这样对你就是不好 对自己狠点脱离吧,男人或者女人只要不愿意为了你们之间关系负责 让你正大光明的有正经身份的出现在他生活圈子里 就是渣 贪图你对ta的好 本质上是对你来说自私的坏人 只愿为了ta自己的利益 根本看不上你 也就把你当作消遣 别再说对方是好人了 对方怎么好 这样对你就是不好 对自己狠点脱离吧,0.3594573740249155,1.0,0.6828176946058269
他只想和你谈恋爱，不想和你结婚，可能是因为你的原生家庭吧！不是因为你不好！男人结婚很现实的,他只想和你谈恋爱，不想和你结婚，可能是因为你的原生家庭吧！不是因为你不好！男人结婚很现实的,0.3594573740249155,1.0,0.6104329561868966
只有我觉得梁宽直只是做了一个男人身为丈夫和父亲该做的事吗，爱护妻子保护子女这些都是应该的啊,只有我觉得梁宽直只是做了一个男人身为丈夫和父亲该做的事吗，爱护妻子保护子女这些都是应该的啊,0.0,1.0,0.5975523390464739
完了，韩剧把所有女生的理想男友拍出来了。真有个这样的男人，陪他吃苦也愿意啊。,完了，韩剧把所有女生的理想男友拍出来了。真有个这样的男人，陪他吃苦也愿意啊。,0.3594573740249155,1.0,0.6983208646274992
为什么会有“女孩子的青春就那几年，很宝贵的”这种话呢？因为发言者认定女孩子需要靠青春美貌来为自己谋一个好归宿，而男人可以自己立身。就这么简单。不要说什么男人女人的青春都是精力最充沛的时候，那他为什么不对女孩子说“人的青春很宝贵”？,为什么会有“女孩子的青春就那几年，很宝贵的”这种话呢？因为发言者认定女孩子需要靠青春美貌来为自己谋一个好归宿，而男人可以自己立身。就这么简单。不要说什么男人女人的青春都是精力最充沛的时候，那他为什么不对女孩子说“人的青春很宝贵”？,0.3594573740249155,1.0,0.6817920384647956
偷偷的跑去她的城市，买了她最喜欢的百合花，看见她和另一个男人拥抱在一起。我等他走了，把花送给她，再见，永远不见。（亲身经历，不是复制的[笑]）,偷偷的跑去她的城市，买了她最喜欢的百合花，看见她和另一个男人拥抱在一起。我等他走了，把花送给她，再见，永远不见。（亲身经历，不是复制的）,0.3594573740249155,1.0,0.6550822434171506
看到这么好的姑娘嫁给一个心底柔软的好男人感觉很安心。希望这个世界上所有善良的姑娘都能有一个同样善良的男人守护。我相信两个美好的灵魂之间形成的联结是格外坚固的。加油💪,看到这么好的姑娘嫁给一个心底柔软的好男人感觉很安心。希望这个世界上所有善良的姑娘都能有一个同样善良的男人守护。我相信两个美好的灵魂之间形成的联结是格外坚固的。加油💪,0.3594573740249155,1.0,0.6161290189389017
我奉劝那些年纪轻轻的男人被情所困的孬货，好好奋斗挣钱吧，努力变得更加优秀，让那些女生开始仰望你，而且时刻要坚持高冷形象，请保持这种心态。（哥亲身体验）,我奉劝那些年纪轻轻的男人被情所困的孬货，好好奋斗挣钱吧，努力变得更加优秀，让那些女生开始仰望你，而且时刻要坚持高冷形象，请保持这种心态。（哥亲身体验）,0.0,1.0,0.5806164284210693
我跟我对象谈了三年了，18岁的时候打游戏认识他的，我一直待在广东，他一直在四川。我爱的是网恋的时候，低音炮的他、神秘的他、准备创业的他、做保险讲师的他、【像哥哥一样的男人】。其他的我实际上了解的并不多。后来我去四川和他奔现，在他家住了一个月，我看见的是一个可以照顾我、教我很多事情的、有一定经济能力、成熟的、家庭完美的男人。后来我把他叫到广东来发展了，我才发现，他其实是一个男孩。会贪玩、会好高骛远、有很多不成熟需要我去照顾他的地方。但是即便这样，我还是跟他谈了三年，同居两年。这两年不是没想过分手，也早就没有对他的怦然心动了。他现在跟我的亲人一样，让我感觉安心、有基础的房车存款、很听我话、喜欢粘着我、还有个靠谱的关心我俩的爹妈、亲戚关系也很不错互相帮助。我也曾感觉到腻味，对别的男孩感兴趣，不过我深思熟虑，一方面是道德心谴责，一方面是认清了，刚认识的人都会有我自己愿意看到的幻想，久了以后不过就是第二个我对象，而且搞不好还不如我对象。所以与其有时间搞恋爱，不如锻炼自己，加强自己，爱自己才是一辈子的,我跟我对象谈了三年了，岁的时候打游戏认识他的，我一直待在广东，他一直在四川。我爱的是网恋的时候，低音炮的他、神秘的他、准备创业的他、做保险讲师的他、【像哥哥一样的男人】。其他的我实际上了解的并不多。后来我去四川和他奔现，在他家住了一个月，我看见的是一个可以照顾我、教我很多事情的、有一定经济能力、成熟的、家庭完美的男人。后来我把他叫到广东来发展了，我才发现，他其实是一个男孩。会贪玩、会好高骛远、有很多不成熟需要我去照顾他的地方。但是即便这样，我还是跟他谈了三年，同居两年。这两年不是没想过分手，也早就没有对他的怦然心动了。他现在跟我的亲人一样，让我感觉安心、有基础的房车存款、很听我话、喜欢粘着我、还有个靠谱的关心我俩的爹妈、亲戚关系也很不错互相帮助。我也曾感觉到腻味，对别的男孩感兴趣，不过我深思熟虑，一方面是道德心谴责，一方面是认清了，刚认识的人都会有我自己愿意看到的幻想，久了以后不过就是第二个我对象，而且搞不好还不如我对象。所以与其有时间搞恋爱，不如锻炼自己，加强自己，爱自己才是一辈子的,1.0,1.0,0.7597413669592068
可以有个娃但不需要有婚姻，男人只会拖垮神仙姐姐们。,可以有个娃但不需要有婚姻，男人只会拖垮神仙姐姐们。,0.0,1.0,0.6533671424684294
[傲娇]就嫁不嫁就不嫁，我有自己的决定，我们女生不是男人的傀儡,就嫁不嫁就不嫁，我有自己的决定，我们女生不是男人的傀儡,0.3594573740249155,1.0,0.5982932617652645
