comment,cleaned_comment,score1,score2,combined_score
"这个我有发言权，不得不赞同佩服
我作为女性，婚后N年，育有一子，谈及经验，基本就是参照系找对象法。第一个参照系我爸，他的缺点是我坚决不要的，其他条件再好都不行，有了底线；第二个参照系就是学生时代关系好的男生，这是明白自身需求，相当有了基线；第三个参照系是实践出来的，大学对象两年多，明白再喜欢你的男人，容忍你的男人，最后本质不会变，男人处理问题和矛盾的时刻就是女人看清本质的时刻，人不坏也爱你，情绪价值太低，不值得拥有；第四个参照系就是颜值身材尚可有些好感的男人，主动出击，内化标准，那些呦女孩子挺主动那睡你吧的男人！pass！这是在我喜欢的人还是喜欢我的人平衡问题。
大学毕业遇见我老公和他朋友，当时他俩都单身，三人做了半年普通朋友，择其一就是现在的老公。我老公这人在我这优点明显，比如不抽烟不喝大酒尊重女性无暴力倾向尊老爱幼情绪稳定等，劣势如生活能力工作能力赚钱能力认真态度都差强人意，就是个差不多先生。对于我老公的评价就会出现我各种夸，外界对他的认可就差了点意思。
（不要认为我说我老公的优点是大部分人都能做到的，比如尊老爱幼，他不知对他父母好，对我父母也不错，喜欢小孩子，日常下班能带孩子。再比如过日子吵架矛盾问题都很多，情绪稳定不暴力且尊重的家人让你舒心万倍，这点很多父母做不到，子女身心疲惫。如果没有劣势，也不是我能把握住的男人[脱单doge]）
综上所述↑，有参考系，内化需求，了解本质，及时止损，都很重要，凡事需要做长期选择的，都经历以上步骤，受损可能性比较小。",这个我有发言权，不得不赞同佩服 我作为女性，婚后N年，育有一子，谈及经验，基本就是参照系找对象法。第一个参照系我爸，他的缺点是我坚决不要的，其他条件再好都不行，有了底线；第二个参照系就是学生时代关系好的男生，这是明白自身需求，相当有了基线；第三个参照系是实践出来的，大学对象两年多，明白再喜欢你的男人，容忍你的男人，最后本质不会变，男人处理问题和矛盾的时刻就是女人看清本质的时刻，人不坏也爱你，情绪价值太低，不值得拥有；第四个参照系就是颜值身材尚可有些好感的男人，主动出击，内化标准，那些呦女孩子挺主动那睡你吧的男人！pass！这是在我喜欢的人还是喜欢我的人平衡问题。 大学毕业遇见我老公和他朋友，当时他俩都单身，三人做了半年普通朋友，择其一就是现在的老公。我老公这人在我这优点明显，比如不抽烟不喝大酒尊重女性无暴力倾向尊老爱幼情绪稳定等，劣势如生活能力工作能力赚钱能力认真态度都差强人意，就是个差不多先生。对于我老公的评价就会出现我各种夸，外界对他的认可就差了点意思。 （不要认为我说我老公的优点是大部分人都能做到的，比如尊老爱幼，他不知对他父母好，对我父母也不错，喜欢小孩子，日常下班能带孩子。再比如过日子吵架矛盾问题都很多，情绪稳定不暴力且尊重的家人让你舒心万倍，这点很多父母做不到，子女身心疲惫。如果没有劣势，也不是我能把握住的男人） 综上所述↑，有参考系，内化需求，了解本质，及时止损，都很重要，凡事需要做长期选择的，都经历以上步骤，受损可能性比较小。,0.3594573740249155,1.0,1.0
把赛道放在选男人上，不如姐妹多提升自己,把赛道放在选男人上，不如姐妹多提升自己,0.3594573740249155,0.4632039205553255,0.419087965674389
[灵魂出窍]稍微了解男人，或者了解人性后，真的对婚姻失望了。,稍微了解男人，或者了解人性后，真的对婚姻失望了。,0.3594573740249155,1.0,0.5766836787703091
希望未来女生都能想的通 看淡婚恋 不结婚就没有风险没有收益  衡量一下自己能靠自己还是靠结婚获益 哪个概率更高   投资男人 男人一直在退化,希望未来女生都能想的通 看淡婚恋 不结婚就没有风险没有收益 衡量一下自己能靠自己还是靠结婚获益 哪个概率更高 投资男人 男人一直在退化,0.3594573740249155,1.0,0.7250174952605253
男人不在乎吃喝，买车是为了更好上班，做app也是为家庭做贡献，这都能让女方和女方闺蜜炸毛，婚姻给男人带来的只有困难啊,男人不在乎吃喝，买车是为了更好上班，做app也是为家庭做贡献，这都能让女方和女方闺蜜炸毛，婚姻给男人带来的只有困难啊,0.3594573740249155,1.0,0.5779299351312533
气抖冷，凭什么只有男人才能买房子。我们女生也能买房子[脱单doge],气抖冷，凭什么只有男人才能买房子。我们女生也能买房子,0.3594573740249155,0.33622659986374615,0.2942019303843245
"省流：男人赚10000花3000，女人赚3000花10000。
总结：结婚后男人穷得跟个要饭似的",省流：男人赚花，女人赚花。 总结：结婚后男人穷得跟个要饭似的,0.3594573740249155,1.0,0.6387347112531101
"我一直觉得老家的思想是非常先进的
1 无论男女都没有彩礼，这样结婚后和双方父母都走得很近，大家都只希望子女能把日子过好就行，子女也会好好赡养父母。
2 没有一丝女权的感觉，不过可能是因为老家女人比男人人数多了15%，甚至隐隐感觉大家都很喜欢女孩子。",我一直觉得老家的思想是非常先进的 无论男女都没有彩礼，这样结婚后和双方父母都走得很近，大家都只希望子女能把日子过好就行，子女也会好好赡养父母。 没有一丝女权的感觉，不过可能是因为老家女人比男人人数多了%，甚至隐隐感觉大家都很喜欢女孩子。,0.0,0.4632039205553255,0.38196229079113425
少对女人说“嫁个好男人最重要”“女人过了三十就不值钱了”，鼓励女生发展自己，也努力赚钱，这样她们自然不会盯着男人钱包，当然这种女人可能就对你不感兴趣了，因为钱不多人也没魅力,少对女人说“嫁个好男人最重要”“女人过了三十就不值钱了”，鼓励女生发展自己，也努力赚钱，这样她们自然不会盯着男人钱包，当然这种女人可能就对你不感兴趣了，因为钱不多人也没魅力,0.3594573740249155,1.0,0.6755389859102292
"男人可不弱势群体嘛😏
你看，谈恋爱得给女人花钱，因为女人物质，喜欢有房有车有存款的。
如果遇到一个女人不花男人的钱，那这个女人就是不让碰不让睡，清高。
话都让男人说去了🤦‍♂️
（仅代表部分男生）",男人可不弱势群体嘛😏 你看，谈恋爱得给女人花钱，因为女人物质，喜欢有房有车有存款的。 如果遇到一个女人不花男人的钱，那这个女人就是不让碰不让睡，清高。 话都让男人说去了🤦‍♂️ （仅代表部分男生）,0.3594573740249155,1.0,0.6235618896132797
刚刚和两个90，00年的小朋友吃饭，她们都提出，只想要小孩，不想结婚，不想进入另一个家庭去适应各个角色，对于男人们都说她们作，即要又要，但是，作为女人，我能理解,刚刚和两个，年的小朋友吃饭，她们都提出，只想要小孩，不想结婚，不想进入另一个家庭去适应各个角色，对于男人们都说她们作，即要又要，但是，作为女人，我能理解,0.3594573740249155,1.0,0.656126790574387
对于女生来说，高学历高薪水的意义是让自己开阔视野、有结识人脉的机会、不再为谋生发愁，而不是挑选配偶的筹码（除非你是个愿意给男人花钱付出的富婆）,对于女生来说，高学历高薪水的意义是让自己开阔视野、有结识人脉的机会、不再为谋生发愁，而不是挑选配偶的筹码（除非你是个愿意给男人花钱付出的富婆）,0.3594573740249155,0.33622659986374615,0.40370400225613495
又学会一句金句：搞男人竞争对手只是女人，搞事业竞争对手是所有人[脱单doge],又学会一句金句：搞男人竞争对手只是女人，搞事业竞争对手是所有人,0.3594573740249155,1.0,0.5407292129148367
"1.给他归属感和看重他
     （1）你想吸引什么样的人，你就要假装自己拥有这方面的特质
恋爱的目的:弥补内心缺陷
(2）放手的方法:本自具足
2.成为一个像男人一样思考的人
1.不要帮他，指责他，
     2.男人希望通过共同做事建立关系
      3.简单一点，直接一点，话少一点
      4.男生喜欢帮女生做事(句式:你愿不愿意...)",.给他归属感和看重他 （）你想吸引什么样的人，你就要假装自己拥有这方面的特质 恋爱的目的:弥补内心缺陷 (）放手的方法:本自具足 .成为一个像男人一样思考的人 .不要帮他，指责他， .男人希望通过共同做事建立关系 .简单一点，直接一点，话少一点 .男生喜欢帮女生做事(句式:你愿不愿意...),0.3594573740249155,1.0,0.7700454543583413
亲密关系，进化心理学，性心里学，男人来自火星女人来自金星，爱的艺术等等，这些书比市面上百分之八十的情感博主都靠谱些。可惜呀，有耐心读的下去不用看，需要看的读不进去。[灰原哀_喝茶],亲密关系，进化心理学，性心里学，男人来自火星女人来自金星，爱的艺术等等，这些书比市面上百分之八十的情感博主都靠谱些。可惜呀，有耐心读的下去不用看，需要看的读不进去。,0.3594573740249155,1.0,0.6413285761680785
不知道你们讨论这个话题的前提是双方只是男女朋友关系还是夫妻关系，如果只是在谈恋爱，就不存在私房钱这个概念，因为经济还是彼此独立的（主动愿意上交除外），如果是夫妻关系存私房钱是为了有时候能帮助父母，这点我只能说如果作为你的伴侣我会感觉很伤心，我会觉得你把我当外人对我不信任，家庭理财中有一块关于对各自家庭支援这部分完全是可以拿出来一起讨论商量的，而不是不经同意就背着伴侣私下挪用夫妻共有财产，这样很不尊重伴侣。另外为什么大家都是默认了上交全部工资后男人口袋里就空空了，男人不是人不需要零花钱吗？,不知道你们讨论这个话题的前提是双方只是男女朋友关系还是夫妻关系，如果只是在谈恋爱，就不存在私房钱这个概念，因为经济还是彼此独立的（主动愿意上交除外），如果是夫妻关系存私房钱是为了有时候能帮助父母，这点我只能说如果作为你的伴侣我会感觉很伤心，我会觉得你把我当外人对我不信任，家庭理财中有一块关于对各自家庭支援这部分完全是可以拿出来一起讨论商量的，而不是不经同意就背着伴侣私下挪用夫妻共有财产，这样很不尊重伴侣。另外为什么大家都是默认了上交全部工资后男人口袋里就空空了，男人不是人不需要零花钱吗？,0.3594573740249155,1.0,0.7733369025795199
我就说一句啊，里面传达的爱情观一句话总结就是：“如果一个男人连自己都养不活，他就没资格谈恋爱”，这话反过来，内在意思是不是就是，女人靠自己是养不活自己的，只能依赖其他人，那这好像也不是恋爱关系，更像寄生……找一个身强体壮的宿主来让自己过上满意的日子[思考]，而不是靠自己过上自己满意的日子，爱情双方应该都是平等的,我就说一句啊，里面传达的爱情观一句话总结就是：“如果一个男人连自己都养不活，他就没资格谈恋爱”，这话反过来，内在意思是不是就是，女人靠自己是养不活自己的，只能依赖其他人，那这好像也不是恋爱关系，更像寄生……找一个身强体壮的宿主来让自己过上满意的日子，而不是靠自己过上自己满意的日子，爱情双方应该都是平等的,0.3594573740249155,1.0,0.6528058858646506
"作为男性，我想给女士们提个建议：爱情和金钱不可得兼时，可以选一端，哪一端都没有错，要么选一个爱你的男人，要么选一个能养你的男人，好歹两方面占一个
最可怕的，是那种天天把爱挂在嘴边，然而事实上除了他自己外，他谁都不爱，更是连上劲心都没有，只会欺骗女孩子的渣男。
你可以选一个现在穷，但是很爱你的潜力股，也可以选一个也许没啥本事，但确实对你付出真心的老实人，亦或者直接以金钱为目的，选一个土大款为自己捞一桶金，但千万别被爱情蒙蔽双眼，进了渣男的鱼池。",作为男性，我想给女士们提个建议：爱情和金钱不可得兼时，可以选一端，哪一端都没有错，要么选一个爱你的男人，要么选一个能养你的男人，好歹两方面占一个 最可怕的，是那种天天把爱挂在嘴边，然而事实上除了他自己外，他谁都不爱，更是连上劲心都没有，只会欺骗女孩子的渣男。 你可以选一个现在穷，但是很爱你的潜力股，也可以选一个也许没啥本事，但确实对你付出真心的老实人，亦或者直接以金钱为目的，选一个土大款为自己捞一桶金，但千万别被爱情蒙蔽双眼，进了渣男的鱼池。,0.3594573740249155,1.0,0.7780103890302928
看看就算了，现实是爱情在金钱面前一文不值。你对她再好都是廉价的，不如别的男人送她个金戒指。爱情？能当饭吃吗？我看不到你的未来。兄弟们好好赚钱吧，有钱了，什么都会有的。我算是明白了，再爱她，也抵不过一个朝三暮四的富二代。,看看就算了，现实是爱情在金钱面前一文不值。你对她再好都是廉价的，不如别的男人送她个金戒指。爱情？能当饭吃吗？我看不到你的未来。兄弟们好好赚钱吧，有钱了，什么都会有的。我算是明白了，再爱她，也抵不过一个朝三暮四的富二代。,0.3594573740249155,1.0,0.7549240313947032
这不是绝对的，婚姻需要共同付出。结婚时一无所有等男人有钱了离婚的多的是。条件好的嫁了，懂得经营的婚姻也会幸福。关键都得看人品！,这不是绝对的，婚姻需要共同付出。结婚时一无所有等男人有钱了离婚的多的是。条件好的嫁了，懂得经营的婚姻也会幸福。关键都得看人品！,0.3594573740249155,1.0,0.689018577553914
我觉得第二点也没错，投资男人不如投资自己，别过头就行了,我觉得第二点也没错，投资男人不如投资自己，别过头就行了,0.3594573740249155,0.33622659986374615,0.3251692136262522
说个事情，彩礼这种东西，一般都是公公婆婆花给夫妻的！能有几个臭不要脸的女人能把那么大笔彩礼私吞？买房子，装修，买车，车险，生孩子，带孩子，养孩子，夫妻之间从结婚开始要一起花的钱就太多太多了，总有种“彩礼是婆婆买媳妇儿的钱”这种**想法，呕，那是婆婆为了将来使唤儿媳妇儿心安理得的借口。找个好老公，同时缺认他爹妈正常，否则，算了，世界男女比例，女人还是少的，三条腿蛤蟆不好找，两条腿男人多的是，还怕找不到男人吗？比起嫁不出去的女孩子她妈，更紧张的的是娶不进来的男孩子她妈。加油！等到好男人再嫁！,说个事情，彩礼这种东西，一般都是公公婆婆花给夫妻的！能有几个臭不要脸的女人能把那么大笔彩礼私吞？买房子，装修，买车，车险，生孩子，带孩子，养孩子，夫妻之间从结婚开始要一起花的钱就太多太多了，总有种“彩礼是婆婆买媳妇儿的钱”这种**想法，呕，那是婆婆为了将来使唤儿媳妇儿心安理得的借口。找个好老公，同时缺认他爹妈正常，否则，算了，世界男女比例，女人还是少的，三条腿蛤蟆不好找，两条腿男人多的是，还怕找不到男人吗？比起嫁不出去的女孩子她妈，更紧张的的是娶不进来的男孩子她妈。加油！等到好男人再嫁！,0.3594573740249155,1.0,0.6613465722944356
感觉好像现在一提到女人就是拜金，下。流，崇洋媚外，各种恶心说辞，我只能说，那样讲的人只能说层次太低低到身边只有那种女人，一天到晚拿个例说事，面对生育就一副你有那器官你就应该负全责，女孩子被骗pao什么的都是女孩子有问题之类的，拜托，你看看哪个有层次有地位的男人会去那么说，那不摆明了拉低自己。提到婚姻就是女人只爱有钱人，那男人还有吃软饭的你咋不说，一提到女孩子出国啊，嫁老外啊就说什么崇洋媚外，软骨头eg，就开始各种嫌弃的说不合适的，人家既然在一起就是人家觉得ok好吗，别一分手就一副我早就知道是这样的样子，搞得好像跟国人在一起就不会分手，反观男人娶外国妞就是为国争光啊扬我国威啊，这公平吗？,感觉好像现在一提到女人就是拜金，下。流，崇洋媚外，各种恶心说辞，我只能说，那样讲的人只能说层次太低低到身边只有那种女人，一天到晚拿个例说事，面对生育就一副你有那器官你就应该负全责，女孩子被骗pao什么的都是女孩子有问题之类的，拜托，你看看哪个有层次有地位的男人会去那么说，那不摆明了拉低自己。提到婚姻就是女人只爱有钱人，那男人还有吃软饭的你咋不说，一提到女孩子出国啊，嫁老外啊就说什么崇洋媚外，软骨头eg，就开始各种嫌弃的说不合适的，人家既然在一起就是人家觉得ok好吗，别一分手就一副我早就知道是这样的样子，搞得好像跟国人在一起就不会分手，反观男人娶外国妞就是为国争光啊扬我国威啊，这公平吗？,0.3594573740249155,1.0,0.7286302598332073
男人还是要和男人结婚，这样就有两套房子，两辆车，两个人可以一起玩，一起打游戏，还不会吵架，还可以一起去会所[doge][doge]简直完美,男人还是要和男人结婚，这样就有两套房子，两辆车，两个人可以一起玩，一起打游戏，还不会吵架，还可以一起去会所简直完美,0.3594573740249155,1.0,0.6411321484432213
"女人要物质才结婚，过分么？
1.女生感情太不稳定，公主病深，要物质太多就是过分
2.彩礼要的贵，女人守身如玉，为男人守寡吗？
3.人那么善变，又会伪装，拿了彩礼能保证不忘初心吗?
总结：男人保护自己的方式，建议不要结婚，用非婚生子的方式对抗不合理的，责任与义务双标的 婚配模式。
要渣就一起渣，互坑嘛，多好😏",女人要物质才结婚，过分么？ .女生感情太不稳定，公主病深，要物质太多就是过分 .彩礼要的贵，女人守身如玉，为男人守寡吗？ .人那么善变，又会伪装，拿了彩礼能保证不忘初心吗? 总结：男人保护自己的方式，建议不要结婚，用非婚生子的方式对抗不合理的，责任与义务双标的 婚配模式。 要渣就一起渣，互坑嘛，多好😏,0.3594573740249155,1.0,0.740046669504508
[吃瓜]我愿意出10万彩礼，娶个男人回家，这个男人负责生孩子带孩子，可以生俩，一个跟他姓，一个跟我姓，我够公平吧。他还得出去挣钱，够他自己花就行，家务可以平摊，我也会帮他做饭，他得孝敬我这边的老人。我又不抽烟不喝酒不打老公，不赌不嫖，跟着我就享福吧！至于这个男的肚子不争气生不出孩子，这不是我的问题，他自己想办法去。,我愿意出万彩礼，娶个男人回家，这个男人负责生孩子带孩子，可以生俩，一个跟他姓，一个跟我姓，我够公平吧。他还得出去挣钱，够他自己花就行，家务可以平摊，我也会帮他做饭，他得孝敬我这边的老人。我又不抽烟不喝酒不打老公，不赌不嫖，跟着我就享福吧！至于这个男的肚子不争气生不出孩子，这不是我的问题，他自己想办法去。,0.3594573740249155,1.0,0.6576333744303624
不想给彩礼的男人就去找不要彩礼的女人，不要去道德绑架别的女人不许要彩礼[OK]因为愿意给彩礼的男人很多的，一份彩礼一份嫁妆是一个新家庭的启动资金[藏狐]谁也别说谁好吗[藏狐]否则特别像狗急跳墙,不想给彩礼的男人就去找不要彩礼的女人，不要去道德绑架别的女人不许要彩礼因为愿意给彩礼的男人很多的，一份彩礼一份嫁妆是一个新家庭的启动资金谁也别说谁好吗否则特别像狗急跳墙,0.3594573740249155,1.0,0.5658449612673759
男人如何体面的谈陪嫁，还能让她更爱你,男人如何体面的谈陪嫁，还能让她更爱你,0.3594573740249155,1.0,0.6276708474985844
男人如果刚看到你就对你说他对你一见钟情，那这种离他远点，这绝对是见色起意。男生比较理性（都是大猪蹄子），如果他负责任，那么他就不会轻易答应你们的承诺（要思考自己是否能承担，以及是否值得），如果直接答应，极有可能是渣男（毕竟提完裤子就跑路，之前的承诺对他半点影响都没有）。还有男人都是老色批[吃瓜],男人如果刚看到你就对你说他对你一见钟情，那这种离他远点，这绝对是见色起意。男生比较理性（都是大猪蹄子），如果他负责任，那么他就不会轻易答应你们的承诺（要思考自己是否能承担，以及是否值得），如果直接答应，极有可能是渣男（毕竟提完裤子就跑路，之前的承诺对他半点影响都没有）。还有男人都是老色批,0.3594573740249155,1.0,0.8447616480563551
然而现在的男人感情经历丰富会被人夸风流，让人羡慕。而女性如果感情经历丰富人家就会骂她烂货破鞋。很多男的总说现在的社会对女性有多好，你统计过吗，你列举出来的所谓对男性不公对待的和对女性不公对待根本不值一提好吗。社会上对女性不公的地方多了去了，你就讲几个所谓的对男人的不公就觉得好像全世界都重女轻男一样。为什么女人会要求男的有车有房，因为在现在的社会环境下，女性被教育是要依付男性生存，只有男人好她们才会过的好，所以她们要要求男的有车有房。有的人又会说那她们为什么不能自己去赚钱养自己，当然有靠自己打拼的女性。然而呢，这些自力更生的女性就会被人说三道四，说她们靠睡成功的。一堆所谓的亲戚朋友会跟她们说，你现在打拼得这么辛苦不如嫁个好男人。可以这样说是当今社会剥夺了女性自力更生的机会和能力。这就是社会的悲哀,然而现在的男人感情经历丰富会被人夸风流，让人羡慕。而女性如果感情经历丰富人家就会骂她烂货破鞋。很多男的总说现在的社会对女性有多好，你统计过吗，你列举出来的所谓对男性不公对待的和对女性不公对待根本不值一提好吗。社会上对女性不公的地方多了去了，你就讲几个所谓的对男人的不公就觉得好像全世界都重女轻男一样。为什么女人会要求男的有车有房，因为在现在的社会环境下，女性被教育是要依付男性生存，只有男人好她们才会过的好，所以她们要要求男的有车有房。有的人又会说那她们为什么不能自己去赚钱养自己，当然有靠自己打拼的女性。然而呢，这些自力更生的女性就会被人说三道四，说她们靠睡成功的。一堆所谓的亲戚朋友会跟她们说，你现在打拼得这么辛苦不如嫁个好男人。可以这样说是当今社会剥夺了女性自力更生的机会和能力。这就是社会的悲哀,0.3594573740249155,1.0,0.7692886802831724
评论里好像都没把&#34;孩子&#34;&#34;生孩子&#34;&#34;养孩子&#34;放在论点之中。因为不管怎么说男女平等，只要跟孩子扯上关系，一切美好的童话泡沫就都碎一地。没孩子之前女人也可以好好工作升迁赚钱，和男人一样，可有了孩子之后想要过的和以前一样可能就很难很难了。╮(￣▽￣)╭男女平等，儿子随谁姓？笑话。,评论里好像都没把&#;孩子&#;&#;生孩子&#;&#;养孩子&#;放在论点之中。因为不管怎么说男女平等，只要跟孩子扯上关系，一切美好的童话泡沫就都碎一地。没孩子之前女人也可以好好工作升迁赚钱，和男人一样，可有了孩子之后想要过的和以前一样可能就很难很难了。╮(￣▽￣)╭男女平等，儿子随谁姓？笑话。,0.3594573740249155,1.0,0.5935138643712504
